{"tags": ["Kitematic", "docker", "Electron"], "context": "\u307f\u306a\u3055\u307e\u3053\u3093\u306b\u3061\u306f\u3002Docker2 Advent Calendar 2016 \u306e9\u65e5\u76ee\u306b\u53c2\u52a0\u3055\u305b\u3066\u3044\u305f\u3060\u3044\u3066\u304a\u308a\u307e\u3059 @akiko_pusu \u3067\u3059\u3002\n\u304c\uff01\n\u65e5\u4ed8\u304c\u5909\u308f\u3063\u3066\u3057\u307e\u3063\u3066\u304b\u3089\u306e\u6295\u7a3f\u3067\u7533\u3057\u8a33\u3054\u3056\u3044\u307e\u305b\u3093...\u3002\n\u3055\u3089\u306b\u3001Docker\u306b\u3064\u3044\u3066\u306f\u305f\u304f\u3055\u3093\u8a9e\u308c\u308b\u7acb\u5834\u3067\u306f\u306a\u3044\u306e\u3067\u3059\u304c\u3001\u3068\u306b\u304b\u304f Kitematic \u306b\u3064\u3044\u3066\u3054\u7d39\u4ecb\u3057\u305f\u3044\u3068\u601d\u3044\u307e\u3059\u3002\n\u5185\u5bb9\u7684\u306b\u306fDocker\u305d\u306e\u3082\u306e\u3088\u308a\u3082\u3001Docker\u3092\u5229\u7528\u3057\u305f\u30a2\u30d7\u30ea\u30b1\u30fc\u30b7\u30e7\u30f3\u5bc4\u308a\u306b\u306a\u3063\u3066\u3057\u307e\u3044\u307e\u3059\u304c\u3001\u3054\u5bb9\u8d66\u304f\u3060\u3055\u3044\u307e\u305b\u3002\n\u306a\u304a\u300112/8 \u306f @okamu_ \u3055\u307e\u306e \u3010Docker\u3011\u3082\u3046\u60a9\u307e\u306a\u3044\uff01MySQL\u306e\u30d5\u30a7\u30a4\u30eb\u30aa\u30fc\u30d0\u30fc\u3092docker-compose\u3067\u7206\u901f\u69cb\u7bc9 \u3067\u3057\u305f\u3002\n\u307e\u305f\u300112/10 \u306f @mekemo_dao \u3055\u307e\u306eElasticBeanstalk Multi-Container Docker\u3067\u672c\u756a\u904b\u7528\u3057\u305f\u3044\u30f3\u30b4 \u3067\u3059\u3002\u3053\u3061\u3089\u3082\u3069\u3046\u305e\u5b9c\u3057\u304f\u304a\u9858\u3044\u3044\u305f\u3057\u307e\u3059\uff01\n\nKitematic\u3063\u3066\u306a\u306b\uff1f\nKitematic\u3068\u306f\u3001\u3053\u3061\u3089\u306e\u8a18\u4e8b\u3067\u3082\u5c11\u3057\u89e6\u308c\u307e\u3057\u305f\u304c\u3001Docker Toolbox \u306b\u3064\u3044\u3066\u304f\u308b\u3001GUI\u306eDocker\u64cd\u4f5c\u7528\u306e\u30c4\u30fc\u30eb\u3067\u3059\u3002\n\nMac\u7248 Docker Toolbox \u3092\u4f7f\u3063\u3066\u307f\u307e\u3057\u305f\n\nhttps://kitematic.com \uff08\u516c\u5f0f\u30b5\u30a4\u30c8\uff09\n\nhttps://docs.docker.com/kitematic/userguide/ \uff08\u30e6\u30fc\u30b6\u30ac\u30a4\u30c9\uff09\n\n\n\u767a\u97f3\u306f\uff1f\n\u3042\u307e\u308a\u81ea\u4fe1\u304c\u3042\u308a\u307e\u305b\u3093\u304c\u3001\u7d39\u4ecb\u7528\u306e\u52d5\u753b\u3092\u898b\u308b\u9650\u308a\u300c\u304b\u3044\u3068\u307e\u3066\u3043\u3063\u304f\u300d\u3068\u547c\u3076\u3088\u3046\u3067\u3059\u3002\n\n\u4f7f\u3044\u65b9\u306f\uff1f\nKitematic\u306fDocker Toolbox\u306e\u4e00\u90e8\u3068\u3057\u3066\u63d0\u4f9b\u3055\u308c\u3066\u3044\u307e\u3059\u3002\n\u30a2\u30a4\u30b3\u30f3\u3092\u30af\u30ea\u30c3\u30af\u3059\u308b\u3068\u3001\u3053\u3093\u306a\u611f\u3058\u3067\u7acb\u3061\u4e0a\u304c\u308a\u307e\u3059\u3002\n\n\u30a2\u30d7\u30ea\u30b1\u30fc\u30b7\u30e7\u30f3\u8d77\u52d5\u6642\u306b\u3001Docker\u306e\u30c7\u30fc\u30e2\u30f3\u304c\u7acb\u3061\u4e0a\u304c\u3063\u3066\u3044\u308b\u304b\u78ba\u8a8d\n\n\nMac\u306e\u5834\u5408\u306f\u30cd\u30a4\u30c6\u30a3\u30d6\u306eDocker for Mac\u304c\u52d5\u3044\u3066\u3044\u308c\u3070Mac\u81ea\u8eab\u3092Docker\u306e\u30db\u30b9\u30c8\u3068\u3057\u3066\u5229\u7528\n\n\n\u30cd\u30a4\u30c6\u30a3\u30d6\u306eDocker\u30c7\u30fc\u30e2\u30f3\u304c\u4e0a\u304c\u3063\u3066\u3044\u306a\u304b\u3063\u305f\u5834\u5408\n\n\nVMWare\u4e0a\u306bboot2docker\u3068\u3044\u3046Docker\u5c02\u7528\u306eVM\u3092\u4f5c\u308a\u3001\u305d\u3053\u3067Docker\u30b5\u30fc\u30d3\u30b9\u3092\u958b\u59cb\n\u63a5\u7d9a\u5148\u3092boot2docker\u3068\u3057\u3066\u5229\u7528\n\n\n\n\n\uff08\u306a\u304a\u3001\u521d\u56de\u8d77\u52d5\u6642\u306b\u306f\u3001DockerHub\u3078\u306e\u30b5\u30a4\u30f3\u30a4\u30f3\u30fb\u30b5\u30a4\u30f3\u30a2\u30c3\u30d7\u753b\u9762\u304c\u51fa\u307e\u3059\u304c\u3001\u3053\u3061\u3089\u306f\u7279\u306b\u306a\u306b\u3082\u3057\u306a\u304f\u3066\u3082\u5229\u7528\u53ef\u80fd\u3067\u3059\uff01\uff09\nDocker\u304c\u5229\u7528\u3067\u304d\u308b\u72b6\u614b\u306b\u306a\u308b\u3068\u3001\u753b\u9762\u53f3\u5074\u306b\u306fDockerHub\u3067\u63d0\u4f9b\u3055\u308c\u3066\u3044\u308b\u4eba\u6c17\u306e\u30a4\u30e1\u30fc\u30b8\u304c\u8868\u793a\u3055\u308c\u307e\u3059\u3002\u8a66\u3057\u306b\u6c17\u306b\u5165\u3063\u305f\u3082\u306e\u3092\u30c0\u30d6\u30eb\u30af\u30ea\u30c3\u30af\u3057\u305f\u308a\u3001\u691c\u7d22\u3057\u3066\u7c21\u5358\u306b\u597d\u304d\u306a\u30a4\u30e1\u30fc\u30b8\u3092\u8ffd\u52a0\u3001\u30b3\u30f3\u30c6\u30ca\u3092\u8d77\u52d5\u3059\u308b\u3053\u3068\u304c\u3067\u304d\u307e\u3059\u3002 \n\u4e00\u65e6\u4f5c\u6210\u3055\u308c\u3066\u8d77\u52d5\u3057\u305f\u30b3\u30f3\u30c6\u30ca\u306b\u3064\u3044\u3066\u306f\u3001\u3053\u3093\u306a\u3053\u3068\u304c\u3067\u304d\u307e\u3059\u3002\n\nStart / Stop\nWeb\u30a2\u30d7\u30ea\u30b1\u30fc\u30b7\u30e7\u30f3\u3067port\u304cExpose\u3055\u308c\u3066\u3044\u308b\u3001\u30b3\u30f3\u30c6\u30ca\u3068\u30db\u30b9\u30c8\u9593\u306e\u30dd\u30fc\u30c8\u30d5\u30a9\u30ef\u30fc\u30c9\u306e\u8a2d\u5b9a\u3082\u3055\u308c\u3066\u3044\u308b\u5834\u5408\u306f\u3001\u30d7\u30ec\u30d3\u30e5\u30fc\u753b\u9762\u304c\u51fa\u3066\u304f\u308b\n\u540d\u524d\u3092\u5909\u66f4\u3067\u304d\u308b\n\u5fc5\u8981\u306b\u5fdc\u3058\u3066\u30dd\u30fc\u30c8\u30d5\u30a9\u30ef\u30fc\u30c9\u306e\u5bfe\u8c61\u306e\u30dd\u30fc\u30c8\u3092\u8ffd\u52a0\u5909\u66f4\u3067\u304d\u308b\n\n\n\u52a9\u304b\u3063\u3066\u3044\u308b\u70b9\n\u30b3\u30f3\u30c6\u30ca\u8d77\u52d5\u306e\u969b\u306b\u3001\u4e0a\u3052\u3063\u3071\u306a\u3057\u3067\u3044\u3064\u306e\u307e\u306b\u304b\u305f\u304f\u3055\u3093\u30b3\u30f3\u30c6\u30ca\u304c\u8d77\u52d5\u3057\u3066\u3044\u305f...\u3068\u3044\u3046\u5834\u5408\u306b\u3082\u3001\u753b\u9762\u3067\u4e00\u76ee\u3067\u5206\u304b\u308a\u307e\u3059\u3002\n\u307e\u305f\u3001\u500b\u4eba\u7684\u306b\u9593\u9055\u3044\u3084\u3059\u3044\u30dd\u30fc\u30c8\u306e\u8a2d\u5b9a\uff08\u30b3\u30f3\u30c6\u30ca\u306e\u30dd\u30fc\u30c8\u3092\u30db\u30b9\u30c8\u306b\u30de\u30c3\u30d7\u3059\u308b\uff09\u3082\u3001\u753b\u9762\u4e0a\u306e\u8a2d\u5b9a\u3092\u898b\u306a\u304c\u3089\u78ba\u8a8d\u3067\u304d\u307e\u3059\u3002\n\u5834\u5408\u306b\u3088\u3063\u3066\u306f\u3001GUI\u304b\u3089\u8d77\u52d5\u4e2d\u306e\u30b3\u30f3\u30c6\u30ca\u306e\u4e2d\u306b\u5165\u3063\u305f\u308a\u3057\u3066\u3001\u52d5\u4f5c\u3092\u78ba\u8a8d\u3059\u308b\u3053\u3068\u3082\u3067\u304d\u307e\u3059\u3002\n\uff08\u3068\u306f\u8a00\u3063\u3066\u3082\u3001\u30b3\u30f3\u30c6\u30ca\u306f\u30b5\u30a4\u30ba\u3092\u5c0f\u3055\u304f\u3059\u308b\u305f\u3081\u30a8\u30c7\u30a3\u30bf\u304c\u5165\u3063\u3066\u3044\u306a\u3044\u5834\u5408\u304c\u3042\u308a\u307e\u3059\u306e\u3067\u3001\u4e2d\u306b\u5165\u3063\u3066\u30bd\u30fc\u30b9\u3092\u7de8\u96c6\u3059\u308b\u3053\u3068\u304c\u51fa\u6765\u306a\u3044\u30b1\u30fc\u30b9\u3084\u3001more\u306f\u3042\u308b\u3051\u3069less\u306f\u7121\u3044\u3001\u3068\u3044\u3063\u305f\u6b8b\u5ff5\u306a\u30b1\u30fc\u30b9\u3082\u3042\u308a\u307e\u3059\u3002\u30bd\u30fc\u30b9\u78ba\u8a8d\u304f\u3089\u3044\u306f\u3067\u304d\u308b\u3068\u3057\u3066...\uff09 \n\n\u4ee5\u4e0b\u306e\u3088\u3046\u306a\u3053\u3068\u3082\u3001GUI\u3067\u8a2d\u5b9a\u5909\u66f4\u3001\u9069\u7528\u304c\u3067\u304d\u307e\u3059\u3002\n\nport\u306e\u5909\u66f4\uff08\u30d5\u30a9\u30ef\u30fc\u30c9\u7528\u306e\u30dd\u30fc\u30c8\u306e\u5909\u66f4\uff09\n\u74b0\u5883\u5909\u6570\u306e\u8a2d\u5b9a\n\u30db\u30b9\u30c8\u3068\u30b3\u30f3\u30c6\u30ca\u3067\u30b7\u30a7\u30a2\u3059\u308b\u30dc\u30ea\u30e5\u30fc\u30e0\u306e\u8a2d\u5b9a\n\n\n\u306a\u306b\u3067\u3067\u304d\u3066\u3044\u308b\u306e\uff1f\n\u3055\u3066\u3001Kitematic\u306f\u3001Electron\u3092\u30d9\u30fc\u30b9\u306b\u3057\u305f\u30a2\u30d7\u30ea\u30b1\u30fc\u30b7\u30e7\u30f3\u3067\u3059\u3002\n\u3053\u306e\u305f\u3081\u3001\u7c21\u5358\u306b\u30bd\u30fc\u30b9\u3092\u53c2\u7167\u3057\u305f\u308a\u3001\u624b\u5143\u3067\u30ab\u30b9\u30bf\u30de\u30a4\u30ba\uff06\u8d77\u52d5\u3059\u308b\u3053\u3068\u304c\u3067\u304d\u307e\u3059\u3002\uff08\u3068\u3001\u5049\u305d\u3046\u306a\u3053\u3068\u3092\u3044\u3044\u307e\u3057\u305f\u304c\u3001\u79c1\u306f\u307e\u3060\u306a\u306b\u3082\u51fa\u6765\u307e\u305b\u3093...\uff09\n\u305b\u3063\u304b\u304f\u306a\u306e\u3067\u3001\u30bd\u30fc\u30b9\u306e\u4e2d\u8eab\u3084\u52d5\u304d\u306b\u3064\u3044\u3066\u3082\u3055\u3089\u3063\u3068\u89e6\u308c\u308b\u3053\u3068\u306b\u3057\u307e\u3059\u3002\n\nKitematic\u306e\u30ea\u30dd\u30b8\u30c8\u30ea\u3092\u306e\u305e\u3044\u3066\u307f\u3088\u3046\uff01\nKitematic\u306e\u30ea\u30dd\u30b8\u30c8\u30ea\u306f\u3053\u3061\u3089\u306b\u306a\u308a\u307e\u3059\u3002\n\n\nhttps://github.com/docker/kitematic.git \n\nREADME\u5074\u306b\u306f\u30a4\u30f3\u30b9\u30c8\u30fc\u30eb\u306e\u624b\u9806\u3068\u3001\u7c21\u5358\u306a\u7d39\u4ecb\u3001\u30c9\u30ad\u30e5\u30e1\u30f3\u30c8\u3084\u516c\u5f0f\u30b5\u30a4\u30c8\u3078\u306e\u30ea\u30f3\u30af\u304c\u8a18\u8f09\u3055\u308c\u3066\u3044\u307e\u3059\u3002\nKitematic\u3068\u3044\u3046Electron\u30d9\u30fc\u30b9\u306e\u30a2\u30d7\u30ea\u30b1\u30fc\u30b7\u30e7\u30f3\u305d\u306e\u3082\u306e\u306b\u8208\u5473\u304c\u3042\u308b\u5834\u5408\u306f\u3001 CONTRIBUTING.md \u3092\u3054\u89a7\u3044\u305f\u3060\u304f\u3068\u3001\u30d3\u30eb\u30c9\u3084\u30c6\u30b9\u30c8\u306e\u65b9\u6cd5\u306b\u3064\u3044\u3066\u8a73\u3057\u304f\u89e6\u308c\u3089\u308c\u3066\u3044\u307e\u3059\u306e\u3067\u3001\u305c\u3072\u305d\u3061\u3089\u3092\u3069\u3046\u305e\uff01\n\u307e\u305f\u3001\u3053\u3053\u304b\u3089\u5148\u306f\u30d3\u30eb\u30c9\u95a2\u9023\u306b\u306a\u3063\u3066\u304d\u307e\u3059\u306e\u3067\u3054\u5bb9\u8d66\u304f\u3060\u3055\u3044\u3002\n\nbuild\u3057\u3066\u307f\u3088\u3046\uff01\nCONTRIBUTING.md\u306b\u3082\u66f8\u304b\u308c\u3066\u3044\u307e\u3059\u304c\u3001node.js\u304c\u5165\u3063\u3066\u3044\u308c\u3070\u57fa\u672c\u7684\u306b\u30d3\u30eb\u30c9\u3067\u304d\u308b\u72b6\u614b\u306b\u306a\u3063\u3066\u3044\u307e\u3059\u306e\u3067\u3001\u4eca\u56de\u306f\u30bd\u30fc\u30b9\u3092clone\u3057\u3066\u304d\u3066\u3001VSCode\u3067\u958b\u3044\u3066\u307f\u307e\u3057\u305f\u3002\uff08VSCode\u3082Electron\u30d9\u30fc\u30b9\u3067\u3059\uff09\npackage.json\u3084Gruntfile.js\u3068\u3044\u3063\u305f\u30d5\u30a1\u30a4\u30eb\u304c\u3042\u308b\u306e\u3067\u3001\u30bf\u30fc\u30df\u30ca\u30eb\u304b\u3089\u306ebuild\u3082\u51fa\u6765\u307e\u3059\u304c\u3001VSCode\u306e\u5834\u5408\u306f\u300c\u30b3\u30de\u30f3\u30c9\u30d1\u30ec\u30c3\u30c8\u300d\u304b\u3089\u3001npm \u3068\u5165\u529b\u3059\u308b\u3068\u3001\u5229\u7528\u3067\u304d\u308b\u30bf\u30b9\u30af\u306e\u5019\u88dc\u304c\u8868\u793a\u3055\u308c\u307e\u3059\u3002\n\n\u3055\u3063\u304f\u308abuild & \u52d5\u304b\u3057\u3066\u307f\u305f\u3044\u3068\u3044\u3046\u5834\u5408\u306b\u306f\u3001npm start \u3092\u9078\u3076\u3068\u3001Electron\u306e\u30a2\u30a4\u30b3\u30f3\u304c\u8868\u793a\u3055\u308c\u3066\u3001Kitematic\u306e\u30a2\u30d7\u30ea\u30b1\u30fc\u30b7\u30e7\u30f3\u304c\u7acb\u3061\u4e0a\u304c\u308a\u307e\u3059\u3002\nGruntfile.js \u306b\u5f93\u3063\u3066Grunt\u306e\u30bf\u30b9\u30af\u3092\u52d5\u304b\u3057\u305f\u3044\u5834\u5408\u306f\u3001npm install -g grunt \u3067grunt\u3092\u8ffd\u52a0\u3057\u3066\u304b\u3089\u30bf\u30b9\u30af\u8d77\u52d5\u306b\u306a\u308a\u307e\u3059\u3002\n\n\u5b9f\u969b\u306b\u30bd\u30fc\u30b9\u3092\u5c11\u3057\u3044\u3058\u3063\u3066\u307f\u308b\u3068\u3001\u3061\u3083\u3093\u3068\u5909\u66f4\u3055\u308c\u308b\u3053\u3068\u304c\u308f\u304b\u308a\u307e\u3059\u3002\n\uff08\u3053\u3061\u3089\u306f\u5358\u7d14\u306b\u30d5\u30a9\u30f3\u30c8\u3092\u5909\u3048\u305f\u4f8b\u3067\u3059\u304c....\uff09\n\n\n\u3082\u3046\u3061\u3087\u3063\u3068\u8a73\u3057\u304f\u307f\u3066\u307f\u3088\u3046\n\n\u3069\u3046\u3084\u3063\u3066\u63cf\u753b\u3057\u3066\u308b\u306e\uff1f\nElectron\u30a2\u30d7\u30ea\u306a\u306e\u3067\u3001\u30bd\u30fc\u30b9\u306fHTML\u304c\u308f\u304b\u308c\u3070\u306a\u3093\u3068\u306a\u304f\u7406\u89e3\u3067\u304d\u305d\u3046\u3001\u3068\u306f\u8a00\u3046\u3082\u306e\u306e\u3001\u3068\u304f\u306b\u30b3\u30f3\u30c6\u30ca\u306e\u30a2\u30d7\u30ea\u30b1\u30fc\u30b7\u30e7\u30f3\u306e\u30d7\u30ec\u30d3\u30e5\u30fc\u306a\u3069\u306f\u3069\u3093\u306a\u3075\u3046\u306b\u5b9f\u73fe\u3057\u3066\u3044\u308b\u3093\u3060\u308d\u3046...\uff1f\n\u3056\u3063\u3068\u4f5c\u308a\u3092\u773a\u3081\u3066\u898b\u305f\u3044\u5834\u5408\u306f\u3001\u753b\u9762\u4e0a\u90e8\u306e\u30e1\u30cb\u30e5\u30fc\u304b\u3089\u3001\u300cChrome Developer Tool\u300d\u3092\u8d77\u52d5\u3059\u308b\u3068\u3001\u30d1\u30cd\u30eb\u4e0a\u306e\u8981\u7d20\u306b\u5bfe\u5fdc\u3059\u308b\u30bd\u30fc\u30b9\u304c\u628a\u63e1\u3067\u304d\u307e\u3059\u3002\uff08\u30d6\u30e9\u30a6\u30b6\u306eChrome\u306eDeveloper Tool\u3068\u540c\u3058\u3067\u3059\uff09\n\u305f\u3057\u304b\u306b\u3001HTML, JavaScript, CSS\u3068\u3044\u3063\u305fWeb\u306e\u6280\u8853\u3067\u69cb\u6210\u3055\u308c\u3066\u3044\u308b\u306e\u304c\u5206\u304b\u308a\u307e\u3059\u306d\u3002\n\u5927\u90e8\u5206\u306e\u52d5\u7684\u306a\u60c5\u5831\u306f\u3001Docker\u306e\u30db\u30b9\u30c8\u5074\u304b\u3089API\u7d4c\u7531\u3067\u53d6\u5f97\u3057\u3001\u305d\u308c\u306b\u57fa\u3065\u3044\u3066\u753b\u9762\u304c\u69cb\u6210\u3055\u308c\u3066\u3044\u307e\u3059\u3002\n\u305f\u3060\u3057\u3001\u4e00\u7b87\u6240\u3001Web\u30a2\u30d7\u30ea\u30b1\u30fc\u30b7\u30e7\u30f3\u306e\u30b3\u30f3\u30c6\u30ca\u306e\u5834\u5408\u306f\u30d7\u30ec\u30d3\u30e5\u30fc\u306e\u753b\u9762\u3082\u8868\u793a\u3055\u308c\u308b\u306e\u3067\u3059\u304c\u3001Docker\u306eAPI\u306b\u306f\u305d\u3093\u306a\u753b\u50cf\u3092\u98db\u3070\u3059\u3082\u306e\u306a\u3093\u3066\u7121\u3044\u306e\u3067\u3001\u300c\u3069\u3046\u3084\u3063\u3066\u3044\u308b\u3093\u3060\u308d\u3046\uff1f\u300d\u3068\u6c17\u306b\u306a\u3063\u3066\u3044\u305f\u306e\u3067\u3059\u304c\u3001\u3088\u304f\u3088\u304f\u898b\u308b\u3068Webview\u3092\u4f7f\u3063\u3066\u306f\u3081\u8fbc\u3093\u3067\u3044\u308b\u3093\u3067\u3059\u306d\u3002\n\n\u4e00\u65b9\u3067\u3001\u300cContainer Logs\u300d\uff08\u30b3\u30f3\u30c6\u30ca\u306e\u30ed\u30b0\uff09\u306b\u95a2\u3057\u3066\u306f\u3001WebView\u3067\u306f\u306a\u304fDocker\u306eAPI\u306elogs\u3092\u53e9\u3044\u3066\u63cf\u753b\u3055\u305b\u3066\u3044\u307e\u3059\u3002\n\n\u3069\u3093\u306a\u3075\u3046\u306bDocker\u30b3\u30f3\u30c6\u30ca\u3068\u304a\u8a71\u3057\u3057\u3066\u308b\u306e\uff1f\n\u4e0a\u8a18\u306e\u901a\u308a\u3001Kitematic\u306fDocker API\u3092\u4f7f\u3063\u3066\u753b\u9762\u3092\u69cb\u6210\u3057\u3066\u3044\u307e\u3059\u3002\n\u6b8b\u5ff5\u306a\u304c\u3089\u3053\u306e\u901a\u4fe1\u306b\u3064\u3044\u3066\u306fDeveloper Tool\u306eNetwork\u30bf\u30d6\u3067\u306f\u898b\u308b\u3053\u3068\u304c\u3067\u304d\u307e\u305b\u3093\u3002\n\u3067\u3059\u304c\u3001API\u306b\u306f\u5909\u308f\u308a\u3042\u308a\u307e\u305b\u3093\u306e\u3067\u3001\u3053\u3061\u3089\u3082\uff08\u8131\u7dda\u3057\u307e\u3059\u304c\uff09\u3061\u3087\u3063\u3068\u89e6\u308c\u3066\u307f\u307e\u3059\u3002\n\nDocker API\u3092\u8a66\u3057\u3066\u307f\u3088\u3046\nDocker API\u306f\u3001\u540c\u4e00\u30db\u30b9\u30c8\u5185\u3067\u3042\u308c\u3070Unix\u30c9\u30e1\u30a4\u30f3\u30bd\u30b1\u30c3\u30c8\u3092\u901a\u3057\u3066\u63d0\u4f9b\u3059\u308b\u3053\u3068\u304c\u3067\u304d\u307e\u3059\u304c\u3001\u5916\u90e8\u3068\u306e\u3084\u308a\u3068\u308a\u304c\u5fc5\u8981\u306b\u306a\u308b\u5834\u5408\u306ftcp (http/https) \u3092\u5229\u7528\u3059\u308b\u5f62\u306b\u306a\u308a\u307e\u3059\u3002\n\nUnix Domain Socket\u306e\u5834\u5408\nMacOS\u3067 Docker for Mac\u3092\u4f7f\u3063\u3066Docker\u306e\u74b0\u5883\u3092\u5229\u7528\u3059\u308b\u5834\u5408\u306f\u3001Mac\u5185\u306edocker\u30b3\u30de\u30f3\u30c9\u30fbKitematic\u306fUnix\u30c9\u30e1\u30a4\u30f3Socket\u3067\u306e\u901a\u4fe1\u306b\u306a\u308a\u307e\u3059\u3002\uff08/var/run/docker.sock\uff09\n\u5b9f\u969b\u306b\u3001\u8d77\u52d5\u4e2d\u306e\u30b3\u30f3\u30c6\u30ca\u306b\u5bfe\u3057\u3066\u3001\u30ed\u30b0\u3092\u53d6\u5f97\u3059\u308bAPI\u3092\u53e9\u304f\u5834\u5408\u306f\u3001\u4ee5\u4e0b\u306e\u3088\u3046\u306a\u30b3\u30de\u30f3\u30c9\u306b\u306a\u308a\u307e\u3059\u3002\n$ curl --unix-socket /var/run/docker.sock \"http:/containers/b1a7d599d/logs?follow=true&stderr=true&stdout=true&timestamps=true\"\n\n# \u3053\u3061\u3089\u3082API\u3092\u53e9\u3044\u3066\u3044\u308b\u611f\u3058\u306b\u306a\u308a\u307e\u3059\n$ docker logs b1a7d59\n\n# \u51fa\u529b\u4f8b\uff08Docker\u30b3\u30f3\u30c6\u30ca\u306eWeb\u306e\u753b\u9762\u306b\u30a2\u30af\u30bb\u30b9\u3059\u308b\u3068\u3001\u30b3\u30f3\u30c6\u30ca\u3067\u8d77\u52d5\u4e2d\u306enginx\u306e\u51fa\u529b\u304c\u30ed\u30b0\u3068\u3057\u3066\u8868\u793a\u3055\u308c\u308b\uff09\n2016-12-09T15:40:43.976694996Z INFO[10650] 172.17.0.1 - - [12/Dec/91243:12:12:12 -1600]  GET \"/index.html\" HTTP/1.1 200 8056 \n2016-12-09T15:40:44.037363718Z INFO[10650] 172.17.0.1 - - [12/Dec/91244:12:12:12 -1600]  GET \"/fonts/droid.woff2\" HTTP/1.1 200 11304 \n2016-12-09T15:40:44.040806479Z INFO[10650] 172.17.0.1 - - [12/Dec/91244:12:12:12 -1600]  GET \"/fonts/droid-bold.woff2\" HTTP/1.1 200 11480 \n2016-12-09T15:41:31.727200261Z INFO[10698] 172.17.0.1 - - [12/Dec/91231:12:12:12 -1600]  GET \"/index.html\" HTTP/1.1 200 8056 \n2016-12-09T15:41:31.818593237Z INFO[10698] 172.17.0.1 - - [12/Dec/91231:12:12:12 -1600]  GET \"/fonts/droid.woff2\" HTTP/1.1 200 11304 \n2016-12-09T15:41:31.818766633Z INFO[10698] 172.17.0.1 - - [12/Dec/91231:12:12:12 -1600]  GET \"/fonts/droid-bold.woff2\" HTTP/1.1 200 11480 \n\nsocket\u306e\u5834\u5408\u3060\u3068\u3001\u901a\u4fe1\u306e\u30ad\u30e3\u30d7\u30c1\u30e3\u306e\u65b9\u6cd5\u304c\u3088\u304f\u5206\u304b\u3089\u306a\u3044...\u3002\n\u3068\u3044\u3046\u3053\u3068\u3067\u3001boot2docker\u3092\u5229\u7528\u3057\u3066Kitematic\u3068Docker\u30db\u30b9\u30c8\u306etcp\u3067\u306eAPI\u901a\u4fe1\u3092\u773a\u3081\u3066\u307f\u308b\u3053\u3068\u306b\u3057\u307e\u3057\u305f\u3002\n\nDocker API\u3068Kitematic\u306e\u901a\u4fe1\u306f\uff1f\nDocker for Mac\u3092\u5229\u7528\u3057\u3066\u3044\u3066\u3082\u3001\u305d\u3061\u3089\u3092\u505c\u6b62\u3057\u3066\u3001boot2docker\u5074\u3092\u5229\u7528\u3059\u308b\u3053\u3068\u304c\u3067\u304d\u307e\u3059\u306e\u3067\u3001\u307e\u305a\u306f\u4ee5\u4e0b\u306e\u901a\u308aDocker\u3092\u5207\u308a\u66ff\u3048\u307e\u3059\u3002\u3053\u306e\u3042\u305f\u308a\u306fKitematic\u3092\u542b\u3080Docker Toolbox\u3092\u30c0\u30a6\u30f3\u30ed\u30fc\u30c9\u3059\u308b\u3068\u4e00\u7dd2\u306b\u5fc5\u8981\u306a\u3082\u306e\u304c\u4ed8\u3044\u3066\u304d\u307e\u3059\u3002\n\u307e\u305f\u3001Kitematic\u3092\u521d\u56de\u8d77\u52d5\u3057\u305f\u5834\u5408\u306f\u3001MacOS\u306e\u30cd\u30a4\u30c6\u30a3\u30d6\u306eDocker\u304c\u4e0a\u304c\u3063\u3066\u3044\u306a\u3051\u308c\u3070\u3001boot2docker\u3092\u5229\u7528\u3057\u3066VM\u3092\u7acb\u3061\u4e0a\u3052\u308b\u51e6\u7406\u304c\u9032\u307f\u307e\u3059\u3002\n\nboot2docker: VirtualBox\u306bLinux\u30d9\u30fc\u30b9\u306eboot2docker\u306e\u30de\u30b7\u30f3\u3092\u8ffd\u52a0\n\n\n\u3053\u306e\u4e2d\u3067Docker\u306e\u30c7\u30fc\u30e2\u30f3\u3092\u8d77\u52d5\n\u4eca\u56de\u306e\u4f8b\u3067\u306f\u3001IP\u306f192.168.99.100 \u3092\u5272\u308a\u5f53\u3066\n\n\n\n\u3046\u307e\u304fboot2docker\u3067\u306eDocker\u30c7\u30fc\u30e2\u30f3\u304c\u4e0a\u304c\u3063\u305f\u3068\u3057\u307e\u3057\u3066\u3002\n\u307e\u305a\u306f Docker Remote API\u306e\u30c9\u30ad\u30e5\u30e1\u30f3\u30c8\u306b\u5f93\u3063\u3066\u3001API\u304c\u3061\u3083\u3093\u3068\u53cd\u5fdc\u3059\u308b\u304b\u78ba\u8a8d\u3057\u3066\u307f\u307e\u3059\u3002\nDocker API\u306e\u30c7\u30d5\u30a9\u30eb\u30c8\u30dd\u30fc\u30c8\u306f2376\u306a\u306e\u3067\u3001\u305d\u3061\u3089\u306b\u5bfe\u3057\u3066\u30ea\u30af\u30a8\u30b9\u30c8\u3092\u6295\u3052\u3066\u307f\u307e\u3059\u3002\n# json\u30c7\u30fc\u30bf\u304c\u8fd4\u308b\u304c\u3001\u305f\u304f\u3055\u3093\u3042\u308b\u306e\u3067\u4e00\u90e8\u306e\u307f\u30d1\u30fc\u30b9\u3057\u3066\u8868\u793a\n\n$ /usr/local/bin/curl -s --insecure --cert $DOCKER_CERT_PATH/cert.pem --key $DOCKER_CERT_PATH/key.pem \\\n   https://192.168.99.100:2376/containers/json | jq '.[].Names[]'\n\n\"/hello-world-nginx\"\n\n\n\u3053\u3093\u306a\u611f\u3058\u3067\u3001\u73fe\u5728\u8d77\u52d5\u3057\u3066\u3044\u308b\u30b3\u30f3\u30c6\u30ca\u306e\u60c5\u5831\u304c\u53d6\u308c\u307e\u3057\u305f\u3002\n\ntcpdump \u3057\u3066\u307f\u305f\u3089\uff1f\nDocker API\u306e\u30c7\u30d5\u30a9\u30eb\u30c8\u306e\u30dd\u30fc\u30c8\u306f2376\u306a\u306e\u3067\u3001tcpdump\u3067\u901a\u4fe1\u3092\u62fe\u3063\u3066\u307f\u308b\u3068\u3053\u3093\u306a\u611f\u3058\u3067\u3059\u3002\nKitematic\u304b\u3089\u30b3\u30f3\u30c6\u30ca\u306e\u60c5\u5831\u3092\u53d6\u5f97\u3057\u305f\u308a\u3001\u8d77\u52d5\u30fb\u4fdd\u5b58\u3092\u5b9f\u884c\u3059\u308b\u3068\u30d1\u30b1\u30c3\u30c8\u304c\u6d41\u308c\u307e\u3059\u3002\n\u3042\u307e\u308a\u3053\u306e\u8fba\u6df1\u6398\u308a\u3067\u304d\u306a\u304f\u3066\u7533\u3057\u8a33\u306a\u3044\u306e\u3067\u3059\u304c\u3001Kitematic\u306eGUI\u304b\u3089\u30b3\u30f3\u30c6\u30ca\u306e\u8a2d\u5b9a\u3092\u4fdd\u5b58\u3057\u305f\u308a\u3001start / stop \u3059\u308b\u3068\u78ba\u304b\u306b\u901a\u4fe1\u304c\u6d41\u308c\u308b\u306e\u304c\u78ba\u8a8d\u3067\u304d\u307e\u3059\u3002\n$ sudo tcpdump port 2376 and host 192.168.99.100 \ntcpdump: data link type PKTAP\ntcpdump: verbose output suppressed, use -v or -vv for full protocol decode\nlistening on pktap, link-type PKTAP (Apple DLT_PKTAP), capture size 262144 bytes\n09:07:52.301770 IP 192.168.99.100.2376 > 192.168.99.1.57608: Flags [S.], seq 34968944, ack 3475486455, win 28960, options [mss 1460,sackOK,TS val 406920 ecr 1142976386,nop,wscale 7], length 0\n09:07:52.302279 IP 192.168.99.100.2376 > 192.168.99.1.57608: Flags [.], ack 1449, win 249, options [nop,nop,TS val 406920 ecr 1142976387], length 0\n......\n\nWireshark\u3092\u3064\u304b\u3046\u3068\u3053\u3093\u306a\u611f\u3058\u3067\u3059\u3002\n\n\u3067\u3082\u3001\u601d\u3063\u3066\u305f\u306e\u3068\u9055\u3046...\u3002\n\u305d\u3046\u3067\u3059\u3001\u901a\u4fe1\u304c\u6697\u53f7\u5316\u3055\u308c\u3066\u3044\u308b\u305f\u3081\u3001TCP\u306e\u3084\u308a\u3068\u308a\u306e\u6d41\u308c\u306f\u8ffd\u3048\u3066\u3082\u3001\u5b9f\u969b\u3069\u3093\u306a\u30d7\u30ed\u30c8\u30b3\u30eb\u3067\u3069\u3093\u306a\u30c7\u30fc\u30bf\u304c\u3084\u308a\u3068\u308a\u3055\u308c\u3066\u3044\u308b\u306e\u304b\u304c\u898b\u3048\u307e\u305b\u3093... ><\n\u305d\u3053\u307e\u3067\u3053\u3060\u308f\u3089\u306a\u304f\u3068\u3082...\u3068\u601d\u3044\u3064\u3064\u3001\u305b\u3063\u304b\u304f\u306a\u306e\u3067\u3084\u3063\u3071\u308atcpdump (or Wireshark)\u3067\u901a\u4fe1\u3092\u8997\u3044\u3066\u307f\u305f\u3044\uff01\n\u3068\u3044\u3046\u3053\u3068\u3067\u3001\u8abf\u6574\u3092\u3057\u3066\u307f\u307e\u3057\u305f\u3002\n(Wireshark\u3067\u6697\u53f7\u5316\u3055\u308c\u305f\u901a\u4fe1\u3092\u9375\u3092\u4f7f\u3063\u3066\u5fa9\u53f7\u5316\u3059\u308b\u65b9\u6cd5\u3082\u3042\u308b\u307f\u305f\u3044\u3067\u3059\u304c\u3001\u3088\u304f\u308f\u304b\u3089\u306a\u304b\u3063\u305f\u306e\u3067\u30d1\u30b9\uff09\n1. boot2docker\u5074\u306eAPI\u3092\u6697\u53f7\u5316\u306a\u3057\u306b\u3059\u308b\nDocker for Mac\u3067\u3082socket\u4ee5\u5916\u306btcp\u3067\u306e\u901a\u4fe1\u3092\u53d7\u3051\u3089\u308c\u308b\u3088\u3046\u306b\u3067\u304d\u305d\u3046\u304b\u306a...\u3068\u3082\u601d\u3063\u305f\u306e\u3067\u3059\u304c\u3001\u3046\u307e\u304f\u884c\u304b\u306a\u304b\u3063\u305f\u306e\u3067\u3053\u3061\u3089\u306e\u65b9\u6cd5\u3067\u3067\u3002\n\nssh \u3067boot2docker\u306eVM\u306b\u30ed\u30b0\u30a4\u30f3\u3059\u308b\nvi /var/lib/boot2docker/profile \u3067\u8a2d\u5b9a\u3092\u7de8\u96c6\n\n\nDOCKER_HOST='-H tcp://0.0.0.0:2375'  # port 2357\u306b\u5909\u66f4\nDOCKER_TLS=no # TLS\u306a\u3057\u306b\u3059\u308b\n\n\n\u4fdd\u5b58\u3092\u3057\u3066\u3001/etc/init.d/docker restart \u3067\u518d\u8d77\u52d5\n\n\u203b\u3042\u307e\u308a\u30aa\u30b9\u30b9\u30e1\u3067\u306f\u306a\u3044\u306e\u3067\u3059\u304c\u3001\u9589\u3058\u305f\u74b0\u5883\u306a\u306e\u3067\u3053\u306e\u3088\u3046\u306b\u3057\u307e\u3057\u305f....\u3002\u3000\u3000\u3000\u3000\u3000\u3000\u3000\u3000\u3000\u3000\u3000\u3000\u3000\n2. Kitematic\u306e\u30bd\u30fc\u30b9\u3092\u4fee\u6b63\u3057\u3066http:2375\u3067\u901a\u4fe1\u3055\u305b\u308b\n\u4e00\u65b9\u306eKitematic\u3067\u3059\u304c\u3001\u57fa\u672c\u306fUnix Socket\u304bhttps://2376/ \u3067API\u3068\u901a\u4fe1\u3059\u308b\u3088\u3046\u306b\u30bd\u30fc\u30b9\u4e2d\u306b\u5b9a\u7fa9\u3055\u308c\u3066\u3044\u307e\u3059\u3002\n\u305d\u306e\u307e\u307e\u8d77\u52d5\u3057\u3066\u3082\u3001https://2376/ \u306b\u554f\u3044\u5408\u308f\u305b\u306b\u884c\u3063\u3066\u3057\u307e\u3046\u305f\u3081\u3001\u3046\u307e\u304f\u3044\u304d\u307e\u305b\u3093\u3002\n\u3068\u3044\u3046\u3053\u3068\u3067\u3001\u30bd\u30fc\u30b9\u3092\u8abf\u6574\u3067\u304d\u308b\u74b0\u5883\u3092\u5229\u7528\u3057\u3066\u3001\u8a2d\u5b9a\u3092\u5909\u66f4\u3057\u3066build, \u8d77\u52d5\u3055\u305b\u3066\u307f\u307e\u3057\u305f\u3002\n\nDockerUtil.js\n      this.client = new dockerode({\n        protocol: 'http', // https\u3060\u3063\u305f\n        host: ip,\n        port: 2375,       // 2376\u3060\u3063\u305f\n        ca: fs.readFileSync(path.join(certDir, 'ca.pem')),\n        cert: fs.readFileSync(path.join(certDir, 'cert.pem')),\n        key: fs.readFileSync(path.join(certDir, 'key.pem'))\n      });\n\n\n\u3055\u3066\u3001\u7acb\u3061\u4e0a\u304c\u3063\u305fKitematic\u3092\u30dd\u30c1\u30dd\u30c1\u30af\u30ea\u30c3\u30af\u3057\u3066\u307f\u308b\u3068\u3001\u3061\u3083\u3093\u3068http\u3067\u901a\u4fe1\u3057\u3066\u304a\u308a\u3001\u901a\u4fe1\u306e\u4e2d\u8eab\u3082Wireshark\u3067\u78ba\u8a8d\u3059\u308b\u3053\u3068\u304c\u3067\u304d\u307e\u3057\u305f\u3002\n\n\u3053\u3046\u3044\u3046\u6642\u3063\u3066\u3001\u30bd\u30fc\u30b9\u3092\u8abf\u6574\u3067\u304d\u308b\u306e\u3063\u3066\u826f\u3044\u306a\u3042...\u3068\u601d\u3044\u307e\u3059\u3002\n\n\u88dc\u8db3\uff1aKitematic\u3067\u306e\u8a2d\u5b9a\u7b87\u6240\nKitematic\u306f\u3001Docker\u306e\u30c7\u30fc\u30e2\u30f3\u304c\u3069\u3093\u306a\u611f\u3058\u3067\u4e0a\u304c\u3063\u3066\u3044\u308b\u304b\u3092\u30c1\u30a7\u30c3\u30af\u3057\u3066\u3001API\u306e\u5b9b\u5148\u3092socket\u3082\u3057\u304f\u306fhttp\uff08https) \u306b\u5207\u308a\u66ff\u3048\u3066\u3044\u307e\u3059\u3002\n\u305d\u306e\u8fba\u306f\u3001DockerUtil.js \u3042\u305f\u308a\u3067\u78ba\u8a8d\u3067\u304d\u307e\u3059\u3002Docker API\u306b\u5bfe\u5fdc\u3059\u308b\u30a2\u30af\u30b7\u30e7\u30f3\u304c\u6982\u306d\u3053\u3061\u3089\u306b\u5b9a\u7fa9\u3055\u308c\u3066\u3044\u308b\u611f\u3058\u3067\u3059\u3002\n\n\u307e\u3068\u3081\n\u4ee5\u4e0a\u3001\u3064\u3089\u3064\u3089\u3068\u3001\u6c17\u304c\u3064\u3051\u3070\u8208\u5473\u306b\u3072\u304d\u305a\u3089\u308c\u308b\u307e\u307e\u306b\u66f8\u3044\u3066\u3057\u307e\u3063\u3066\u7533\u3057\u8a33\u3054\u3056\u3044\u307e\u305b\u3093\u3002\n\u8131\u7dda\u3092\u631f\u307f\u306a\u304c\u3089\u3082\u3001\u3053\u3093\u306a\u70b9\u306b\u3064\u3044\u3066\u89e6\u308c\u3066\u3044\u307e\u3059\u3002\n\nKitematic\u306b\u3064\u3044\u3066 \nKitematic\u3092\u30bd\u30fc\u30b9\u304b\u3089\u8d77\u52d5\u3059\u308b\nDocker API\u3068Kitematic\u306e\u901a\u4fe1\u3092\u773a\u3081\u308b\n\n\u95a2\u9023\u3057\u3066\u3001Docker for Mac / boot2docker\u306e\u9055\u3044\u3084\u3001\u901a\u4fe1\u306e\u30ad\u30e3\u30d7\u30c1\u30e3\u3001Electron\u306b\u3064\u3044\u3066\u3082\u89e6\u308c\u307e\u3057\u305f\u3002\n\u3053\u308c\u304b\u3089Docker\u3092\uff08Mac\u3092\u30d9\u30fc\u30b9\u306b\uff09\u89e6\u3063\u3066\u307f\u3088\u3046\u3068\u3044\u3046\u65b9\u3084\u3001Electron\u306b\u89e6\u308c\u3066\u307f\u3088\u3046\u3068\u3044\u3046\u65b9\u306b\u3068\u3063\u3066\u3082\u3001Kitematic\u306f\u306a\u304b\u306a\u304b\u9762\u767d\u3044\u7d20\u6750\u306a\u306e\u3067\u306f\u306a\u3044\u304b\u306a\u3068\u601d\u3044\u307e\u3059\u3002\n\u8a2d\u5b9a\u306b\u6163\u308c\u308b\u3001\u3082\u3057\u304f\u306f\u3044\u308d\u3093\u306a\u30a4\u30e1\u30fc\u30b8\u3092\u8a66\u3057\u3066\u307f\u308b\u3068\u3044\u3063\u305f\u70b9\u3067\u3082\u3001\u3068\u3066\u3082\u4f7f\u3044\u3084\u3059\u3044\u30c4\u30fc\u30eb\u3067\u3059\u306e\u3067\u3001\u305c\u3072\u6a5f\u4f1a\u304c\u3042\u308c\u3070\u5229\u7528\u3057\u3066\u307f\u3066\u304f\u3060\u3055\u3044\u306d!\n\n\u304a\u307e\u3051\uff1a\u30ad\u30e3\u30e9\u3092\u63cf\u3044\u3066\u3044\u308b\u65b9\u306f\uff1f\nDocker\u306e\u30af\u30b8\u30e9\u3055\u3093\u3001\u30a8\u30a4\u3001\u305d\u306e\u4ed6\u306e\u30a4\u30e9\u30b9\u30c8\u306f\u3001laurel\u3055\u3093 \u3068\u3044\u3046\u65b9\u304c\u304b\u3044\u3066\u3044\u3089\u3063\u3057\u3083\u3044\u307e\u3059\u3002\u3053\u3061\u3089\u3082\u65e5\u3005\u53ef\u611b\u3044Docker\u306e\u30ad\u30e3\u30e9\u30af\u30bf\u30fc\u306e\u9762\u3005\u304c\u7d39\u4ecb\u3055\u308c\u305f\u308a\u3057\u3066\u3044\u307e\u3059\uff01\n\u500b\u4eba\u7684\u306b\u3001Kitematic\u306e\u30a4\u30e1\u30fc\u30b8\u30ad\u30e3\u30e9\u30af\u30bf\u30fc\uff08\u30a8\u30a4\uff09\u306e\u53ef\u611b\u3055\u304c\u6c17\u306b\u5165\u3063\u3066\u304a\u308a\u307e\u3059\u3002Kitematic\u3092\u30a4\u30f3\u30b9\u30c8\u30fc\u30eb\u3055\u308c\u305f\u5834\u5408\u306f\u3001about...\u306e\u753b\u9762\u306b\u3053\u3093\u306a\u30ad\u30e3\u30e9\u30af\u30bf\u30fc\u304c\u51fa\u3066\u304d\u307e\u3059\u306e\u3067\u3001\u3053\u3061\u3089\u3082\u5408\u308f\u305b\u3066\u3054\u89a7\u304f\u3060\u3055\u3044\u307e\u305b\u3002\n\n\u305d\u308c\u3067\u306f\u3001\u826f\u3044\u5e74\u672b\u5e74\u59cb\u3092\u304a\u904e\u3054\u3057\u304f\u3060\u3055\u3044\uff01\n\u307f\u306a\u3055\u307e\u3053\u3093\u306b\u3061\u306f\u3002[Docker2 Advent Calendar 2016](http://qiita.com/advent-calendar/2016/docker2) \u306e9\u65e5\u76ee\u306b\u53c2\u52a0\u3055\u305b\u3066\u3044\u305f\u3060\u3044\u3066\u304a\u308a\u307e\u3059 @akiko_pusu \u3067\u3059\u3002\n\u304c\uff01\n\u65e5\u4ed8\u304c\u5909\u308f\u3063\u3066\u3057\u307e\u3063\u3066\u304b\u3089\u306e\u6295\u7a3f\u3067\u7533\u3057\u8a33\u3054\u3056\u3044\u307e\u305b\u3093...\u3002\n\u3055\u3089\u306b\u3001Docker\u306b\u3064\u3044\u3066\u306f\u305f\u304f\u3055\u3093\u8a9e\u308c\u308b\u7acb\u5834\u3067\u306f\u306a\u3044\u306e\u3067\u3059\u304c\u3001\u3068\u306b\u304b\u304f **Kitematic** \u306b\u3064\u3044\u3066\u3054\u7d39\u4ecb\u3057\u305f\u3044\u3068\u601d\u3044\u307e\u3059\u3002\n\n\u5185\u5bb9\u7684\u306b\u306fDocker\u305d\u306e\u3082\u306e\u3088\u308a\u3082\u3001Docker\u3092\u5229\u7528\u3057\u305f\u30a2\u30d7\u30ea\u30b1\u30fc\u30b7\u30e7\u30f3\u5bc4\u308a\u306b\u306a\u3063\u3066\u3057\u307e\u3044\u307e\u3059\u304c\u3001\u3054\u5bb9\u8d66\u304f\u3060\u3055\u3044\u307e\u305b\u3002\n\n\u306a\u304a\u300112/8 \u306f @okamu_ \u3055\u307e\u306e [\u3010Docker\u3011\u3082\u3046\u60a9\u307e\u306a\u3044\uff01MySQL\u306e\u30d5\u30a7\u30a4\u30eb\u30aa\u30fc\u30d0\u30fc\u3092docker-compose\u3067\u7206\u901f\u69cb\u7bc9](http://qiita.com/okamu_/items/6ab5269662bfeda4875b) \u3067\u3057\u305f\u3002\n\u307e\u305f\u300112/10 \u306f @mekemo_dao \u3055\u307e\u306e[ElasticBeanstalk Multi-Container Docker\u3067\u672c\u756a\u904b\u7528\u3057\u305f\u3044\u30f3\u30b4](http://qiita.com/mekemo_dao/items/dca7c2429869ea9d8693) \u3067\u3059\u3002\u3053\u3061\u3089\u3082\u3069\u3046\u305e\u5b9c\u3057\u304f\u304a\u9858\u3044\u3044\u305f\u3057\u307e\u3059\uff01\n\n## Kitematic\u3063\u3066\u306a\u306b\uff1f\n\nKitematic\u3068\u306f\u3001\u3053\u3061\u3089\u306e\u8a18\u4e8b\u3067\u3082\u5c11\u3057\u89e6\u308c\u307e\u3057\u305f\u304c\u3001Docker Toolbox \u306b\u3064\u3044\u3066\u304f\u308b\u3001GUI\u306eDocker\u64cd\u4f5c\u7528\u306e\u30c4\u30fc\u30eb\u3067\u3059\u3002\n\n- [Mac\u7248 Docker Toolbox \u3092\u4f7f\u3063\u3066\u307f\u307e\u3057\u305f](http://qiita.com/akiko-pusu/items/a30db6332a77ed0ded09)\n- https://kitematic.com \uff08\u516c\u5f0f\u30b5\u30a4\u30c8\uff09\n- https://docs.docker.com/kitematic/userguide/ \uff08\u30e6\u30fc\u30b6\u30ac\u30a4\u30c9\uff09\n\n### \u767a\u97f3\u306f\uff1f\n\n\u3042\u307e\u308a\u81ea\u4fe1\u304c\u3042\u308a\u307e\u305b\u3093\u304c\u3001[\u7d39\u4ecb\u7528\u306e\u52d5\u753b](https://www.youtube.com/watch?v=QEr340gjV1Q)\u3092\u898b\u308b\u9650\u308a\u300c\u304b\u3044\u3068\u307e\u3066\u3043\u3063\u304f\u300d\u3068\u547c\u3076\u3088\u3046\u3067\u3059\u3002\n\n### \u4f7f\u3044\u65b9\u306f\uff1f\n\nKitematic\u306fDocker Toolbox\u306e\u4e00\u90e8\u3068\u3057\u3066\u63d0\u4f9b\u3055\u308c\u3066\u3044\u307e\u3059\u3002\n\u30a2\u30a4\u30b3\u30f3\u3092\u30af\u30ea\u30c3\u30af\u3059\u308b\u3068\u3001\u3053\u3093\u306a\u611f\u3058\u3067\u7acb\u3061\u4e0a\u304c\u308a\u307e\u3059\u3002\n\n- \u30a2\u30d7\u30ea\u30b1\u30fc\u30b7\u30e7\u30f3\u8d77\u52d5\u6642\u306b\u3001Docker\u306e\u30c7\u30fc\u30e2\u30f3\u304c\u7acb\u3061\u4e0a\u304c\u3063\u3066\u3044\u308b\u304b\u78ba\u8a8d\n - Mac\u306e\u5834\u5408\u306f\u30cd\u30a4\u30c6\u30a3\u30d6\u306eDocker for Mac\u304c\u52d5\u3044\u3066\u3044\u308c\u3070Mac\u81ea\u8eab\u3092Docker\u306e\u30db\u30b9\u30c8\u3068\u3057\u3066\u5229\u7528\n- \u30cd\u30a4\u30c6\u30a3\u30d6\u306eDocker\u30c7\u30fc\u30e2\u30f3\u304c\u4e0a\u304c\u3063\u3066\u3044\u306a\u304b\u3063\u305f\u5834\u5408\n - VMWare\u4e0a\u306bboot2docker\u3068\u3044\u3046Docker\u5c02\u7528\u306eVM\u3092\u4f5c\u308a\u3001\u305d\u3053\u3067Docker\u30b5\u30fc\u30d3\u30b9\u3092\u958b\u59cb\n - \u63a5\u7d9a\u5148\u3092boot2docker\u3068\u3057\u3066\u5229\u7528\n\n![kitematic-and-docker-for-mac.png](https://qiita-image-store.s3.amazonaws.com/0/27976/6906ccd9-16d7-060c-aa2b-5df563f9c642.png \"kitematic-and-docker-for-mac.png\")\n\n\uff08\u306a\u304a\u3001\u521d\u56de\u8d77\u52d5\u6642\u306b\u306f\u3001DockerHub\u3078\u306e\u30b5\u30a4\u30f3\u30a4\u30f3\u30fb\u30b5\u30a4\u30f3\u30a2\u30c3\u30d7\u753b\u9762\u304c\u51fa\u307e\u3059\u304c\u3001\u3053\u3061\u3089\u306f\u7279\u306b\u306a\u306b\u3082\u3057\u306a\u304f\u3066\u3082\u5229\u7528\u53ef\u80fd\u3067\u3059\uff01\uff09\n\nDocker\u304c\u5229\u7528\u3067\u304d\u308b\u72b6\u614b\u306b\u306a\u308b\u3068\u3001\u753b\u9762\u53f3\u5074\u306b\u306fDockerHub\u3067\u63d0\u4f9b\u3055\u308c\u3066\u3044\u308b\u4eba\u6c17\u306e\u30a4\u30e1\u30fc\u30b8\u304c\u8868\u793a\u3055\u308c\u307e\u3059\u3002\u8a66\u3057\u306b\u6c17\u306b\u5165\u3063\u305f\u3082\u306e\u3092\u30c0\u30d6\u30eb\u30af\u30ea\u30c3\u30af\u3057\u305f\u308a\u3001\u691c\u7d22\u3057\u3066\u7c21\u5358\u306b\u597d\u304d\u306a\u30a4\u30e1\u30fc\u30b8\u3092\u8ffd\u52a0\u3001\u30b3\u30f3\u30c6\u30ca\u3092\u8d77\u52d5\u3059\u308b\u3053\u3068\u304c\u3067\u304d\u307e\u3059\u3002 \n\n\u4e00\u65e6\u4f5c\u6210\u3055\u308c\u3066\u8d77\u52d5\u3057\u305f\u30b3\u30f3\u30c6\u30ca\u306b\u3064\u3044\u3066\u306f\u3001\u3053\u3093\u306a\u3053\u3068\u304c\u3067\u304d\u307e\u3059\u3002\n\n- Start / Stop\n- Web\u30a2\u30d7\u30ea\u30b1\u30fc\u30b7\u30e7\u30f3\u3067port\u304cExpose\u3055\u308c\u3066\u3044\u308b\u3001\u30b3\u30f3\u30c6\u30ca\u3068\u30db\u30b9\u30c8\u9593\u306e\u30dd\u30fc\u30c8\u30d5\u30a9\u30ef\u30fc\u30c9\u306e\u8a2d\u5b9a\u3082\u3055\u308c\u3066\u3044\u308b\u5834\u5408\u306f\u3001\u30d7\u30ec\u30d3\u30e5\u30fc\u753b\u9762\u304c\u51fa\u3066\u304f\u308b\n- \u540d\u524d\u3092\u5909\u66f4\u3067\u304d\u308b\n- \u5fc5\u8981\u306b\u5fdc\u3058\u3066\u30dd\u30fc\u30c8\u30d5\u30a9\u30ef\u30fc\u30c9\u306e\u5bfe\u8c61\u306e\u30dd\u30fc\u30c8\u3092\u8ffd\u52a0\u5909\u66f4\u3067\u304d\u308b\n\n### \u52a9\u304b\u3063\u3066\u3044\u308b\u70b9\n\n\u30b3\u30f3\u30c6\u30ca\u8d77\u52d5\u306e\u969b\u306b\u3001\u4e0a\u3052\u3063\u3071\u306a\u3057\u3067\u3044\u3064\u306e\u307e\u306b\u304b\u305f\u304f\u3055\u3093\u30b3\u30f3\u30c6\u30ca\u304c\u8d77\u52d5\u3057\u3066\u3044\u305f...\u3068\u3044\u3046\u5834\u5408\u306b\u3082\u3001\u753b\u9762\u3067\u4e00\u76ee\u3067\u5206\u304b\u308a\u307e\u3059\u3002\n\u307e\u305f\u3001\u500b\u4eba\u7684\u306b\u9593\u9055\u3044\u3084\u3059\u3044\u30dd\u30fc\u30c8\u306e\u8a2d\u5b9a\uff08\u30b3\u30f3\u30c6\u30ca\u306e\u30dd\u30fc\u30c8\u3092\u30db\u30b9\u30c8\u306b\u30de\u30c3\u30d7\u3059\u308b\uff09\u3082\u3001\u753b\u9762\u4e0a\u306e\u8a2d\u5b9a\u3092\u898b\u306a\u304c\u3089\u78ba\u8a8d\u3067\u304d\u307e\u3059\u3002\n\n\u5834\u5408\u306b\u3088\u3063\u3066\u306f\u3001GUI\u304b\u3089\u8d77\u52d5\u4e2d\u306e\u30b3\u30f3\u30c6\u30ca\u306e\u4e2d\u306b\u5165\u3063\u305f\u308a\u3057\u3066\u3001\u52d5\u4f5c\u3092\u78ba\u8a8d\u3059\u308b\u3053\u3068\u3082\u3067\u304d\u307e\u3059\u3002\n\uff08\u3068\u306f\u8a00\u3063\u3066\u3082\u3001\u30b3\u30f3\u30c6\u30ca\u306f\u30b5\u30a4\u30ba\u3092\u5c0f\u3055\u304f\u3059\u308b\u305f\u3081\u30a8\u30c7\u30a3\u30bf\u304c\u5165\u3063\u3066\u3044\u306a\u3044\u5834\u5408\u304c\u3042\u308a\u307e\u3059\u306e\u3067\u3001\u4e2d\u306b\u5165\u3063\u3066\u30bd\u30fc\u30b9\u3092\u7de8\u96c6\u3059\u308b\u3053\u3068\u304c\u51fa\u6765\u306a\u3044\u30b1\u30fc\u30b9\u3084\u3001more\u306f\u3042\u308b\u3051\u3069less\u306f\u7121\u3044\u3001\u3068\u3044\u3063\u305f\u6b8b\u5ff5\u306a\u30b1\u30fc\u30b9\u3082\u3042\u308a\u307e\u3059\u3002\u30bd\u30fc\u30b9\u78ba\u8a8d\u304f\u3089\u3044\u306f\u3067\u304d\u308b\u3068\u3057\u3066...\uff09 \n\n![exec-and-result.png](https://qiita-image-store.s3.amazonaws.com/0/27976/e0ed5096-f494-4295-96e1-6e5cd30b1c9c.png \"exec-and-result.png\")\n\n\u4ee5\u4e0b\u306e\u3088\u3046\u306a\u3053\u3068\u3082\u3001GUI\u3067\u8a2d\u5b9a\u5909\u66f4\u3001\u9069\u7528\u304c\u3067\u304d\u307e\u3059\u3002\n\n- port\u306e\u5909\u66f4\uff08\u30d5\u30a9\u30ef\u30fc\u30c9\u7528\u306e\u30dd\u30fc\u30c8\u306e\u5909\u66f4\uff09\n- \u74b0\u5883\u5909\u6570\u306e\u8a2d\u5b9a\n- \u30db\u30b9\u30c8\u3068\u30b3\u30f3\u30c6\u30ca\u3067\u30b7\u30a7\u30a2\u3059\u308b\u30dc\u30ea\u30e5\u30fc\u30e0\u306e\u8a2d\u5b9a\n\n\n## \u306a\u306b\u3067\u3067\u304d\u3066\u3044\u308b\u306e\uff1f\n\n\u3055\u3066\u3001Kitematic\u306f\u3001Electron\u3092\u30d9\u30fc\u30b9\u306b\u3057\u305f\u30a2\u30d7\u30ea\u30b1\u30fc\u30b7\u30e7\u30f3\u3067\u3059\u3002\n\u3053\u306e\u305f\u3081\u3001\u7c21\u5358\u306b\u30bd\u30fc\u30b9\u3092\u53c2\u7167\u3057\u305f\u308a\u3001\u624b\u5143\u3067\u30ab\u30b9\u30bf\u30de\u30a4\u30ba\uff06\u8d77\u52d5\u3059\u308b\u3053\u3068\u304c\u3067\u304d\u307e\u3059\u3002\uff08\u3068\u3001\u5049\u305d\u3046\u306a\u3053\u3068\u3092\u3044\u3044\u307e\u3057\u305f\u304c\u3001\u79c1\u306f\u307e\u3060\u306a\u306b\u3082\u51fa\u6765\u307e\u305b\u3093...\uff09\n\u305b\u3063\u304b\u304f\u306a\u306e\u3067\u3001\u30bd\u30fc\u30b9\u306e\u4e2d\u8eab\u3084\u52d5\u304d\u306b\u3064\u3044\u3066\u3082\u3055\u3089\u3063\u3068\u89e6\u308c\u308b\u3053\u3068\u306b\u3057\u307e\u3059\u3002\n\n## Kitematic\u306e\u30ea\u30dd\u30b8\u30c8\u30ea\u3092\u306e\u305e\u3044\u3066\u307f\u3088\u3046\uff01\n\nKitematic\u306e\u30ea\u30dd\u30b8\u30c8\u30ea\u306f\u3053\u3061\u3089\u306b\u306a\u308a\u307e\u3059\u3002\n\n- https://github.com/docker/kitematic.git \n\nREADME\u5074\u306b\u306f\u30a4\u30f3\u30b9\u30c8\u30fc\u30eb\u306e\u624b\u9806\u3068\u3001\u7c21\u5358\u306a\u7d39\u4ecb\u3001\u30c9\u30ad\u30e5\u30e1\u30f3\u30c8\u3084\u516c\u5f0f\u30b5\u30a4\u30c8\u3078\u306e\u30ea\u30f3\u30af\u304c\u8a18\u8f09\u3055\u308c\u3066\u3044\u307e\u3059\u3002\n\nKitematic\u3068\u3044\u3046Electron\u30d9\u30fc\u30b9\u306e\u30a2\u30d7\u30ea\u30b1\u30fc\u30b7\u30e7\u30f3\u305d\u306e\u3082\u306e\u306b\u8208\u5473\u304c\u3042\u308b\u5834\u5408\u306f\u3001 [CONTRIBUTING.md](https://github.com/docker/kitematic/blob/master/CONTRIBUTING.md) \u3092\u3054\u89a7\u3044\u305f\u3060\u304f\u3068\u3001\u30d3\u30eb\u30c9\u3084\u30c6\u30b9\u30c8\u306e\u65b9\u6cd5\u306b\u3064\u3044\u3066\u8a73\u3057\u304f\u89e6\u308c\u3089\u308c\u3066\u3044\u307e\u3059\u306e\u3067\u3001\u305c\u3072\u305d\u3061\u3089\u3092\u3069\u3046\u305e\uff01\n\n\u307e\u305f\u3001\u3053\u3053\u304b\u3089\u5148\u306f\u30d3\u30eb\u30c9\u95a2\u9023\u306b\u306a\u3063\u3066\u304d\u307e\u3059\u306e\u3067\u3054\u5bb9\u8d66\u304f\u3060\u3055\u3044\u3002\n\n## build\u3057\u3066\u307f\u3088\u3046\uff01\n\nCONTRIBUTING.md\u306b\u3082\u66f8\u304b\u308c\u3066\u3044\u307e\u3059\u304c\u3001node.js\u304c\u5165\u3063\u3066\u3044\u308c\u3070\u57fa\u672c\u7684\u306b\u30d3\u30eb\u30c9\u3067\u304d\u308b\u72b6\u614b\u306b\u306a\u3063\u3066\u3044\u307e\u3059\u306e\u3067\u3001\u4eca\u56de\u306f\u30bd\u30fc\u30b9\u3092clone\u3057\u3066\u304d\u3066\u3001VSCode\u3067\u958b\u3044\u3066\u307f\u307e\u3057\u305f\u3002\uff08VSCode\u3082Electron\u30d9\u30fc\u30b9\u3067\u3059\uff09\n\npackage.json\u3084Gruntfile.js\u3068\u3044\u3063\u305f\u30d5\u30a1\u30a4\u30eb\u304c\u3042\u308b\u306e\u3067\u3001\u30bf\u30fc\u30df\u30ca\u30eb\u304b\u3089\u306ebuild\u3082\u51fa\u6765\u307e\u3059\u304c\u3001VSCode\u306e\u5834\u5408\u306f\u300c\u30b3\u30de\u30f3\u30c9\u30d1\u30ec\u30c3\u30c8\u300d\u304b\u3089\u3001npm \u3068\u5165\u529b\u3059\u308b\u3068\u3001\u5229\u7528\u3067\u304d\u308b\u30bf\u30b9\u30af\u306e\u5019\u88dc\u304c\u8868\u793a\u3055\u308c\u307e\u3059\u3002\n\n![build-with-vscode.png](https://qiita-image-store.s3.amazonaws.com/0/27976/1d9a2308-9d81-fe82-caf3-60dc7836dbc2.png \"build-with-vscode.png\")\n\n\n\u3055\u3063\u304f\u308abuild & \u52d5\u304b\u3057\u3066\u307f\u305f\u3044\u3068\u3044\u3046\u5834\u5408\u306b\u306f\u3001npm start \u3092\u9078\u3076\u3068\u3001Electron\u306e\u30a2\u30a4\u30b3\u30f3\u304c\u8868\u793a\u3055\u308c\u3066\u3001Kitematic\u306e\u30a2\u30d7\u30ea\u30b1\u30fc\u30b7\u30e7\u30f3\u304c\u7acb\u3061\u4e0a\u304c\u308a\u307e\u3059\u3002\n\nGruntfile.js \u306b\u5f93\u3063\u3066Grunt\u306e\u30bf\u30b9\u30af\u3092\u52d5\u304b\u3057\u305f\u3044\u5834\u5408\u306f\u3001npm install -g grunt \u3067grunt\u3092\u8ffd\u52a0\u3057\u3066\u304b\u3089\u30bf\u30b9\u30af\u8d77\u52d5\u306b\u306a\u308a\u307e\u3059\u3002\n\n![grunt.png](https://qiita-image-store.s3.amazonaws.com/0/27976/56907319-1173-2573-c2a9-03821f6707b0.png \"grunt.png\")\n\n\n\u5b9f\u969b\u306b\u30bd\u30fc\u30b9\u3092\u5c11\u3057\u3044\u3058\u3063\u3066\u307f\u308b\u3068\u3001\u3061\u3083\u3093\u3068\u5909\u66f4\u3055\u308c\u308b\u3053\u3068\u304c\u308f\u304b\u308a\u307e\u3059\u3002\n\uff08\u3053\u3061\u3089\u306f\u5358\u7d14\u306b\u30d5\u30a9\u30f3\u30c8\u3092\u5909\u3048\u305f\u4f8b\u3067\u3059\u304c....\uff09\n\n![customize-sample.png](https://qiita-image-store.s3.amazonaws.com/0/27976/270541af-8b23-8955-fa9f-f19d53319569.png \"customize-sample.png\")\n\n\n## \u3082\u3046\u3061\u3087\u3063\u3068\u8a73\u3057\u304f\u307f\u3066\u307f\u3088\u3046\n\n### \u3069\u3046\u3084\u3063\u3066\u63cf\u753b\u3057\u3066\u308b\u306e\uff1f\n\nElectron\u30a2\u30d7\u30ea\u306a\u306e\u3067\u3001\u30bd\u30fc\u30b9\u306fHTML\u304c\u308f\u304b\u308c\u3070\u306a\u3093\u3068\u306a\u304f\u7406\u89e3\u3067\u304d\u305d\u3046\u3001\u3068\u306f\u8a00\u3046\u3082\u306e\u306e\u3001\u3068\u304f\u306b\u30b3\u30f3\u30c6\u30ca\u306e\u30a2\u30d7\u30ea\u30b1\u30fc\u30b7\u30e7\u30f3\u306e\u30d7\u30ec\u30d3\u30e5\u30fc\u306a\u3069\u306f\u3069\u3093\u306a\u3075\u3046\u306b\u5b9f\u73fe\u3057\u3066\u3044\u308b\u3093\u3060\u308d\u3046...\uff1f\n\n\u3056\u3063\u3068\u4f5c\u308a\u3092\u773a\u3081\u3066\u898b\u305f\u3044\u5834\u5408\u306f\u3001\u753b\u9762\u4e0a\u90e8\u306e\u30e1\u30cb\u30e5\u30fc\u304b\u3089\u3001\u300cChrome Developer Tool\u300d\u3092\u8d77\u52d5\u3059\u308b\u3068\u3001\u30d1\u30cd\u30eb\u4e0a\u306e\u8981\u7d20\u306b\u5bfe\u5fdc\u3059\u308b\u30bd\u30fc\u30b9\u304c\u628a\u63e1\u3067\u304d\u307e\u3059\u3002\uff08\u30d6\u30e9\u30a6\u30b6\u306eChrome\u306eDeveloper Tool\u3068\u540c\u3058\u3067\u3059\uff09\n\n\u305f\u3057\u304b\u306b\u3001HTML, JavaScript, CSS\u3068\u3044\u3063\u305fWeb\u306e\u6280\u8853\u3067\u69cb\u6210\u3055\u308c\u3066\u3044\u308b\u306e\u304c\u5206\u304b\u308a\u307e\u3059\u306d\u3002\n\u5927\u90e8\u5206\u306e\u52d5\u7684\u306a\u60c5\u5831\u306f\u3001Docker\u306e\u30db\u30b9\u30c8\u5074\u304b\u3089API\u7d4c\u7531\u3067\u53d6\u5f97\u3057\u3001\u305d\u308c\u306b\u57fa\u3065\u3044\u3066\u753b\u9762\u304c\u69cb\u6210\u3055\u308c\u3066\u3044\u307e\u3059\u3002\n\n\u305f\u3060\u3057\u3001\u4e00\u7b87\u6240\u3001Web\u30a2\u30d7\u30ea\u30b1\u30fc\u30b7\u30e7\u30f3\u306e\u30b3\u30f3\u30c6\u30ca\u306e\u5834\u5408\u306f\u30d7\u30ec\u30d3\u30e5\u30fc\u306e\u753b\u9762\u3082\u8868\u793a\u3055\u308c\u308b\u306e\u3067\u3059\u304c\u3001Docker\u306eAPI\u306b\u306f\u305d\u3093\u306a\u753b\u50cf\u3092\u98db\u3070\u3059\u3082\u306e\u306a\u3093\u3066\u7121\u3044\u306e\u3067\u3001\u300c\u3069\u3046\u3084\u3063\u3066\u3044\u308b\u3093\u3060\u308d\u3046\uff1f\u300d\u3068\u6c17\u306b\u306a\u3063\u3066\u3044\u305f\u306e\u3067\u3059\u304c\u3001\u3088\u304f\u3088\u304f\u898b\u308b\u3068Webview\u3092\u4f7f\u3063\u3066\u306f\u3081\u8fbc\u3093\u3067\u3044\u308b\u3093\u3067\u3059\u306d\u3002\n\n![using-webview.png](https://qiita-image-store.s3.amazonaws.com/0/27976/644adf6d-6488-36c8-2af5-90d6d41ddfda.png \"using-webview.png\")\n\n\u4e00\u65b9\u3067\u3001\u300cContainer Logs\u300d\uff08\u30b3\u30f3\u30c6\u30ca\u306e\u30ed\u30b0\uff09\u306b\u95a2\u3057\u3066\u306f\u3001WebView\u3067\u306f\u306a\u304fDocker\u306eAPI\u306elogs\u3092\u53e9\u3044\u3066\u63cf\u753b\u3055\u305b\u3066\u3044\u307e\u3059\u3002\n\n### \u3069\u3093\u306a\u3075\u3046\u306bDocker\u30b3\u30f3\u30c6\u30ca\u3068\u304a\u8a71\u3057\u3057\u3066\u308b\u306e\uff1f\n\n\u4e0a\u8a18\u306e\u901a\u308a\u3001Kitematic\u306fDocker API\u3092\u4f7f\u3063\u3066\u753b\u9762\u3092\u69cb\u6210\u3057\u3066\u3044\u307e\u3059\u3002\n\n\u6b8b\u5ff5\u306a\u304c\u3089\u3053\u306e\u901a\u4fe1\u306b\u3064\u3044\u3066\u306fDeveloper Tool\u306eNetwork\u30bf\u30d6\u3067\u306f\u898b\u308b\u3053\u3068\u304c\u3067\u304d\u307e\u305b\u3093\u3002\n\u3067\u3059\u304c\u3001API\u306b\u306f\u5909\u308f\u308a\u3042\u308a\u307e\u305b\u3093\u306e\u3067\u3001\u3053\u3061\u3089\u3082\uff08\u8131\u7dda\u3057\u307e\u3059\u304c\uff09\u3061\u3087\u3063\u3068\u89e6\u308c\u3066\u307f\u307e\u3059\u3002\n\n## Docker API\u3092\u8a66\u3057\u3066\u307f\u3088\u3046\n\nDocker API\u306f\u3001\u540c\u4e00\u30db\u30b9\u30c8\u5185\u3067\u3042\u308c\u3070Unix\u30c9\u30e1\u30a4\u30f3\u30bd\u30b1\u30c3\u30c8\u3092\u901a\u3057\u3066\u63d0\u4f9b\u3059\u308b\u3053\u3068\u304c\u3067\u304d\u307e\u3059\u304c\u3001\u5916\u90e8\u3068\u306e\u3084\u308a\u3068\u308a\u304c\u5fc5\u8981\u306b\u306a\u308b\u5834\u5408\u306ftcp (http/https) \u3092\u5229\u7528\u3059\u308b\u5f62\u306b\u306a\u308a\u307e\u3059\u3002\n\n### Unix Domain Socket\u306e\u5834\u5408\n\nMacOS\u3067 Docker for Mac\u3092\u4f7f\u3063\u3066Docker\u306e\u74b0\u5883\u3092\u5229\u7528\u3059\u308b\u5834\u5408\u306f\u3001Mac\u5185\u306edocker\u30b3\u30de\u30f3\u30c9\u30fbKitematic\u306fUnix\u30c9\u30e1\u30a4\u30f3Socket\u3067\u306e\u901a\u4fe1\u306b\u306a\u308a\u307e\u3059\u3002\uff08/var/run/docker.sock\uff09\n\u5b9f\u969b\u306b\u3001\u8d77\u52d5\u4e2d\u306e\u30b3\u30f3\u30c6\u30ca\u306b\u5bfe\u3057\u3066\u3001\u30ed\u30b0\u3092\u53d6\u5f97\u3059\u308bAPI\u3092\u53e9\u304f\u5834\u5408\u306f\u3001\u4ee5\u4e0b\u306e\u3088\u3046\u306a\u30b3\u30de\u30f3\u30c9\u306b\u306a\u308a\u307e\u3059\u3002\n\n```\n$ curl --unix-socket /var/run/docker.sock \"http:/containers/b1a7d599d/logs?follow=true&stderr=true&stdout=true&timestamps=true\"\n\n# \u3053\u3061\u3089\u3082API\u3092\u53e9\u3044\u3066\u3044\u308b\u611f\u3058\u306b\u306a\u308a\u307e\u3059\n$ docker logs b1a7d59\n\n# \u51fa\u529b\u4f8b\uff08Docker\u30b3\u30f3\u30c6\u30ca\u306eWeb\u306e\u753b\u9762\u306b\u30a2\u30af\u30bb\u30b9\u3059\u308b\u3068\u3001\u30b3\u30f3\u30c6\u30ca\u3067\u8d77\u52d5\u4e2d\u306enginx\u306e\u51fa\u529b\u304c\u30ed\u30b0\u3068\u3057\u3066\u8868\u793a\u3055\u308c\u308b\uff09\n2016-12-09T15:40:43.976694996Z INFO[10650] 172.17.0.1 - - [12/Dec/91243:12:12:12 -1600]  GET \"/index.html\" HTTP/1.1 200 8056 \n2016-12-09T15:40:44.037363718Z INFO[10650] 172.17.0.1 - - [12/Dec/91244:12:12:12 -1600]  GET \"/fonts/droid.woff2\" HTTP/1.1 200 11304 \n2016-12-09T15:40:44.040806479Z INFO[10650] 172.17.0.1 - - [12/Dec/91244:12:12:12 -1600]  GET \"/fonts/droid-bold.woff2\" HTTP/1.1 200 11480 \n2016-12-09T15:41:31.727200261Z INFO[10698] 172.17.0.1 - - [12/Dec/91231:12:12:12 -1600]  GET \"/index.html\" HTTP/1.1 200 8056 \n2016-12-09T15:41:31.818593237Z INFO[10698] 172.17.0.1 - - [12/Dec/91231:12:12:12 -1600]  GET \"/fonts/droid.woff2\" HTTP/1.1 200 11304 \n2016-12-09T15:41:31.818766633Z INFO[10698] 172.17.0.1 - - [12/Dec/91231:12:12:12 -1600]  GET \"/fonts/droid-bold.woff2\" HTTP/1.1 200 11480 \n```\n\nsocket\u306e\u5834\u5408\u3060\u3068\u3001\u901a\u4fe1\u306e\u30ad\u30e3\u30d7\u30c1\u30e3\u306e\u65b9\u6cd5\u304c\u3088\u304f\u5206\u304b\u3089\u306a\u3044...\u3002\n\u3068\u3044\u3046\u3053\u3068\u3067\u3001boot2docker\u3092\u5229\u7528\u3057\u3066Kitematic\u3068Docker\u30db\u30b9\u30c8\u306etcp\u3067\u306eAPI\u901a\u4fe1\u3092\u773a\u3081\u3066\u307f\u308b\u3053\u3068\u306b\u3057\u307e\u3057\u305f\u3002\n\n### Docker API\u3068Kitematic\u306e\u901a\u4fe1\u306f\uff1f\n\nDocker for Mac\u3092\u5229\u7528\u3057\u3066\u3044\u3066\u3082\u3001\u305d\u3061\u3089\u3092\u505c\u6b62\u3057\u3066\u3001boot2docker\u5074\u3092\u5229\u7528\u3059\u308b\u3053\u3068\u304c\u3067\u304d\u307e\u3059\u306e\u3067\u3001\u307e\u305a\u306f\u4ee5\u4e0b\u306e\u901a\u308aDocker\u3092\u5207\u308a\u66ff\u3048\u307e\u3059\u3002\u3053\u306e\u3042\u305f\u308a\u306fKitematic\u3092\u542b\u3080Docker Toolbox\u3092\u30c0\u30a6\u30f3\u30ed\u30fc\u30c9\u3059\u308b\u3068\u4e00\u7dd2\u306b\u5fc5\u8981\u306a\u3082\u306e\u304c\u4ed8\u3044\u3066\u304d\u307e\u3059\u3002\n\u307e\u305f\u3001Kitematic\u3092\u521d\u56de\u8d77\u52d5\u3057\u305f\u5834\u5408\u306f\u3001MacOS\u306e\u30cd\u30a4\u30c6\u30a3\u30d6\u306eDocker\u304c\u4e0a\u304c\u3063\u3066\u3044\u306a\u3051\u308c\u3070\u3001boot2docker\u3092\u5229\u7528\u3057\u3066VM\u3092\u7acb\u3061\u4e0a\u3052\u308b\u51e6\u7406\u304c\u9032\u307f\u307e\u3059\u3002\n\n- boot2docker: VirtualBox\u306bLinux\u30d9\u30fc\u30b9\u306eboot2docker\u306e\u30de\u30b7\u30f3\u3092\u8ffd\u52a0\n - \u3053\u306e\u4e2d\u3067Docker\u306e\u30c7\u30fc\u30e2\u30f3\u3092\u8d77\u52d5\n - \u4eca\u56de\u306e\u4f8b\u3067\u306f\u3001IP\u306f192.168.99.100 \u3092\u5272\u308a\u5f53\u3066\n\n\u3046\u307e\u304fboot2docker\u3067\u306eDocker\u30c7\u30fc\u30e2\u30f3\u304c\u4e0a\u304c\u3063\u305f\u3068\u3057\u307e\u3057\u3066\u3002\n\n\u307e\u305a\u306f [Docker Remote API](https://docs.docker.com/engine/reference/api/docker_remote_api/)\u306e\u30c9\u30ad\u30e5\u30e1\u30f3\u30c8\u306b\u5f93\u3063\u3066\u3001API\u304c\u3061\u3083\u3093\u3068\u53cd\u5fdc\u3059\u308b\u304b\u78ba\u8a8d\u3057\u3066\u307f\u307e\u3059\u3002\nDocker API\u306e\u30c7\u30d5\u30a9\u30eb\u30c8\u30dd\u30fc\u30c8\u306f2376\u306a\u306e\u3067\u3001\u305d\u3061\u3089\u306b\u5bfe\u3057\u3066\u30ea\u30af\u30a8\u30b9\u30c8\u3092\u6295\u3052\u3066\u307f\u307e\u3059\u3002\n\n```\n# json\u30c7\u30fc\u30bf\u304c\u8fd4\u308b\u304c\u3001\u305f\u304f\u3055\u3093\u3042\u308b\u306e\u3067\u4e00\u90e8\u306e\u307f\u30d1\u30fc\u30b9\u3057\u3066\u8868\u793a\n\n$ /usr/local/bin/curl -s --insecure --cert $DOCKER_CERT_PATH/cert.pem --key $DOCKER_CERT_PATH/key.pem \\\n   https://192.168.99.100:2376/containers/json | jq '.[].Names[]'\n\n\"/hello-world-nginx\"\n\n```\n\n\u3053\u3093\u306a\u611f\u3058\u3067\u3001\u73fe\u5728\u8d77\u52d5\u3057\u3066\u3044\u308b\u30b3\u30f3\u30c6\u30ca\u306e\u60c5\u5831\u304c\u53d6\u308c\u307e\u3057\u305f\u3002\n\n### tcpdump \u3057\u3066\u307f\u305f\u3089\uff1f\n\nDocker API\u306e\u30c7\u30d5\u30a9\u30eb\u30c8\u306e\u30dd\u30fc\u30c8\u306f2376\u306a\u306e\u3067\u3001tcpdump\u3067\u901a\u4fe1\u3092\u62fe\u3063\u3066\u307f\u308b\u3068\u3053\u3093\u306a\u611f\u3058\u3067\u3059\u3002\nKitematic\u304b\u3089\u30b3\u30f3\u30c6\u30ca\u306e\u60c5\u5831\u3092\u53d6\u5f97\u3057\u305f\u308a\u3001\u8d77\u52d5\u30fb\u4fdd\u5b58\u3092\u5b9f\u884c\u3059\u308b\u3068\u30d1\u30b1\u30c3\u30c8\u304c\u6d41\u308c\u307e\u3059\u3002\n\u3042\u307e\u308a\u3053\u306e\u8fba\u6df1\u6398\u308a\u3067\u304d\u306a\u304f\u3066\u7533\u3057\u8a33\u306a\u3044\u306e\u3067\u3059\u304c\u3001Kitematic\u306eGUI\u304b\u3089\u30b3\u30f3\u30c6\u30ca\u306e\u8a2d\u5b9a\u3092\u4fdd\u5b58\u3057\u305f\u308a\u3001start / stop \u3059\u308b\u3068\u78ba\u304b\u306b\u901a\u4fe1\u304c\u6d41\u308c\u308b\u306e\u304c\u78ba\u8a8d\u3067\u304d\u307e\u3059\u3002\n\n```\n$ sudo tcpdump port 2376 and host 192.168.99.100 \ntcpdump: data link type PKTAP\ntcpdump: verbose output suppressed, use -v or -vv for full protocol decode\nlistening on pktap, link-type PKTAP (Apple DLT_PKTAP), capture size 262144 bytes\n09:07:52.301770 IP 192.168.99.100.2376 > 192.168.99.1.57608: Flags [S.], seq 34968944, ack 3475486455, win 28960, options [mss 1460,sackOK,TS val 406920 ecr 1142976386,nop,wscale 7], length 0\n09:07:52.302279 IP 192.168.99.100.2376 > 192.168.99.1.57608: Flags [.], ack 1449, win 249, options [nop,nop,TS val 406920 ecr 1142976387], length 0\n......\n```\n\nWireshark\u3092\u3064\u304b\u3046\u3068\u3053\u3093\u306a\u611f\u3058\u3067\u3059\u3002\n\n![with-wireshark.png](https://qiita-image-store.s3.amazonaws.com/0/27976/93ac842e-4ff0-0618-68cc-db9d5777dc1a.png \"with-wireshark.png\")\n\n\u3067\u3082\u3001\u601d\u3063\u3066\u305f\u306e\u3068\u9055\u3046...\u3002\n\u305d\u3046\u3067\u3059\u3001\u901a\u4fe1\u304c\u6697\u53f7\u5316\u3055\u308c\u3066\u3044\u308b\u305f\u3081\u3001TCP\u306e\u3084\u308a\u3068\u308a\u306e\u6d41\u308c\u306f\u8ffd\u3048\u3066\u3082\u3001\u5b9f\u969b\u3069\u3093\u306a\u30d7\u30ed\u30c8\u30b3\u30eb\u3067\u3069\u3093\u306a\u30c7\u30fc\u30bf\u304c\u3084\u308a\u3068\u308a\u3055\u308c\u3066\u3044\u308b\u306e\u304b\u304c\u898b\u3048\u307e\u305b\u3093... ><\n\u305d\u3053\u307e\u3067\u3053\u3060\u308f\u3089\u306a\u304f\u3068\u3082...\u3068\u601d\u3044\u3064\u3064\u3001\u305b\u3063\u304b\u304f\u306a\u306e\u3067\u3084\u3063\u3071\u308atcpdump (or Wireshark)\u3067\u901a\u4fe1\u3092\u8997\u3044\u3066\u307f\u305f\u3044\uff01\n\u3068\u3044\u3046\u3053\u3068\u3067\u3001\u8abf\u6574\u3092\u3057\u3066\u307f\u307e\u3057\u305f\u3002\n(Wireshark\u3067\u6697\u53f7\u5316\u3055\u308c\u305f\u901a\u4fe1\u3092\u9375\u3092\u4f7f\u3063\u3066\u5fa9\u53f7\u5316\u3059\u308b\u65b9\u6cd5\u3082\u3042\u308b\u307f\u305f\u3044\u3067\u3059\u304c\u3001\u3088\u304f\u308f\u304b\u3089\u306a\u304b\u3063\u305f\u306e\u3067\u30d1\u30b9\uff09\n\n**1. boot2docker\u5074\u306eAPI\u3092\u6697\u53f7\u5316\u306a\u3057\u306b\u3059\u308b**\n\nDocker for Mac\u3067\u3082socket\u4ee5\u5916\u306btcp\u3067\u306e\u901a\u4fe1\u3092\u53d7\u3051\u3089\u308c\u308b\u3088\u3046\u306b\u3067\u304d\u305d\u3046\u304b\u306a...\u3068\u3082\u601d\u3063\u305f\u306e\u3067\u3059\u304c\u3001\u3046\u307e\u304f\u884c\u304b\u306a\u304b\u3063\u305f\u306e\u3067\u3053\u3061\u3089\u306e\u65b9\u6cd5\u3067\u3067\u3002\n\n- ssh \u3067boot2docker\u306eVM\u306b\u30ed\u30b0\u30a4\u30f3\u3059\u308b\n- vi /var/lib/boot2docker/profile \u3067\u8a2d\u5b9a\u3092\u7de8\u96c6\n - DOCKER_HOST='-H tcp://0.0.0.0:2375'  # port 2357\u306b\u5909\u66f4\n - DOCKER_TLS=no # TLS\u306a\u3057\u306b\u3059\u308b\n- \u4fdd\u5b58\u3092\u3057\u3066\u3001/etc/init.d/docker restart \u3067\u518d\u8d77\u52d5\n\n\u203b\u3042\u307e\u308a\u30aa\u30b9\u30b9\u30e1\u3067\u306f\u306a\u3044\u306e\u3067\u3059\u304c\u3001\u9589\u3058\u305f\u74b0\u5883\u306a\u306e\u3067\u3053\u306e\u3088\u3046\u306b\u3057\u307e\u3057\u305f....\u3002\u3000\u3000\u3000\u3000\u3000\u3000\u3000\u3000\u3000\u3000\u3000\u3000\u3000\n\n**2. Kitematic\u306e\u30bd\u30fc\u30b9\u3092\u4fee\u6b63\u3057\u3066http:2375\u3067\u901a\u4fe1\u3055\u305b\u308b**\n\n\u4e00\u65b9\u306eKitematic\u3067\u3059\u304c\u3001\u57fa\u672c\u306fUnix Socket\u304bhttps://2376/ \u3067API\u3068\u901a\u4fe1\u3059\u308b\u3088\u3046\u306b\u30bd\u30fc\u30b9\u4e2d\u306b\u5b9a\u7fa9\u3055\u308c\u3066\u3044\u307e\u3059\u3002\n\u305d\u306e\u307e\u307e\u8d77\u52d5\u3057\u3066\u3082\u3001https://2376/ \u306b\u554f\u3044\u5408\u308f\u305b\u306b\u884c\u3063\u3066\u3057\u307e\u3046\u305f\u3081\u3001\u3046\u307e\u304f\u3044\u304d\u307e\u305b\u3093\u3002\n\n\u3068\u3044\u3046\u3053\u3068\u3067\u3001\u30bd\u30fc\u30b9\u3092\u8abf\u6574\u3067\u304d\u308b\u74b0\u5883\u3092\u5229\u7528\u3057\u3066\u3001\u8a2d\u5b9a\u3092\u5909\u66f4\u3057\u3066build, \u8d77\u52d5\u3055\u305b\u3066\u307f\u307e\u3057\u305f\u3002\n\n```source:DockerUtil.js\n      this.client = new dockerode({\n        protocol: 'http', // https\u3060\u3063\u305f\n        host: ip,\n        port: 2375,       // 2376\u3060\u3063\u305f\n        ca: fs.readFileSync(path.join(certDir, 'ca.pem')),\n        cert: fs.readFileSync(path.join(certDir, 'cert.pem')),\n        key: fs.readFileSync(path.join(certDir, 'key.pem'))\n      });\n```\n\n\u3055\u3066\u3001\u7acb\u3061\u4e0a\u304c\u3063\u305fKitematic\u3092\u30dd\u30c1\u30dd\u30c1\u30af\u30ea\u30c3\u30af\u3057\u3066\u307f\u308b\u3068\u3001\u3061\u3083\u3093\u3068http\u3067\u901a\u4fe1\u3057\u3066\u304a\u308a\u3001\u901a\u4fe1\u306e\u4e2d\u8eab\u3082Wireshark\u3067\u78ba\u8a8d\u3059\u308b\u3053\u3068\u304c\u3067\u304d\u307e\u3057\u305f\u3002\n\n![change-after-http.png](https://qiita-image-store.s3.amazonaws.com/0/27976/ba8c3ba4-39f3-45b6-e3cd-e69d1f61068c.png \"change-after-http.png\")\n\n\n\u3053\u3046\u3044\u3046\u6642\u3063\u3066\u3001\u30bd\u30fc\u30b9\u3092\u8abf\u6574\u3067\u304d\u308b\u306e\u3063\u3066\u826f\u3044\u306a\u3042...\u3068\u601d\u3044\u307e\u3059\u3002\n\n\n### \u88dc\u8db3\uff1aKitematic\u3067\u306e\u8a2d\u5b9a\u7b87\u6240\n\nKitematic\u306f\u3001Docker\u306e\u30c7\u30fc\u30e2\u30f3\u304c\u3069\u3093\u306a\u611f\u3058\u3067\u4e0a\u304c\u3063\u3066\u3044\u308b\u304b\u3092\u30c1\u30a7\u30c3\u30af\u3057\u3066\u3001API\u306e\u5b9b\u5148\u3092socket\u3082\u3057\u304f\u306fhttp\uff08https) \u306b\u5207\u308a\u66ff\u3048\u3066\u3044\u307e\u3059\u3002\n\u305d\u306e\u8fba\u306f\u3001[DockerUtil.js](https://github.com/docker/kitematic/blob/master/src/utils/DockerUtil.js) \u3042\u305f\u308a\u3067\u78ba\u8a8d\u3067\u304d\u307e\u3059\u3002Docker API\u306b\u5bfe\u5fdc\u3059\u308b\u30a2\u30af\u30b7\u30e7\u30f3\u304c\u6982\u306d\u3053\u3061\u3089\u306b\u5b9a\u7fa9\u3055\u308c\u3066\u3044\u308b\u611f\u3058\u3067\u3059\u3002\n\n## \u307e\u3068\u3081\n\n\u4ee5\u4e0a\u3001\u3064\u3089\u3064\u3089\u3068\u3001\u6c17\u304c\u3064\u3051\u3070\u8208\u5473\u306b\u3072\u304d\u305a\u3089\u308c\u308b\u307e\u307e\u306b\u66f8\u3044\u3066\u3057\u307e\u3063\u3066\u7533\u3057\u8a33\u3054\u3056\u3044\u307e\u305b\u3093\u3002\n\u8131\u7dda\u3092\u631f\u307f\u306a\u304c\u3089\u3082\u3001\u3053\u3093\u306a\u70b9\u306b\u3064\u3044\u3066\u89e6\u308c\u3066\u3044\u307e\u3059\u3002\n\n- Kitematic\u306b\u3064\u3044\u3066 \n- Kitematic\u3092\u30bd\u30fc\u30b9\u304b\u3089\u8d77\u52d5\u3059\u308b\n- Docker API\u3068Kitematic\u306e\u901a\u4fe1\u3092\u773a\u3081\u308b\n\n\u95a2\u9023\u3057\u3066\u3001Docker for Mac / boot2docker\u306e\u9055\u3044\u3084\u3001\u901a\u4fe1\u306e\u30ad\u30e3\u30d7\u30c1\u30e3\u3001Electron\u306b\u3064\u3044\u3066\u3082\u89e6\u308c\u307e\u3057\u305f\u3002\n\n\n\u3053\u308c\u304b\u3089Docker\u3092\uff08Mac\u3092\u30d9\u30fc\u30b9\u306b\uff09\u89e6\u3063\u3066\u307f\u3088\u3046\u3068\u3044\u3046\u65b9\u3084\u3001Electron\u306b\u89e6\u308c\u3066\u307f\u3088\u3046\u3068\u3044\u3046\u65b9\u306b\u3068\u3063\u3066\u3082\u3001Kitematic\u306f\u306a\u304b\u306a\u304b\u9762\u767d\u3044\u7d20\u6750\u306a\u306e\u3067\u306f\u306a\u3044\u304b\u306a\u3068\u601d\u3044\u307e\u3059\u3002\n\u8a2d\u5b9a\u306b\u6163\u308c\u308b\u3001\u3082\u3057\u304f\u306f\u3044\u308d\u3093\u306a\u30a4\u30e1\u30fc\u30b8\u3092\u8a66\u3057\u3066\u307f\u308b\u3068\u3044\u3063\u305f\u70b9\u3067\u3082\u3001\u3068\u3066\u3082\u4f7f\u3044\u3084\u3059\u3044\u30c4\u30fc\u30eb\u3067\u3059\u306e\u3067\u3001\u305c\u3072\u6a5f\u4f1a\u304c\u3042\u308c\u3070\u5229\u7528\u3057\u3066\u307f\u3066\u304f\u3060\u3055\u3044\u306d!\n\n\n## \u304a\u307e\u3051\uff1a\u30ad\u30e3\u30e9\u3092\u63cf\u3044\u3066\u3044\u308b\u65b9\u306f\uff1f\n\nDocker\u306e\u30af\u30b8\u30e9\u3055\u3093\u3001\u30a8\u30a4\u3001\u305d\u306e\u4ed6\u306e\u30a4\u30e9\u30b9\u30c8\u306f\u3001[laurel\u3055\u3093](https://twitter.com/laurelcomics) \u3068\u3044\u3046\u65b9\u304c\u304b\u3044\u3066\u3044\u3089\u3063\u3057\u3083\u3044\u307e\u3059\u3002\u3053\u3061\u3089\u3082\u65e5\u3005\u53ef\u611b\u3044Docker\u306e\u30ad\u30e3\u30e9\u30af\u30bf\u30fc\u306e\u9762\u3005\u304c\u7d39\u4ecb\u3055\u308c\u305f\u308a\u3057\u3066\u3044\u307e\u3059\uff01\n\n\u500b\u4eba\u7684\u306b\u3001Kitematic\u306e\u30a4\u30e1\u30fc\u30b8\u30ad\u30e3\u30e9\u30af\u30bf\u30fc\uff08\u30a8\u30a4\uff09\u306e\u53ef\u611b\u3055\u304c\u6c17\u306b\u5165\u3063\u3066\u304a\u308a\u307e\u3059\u3002Kitematic\u3092\u30a4\u30f3\u30b9\u30c8\u30fc\u30eb\u3055\u308c\u305f\u5834\u5408\u306f\u3001about...\u306e\u753b\u9762\u306b\u3053\u3093\u306a\u30ad\u30e3\u30e9\u30af\u30bf\u30fc\u304c\u51fa\u3066\u304d\u307e\u3059\u306e\u3067\u3001\u3053\u3061\u3089\u3082\u5408\u308f\u305b\u3066\u3054\u89a7\u304f\u3060\u3055\u3044\u307e\u305b\u3002\n\n![kitematic-and-docker.png](https://qiita-image-store.s3.amazonaws.com/0/27976/f4a60636-b89b-2ff1-a933-67f33298f656.png \"kitematic-and-docker.png\")\n\n\u305d\u308c\u3067\u306f\u3001\u826f\u3044\u5e74\u672b\u5e74\u59cb\u3092\u304a\u904e\u3054\u3057\u304f\u3060\u3055\u3044\uff01\n\n"}