{"context": " More than 1 year has passed since last update.CoreOS \u4e0a\u3067\u3082 tcpdump \u3067\u30cd\u30c3\u30c8\u30ef\u30fc\u30af\u30c7\u30d0\u30c3\u30b0\u3059\u308b\u8a71\u3067\u3059\u3002\n\ntcpdump \u304f\u3089\u3044\u3042\u308b\u3084\u308d\ncore@core-01 ~ $ tcpdump\n-bash: tcpdump: command not found\n\n\u7121\u3044\u3093\u3067\u3059\u3088\u306d\u30fc\n\nCoreOS toolbox\nhttps://github.com/coreos/toolbox\nCoreOS \u306f OS \u672c\u4f53\u306b\u4f55\u3082\u5165\u3063\u3066\u306a\u3044\uff08\u304b\u3089\u30a2\u30d7\u30ea\u30b1\u30fc\u30b7\u30e7\u30f3\u306f Docker \u30b3\u30f3\u30c6\u30ca\u3068\u3057\u3066\u52d5\u304b\u3059\uff09\u3053\u3068\u3067\u6709\u540d\u3067\u3059\u304c\u3001\u4e0a\u8a18\u306e\u3088\u3046\u306b tcpdump \u3059\u3089\u5165\u3063\u3066\u306a\u3044\u306e\u3067\u7279\u306b\u4f4e\u30ec\u30a4\u30e4\u30fc\u306e\u8abf\u67fb\u3067\u56f0\u308b\u3053\u3068\u304c\u3042\u308a\u307e\u3059\u3002\u305d\u308c\u3092\u88dc\u52a9\u3059\u308b\u305f\u3081\u306b\u3001CoreOS \u304c\u516c\u5f0f\u306b toolbox \u3068\u3044\u3046\u306e\u3092\u63d0\u4f9b\u3057\u3066\u3044\u307e\u3059\u3002\n\u5b9f\u969b\u306b\u4f7f\u3063\u3066\u307f\u307e\u3057\u3087\u3046\u3002\ncore@core-01 ~ $ /usr/bin/toolbox\nlatest: Pulling from fedora\n\n48ecf305d2cf: Pull complete\nded7cd95e059: Pull complete\nfedora:latest: The image you are pulling has been verified. Important: image verification is a tech preview feature and should not be relied on to provide security.\n\nDigest: sha256:49ae2d6d0b51f713a18db1c0da9fb1b5c94e92eb43cd712ba09028161ea22880\nStatus: Downloaded newer image for fedora:latest\ncore-fedora-latest\nSpawning container core-fedora-latest on /var/lib/toolbox/core-fedora-latest.\nPress ^] three times within 1s to kill container.\n[root@core-01 ~]#\n\n\u305d\u3046\u3001toolbox \u306e\u6b63\u4f53\u306f Fedora \u306e\u30b3\u30f3\u30c6\u30ca\u306a\u306e\u3067\u3059\uff01\n\uff08~/.toolboxrc \u3092\u66f8\u3051\u3070\u30d9\u30fc\u30b9 OS \u306f\u5909\u3048\u3089\u308c\u308b\u3088\u3046\u3067\u3059 [\u53c2\u8003]\uff09\n[root@core-01 ~]# tcpdump\n-bash: tcpdump: command not found\n\n\u3057\u304b\u3057 tcpdump \u306f\u3053\u3053\u306b\u3082\u5165\u3063\u3066\u307e\u305b\u3093\u3002\u5165\u308c\u307e\u3057\u3087\u3046\u3002Fedora \u306a\u306e\u3067 yum \u3067\u5165\u308a\u307e\u3059\u3002\n[root@core-01 ~]# yum install -y tcpdump\nYum command has been deprecated, redirecting to '/usr/bin/dnf install tcpdump'.\nSee 'man dnf' and 'man yum2dnf' for more information.\nTo transfer transaction metadata from yum to DNF, run:\n'dnf install python-dnf-plugins-extras-migrate && dnf-2 migrate'\n\n(snip)\n\nInstalled:\n  libpcap.x86_64 14:1.7.3-1.fc22      tcpdump.x86_64 14:4.7.4-2.fc22\n\nComplete!\n\n\u78ba\u8a8d\n[root@core-01 ~]# tcpdump -s0 -A port 80\ntcpdump: verbose output suppressed, use -v or -vv for full protocol decode\nlistening on eth0, link-type EN10MB (Ethernet), capture size 262144 bytes\n07:05:16.294511 IP core-01.36947 > 160.16.73.241.http: Flags [S], seq 3568280055, win 29200, options [mss 1460,sackOK,TS val 197800 ecr 0,nop,wscale 7], length 0\nE..<._@.@..L\n.....I..S.P..........r..>.........\n............\n07:05:16.774151 IP 160.16.73.241.http > core-01.36947: Flags [S.], seq 64320001, ack 3568280056, win 65535, options [mss 1460], length 0\nE..,....@.....I.\n\nCoreOS \u3067\u3082 tcpdump \u3067\u304d\u307e\u3057\u305f\u3002\u7d42\u308f\u3063\u305f\u3089 exit \u3067\u30b3\u30f3\u30c6\u30ca\u304b\u3089\u629c\u3051\u307e\u3059\u3002\n\u307e\u305f tcpdump \u3057\u305f\u304f\u306a\u3063\u305f\u3089 /usr/bin/toolbox \u3059\u308c\u3070\u30b3\u30f3\u30c6\u30ca\u304c\u7acb\u3061\u4e0a\u304c\u308a\u4f5c\u696d\u3067\u304d\u307e\u3059\u3002\n\n\u304a\u308f\u308a\u306b\nCoreOS toolbox \u3092\u4f7f\u3063\u3066 CoreOS \u4e0a\u3067 tcpdump \u3059\u308b\u65b9\u6cd5\u3092\u7d39\u4ecb\u3057\u307e\u3057\u305f\u3002\n\nREF\n\ncoreos/toolbox\nInstall Debugging Tools\n\ndocker - CoreOS \u3067\u30b7\u30b9\u30c6\u30e0\u30e1\u30c8\u30ea\u30af\u30b9\u3092\u53ce\u96c6\u3057\u3001\u30b0\u30e9\u30d5\u5316\u3059\u308b - Qiita\n\ntoolbox \u306e\u6b63\u4f53\u306b\u3064\u3044\u3066\u306f\u3053\u3061\u3089\u306e\u8a18\u4e8b\u304c\u8a73\u3057\u3044\u3067\u3059\u3002\n\n\n\nCoreOS \u4e0a\u3067\u3082 tcpdump \u3067\u30cd\u30c3\u30c8\u30ef\u30fc\u30af\u30c7\u30d0\u30c3\u30b0\u3059\u308b\u8a71\u3067\u3059\u3002\n\n## tcpdump \u304f\u3089\u3044\u3042\u308b\u3084\u308d\n\n```bash\ncore@core-01 ~ $ tcpdump\n-bash: tcpdump: command not found\n```\n\n\u7121\u3044\u3093\u3067\u3059\u3088\u306d\u30fc\n\n## CoreOS toolbox\n\nhttps://github.com/coreos/toolbox\n\nCoreOS \u306f OS \u672c\u4f53\u306b\u4f55\u3082\u5165\u3063\u3066\u306a\u3044\uff08\u304b\u3089\u30a2\u30d7\u30ea\u30b1\u30fc\u30b7\u30e7\u30f3\u306f Docker \u30b3\u30f3\u30c6\u30ca\u3068\u3057\u3066\u52d5\u304b\u3059\uff09\u3053\u3068\u3067\u6709\u540d\u3067\u3059\u304c\u3001\u4e0a\u8a18\u306e\u3088\u3046\u306b tcpdump \u3059\u3089\u5165\u3063\u3066\u306a\u3044\u306e\u3067\u7279\u306b\u4f4e\u30ec\u30a4\u30e4\u30fc\u306e\u8abf\u67fb\u3067\u56f0\u308b\u3053\u3068\u304c\u3042\u308a\u307e\u3059\u3002\u305d\u308c\u3092\u88dc\u52a9\u3059\u308b\u305f\u3081\u306b\u3001CoreOS \u304c\u516c\u5f0f\u306b toolbox \u3068\u3044\u3046\u306e\u3092\u63d0\u4f9b\u3057\u3066\u3044\u307e\u3059\u3002\n\n\u5b9f\u969b\u306b\u4f7f\u3063\u3066\u307f\u307e\u3057\u3087\u3046\u3002\n\n```bash\ncore@core-01 ~ $ /usr/bin/toolbox\nlatest: Pulling from fedora\n\n48ecf305d2cf: Pull complete\nded7cd95e059: Pull complete\nfedora:latest: The image you are pulling has been verified. Important: image verification is a tech preview feature and should not be relied on to provide security.\n\nDigest: sha256:49ae2d6d0b51f713a18db1c0da9fb1b5c94e92eb43cd712ba09028161ea22880\nStatus: Downloaded newer image for fedora:latest\ncore-fedora-latest\nSpawning container core-fedora-latest on /var/lib/toolbox/core-fedora-latest.\nPress ^] three times within 1s to kill container.\n[root@core-01 ~]#\n```\n\n\u305d\u3046\u3001toolbox \u306e\u6b63\u4f53\u306f Fedora \u306e\u30b3\u30f3\u30c6\u30ca\u306a\u306e\u3067\u3059\uff01\n\uff08`~/.toolboxrc` \u3092\u66f8\u3051\u3070\u30d9\u30fc\u30b9 OS \u306f\u5909\u3048\u3089\u308c\u308b\u3088\u3046\u3067\u3059 [[\u53c2\u8003](https://github.com/coreos/toolbox#use-a-custom-image)]\uff09\n\n```\n[root@core-01 ~]# tcpdump\n-bash: tcpdump: command not found\n```\n\n\u3057\u304b\u3057 tcpdump \u306f\u3053\u3053\u306b\u3082\u5165\u3063\u3066\u307e\u305b\u3093\u3002\u5165\u308c\u307e\u3057\u3087\u3046\u3002Fedora \u306a\u306e\u3067 yum \u3067\u5165\u308a\u307e\u3059\u3002\n\n```\n[root@core-01 ~]# yum install -y tcpdump\nYum command has been deprecated, redirecting to '/usr/bin/dnf install tcpdump'.\nSee 'man dnf' and 'man yum2dnf' for more information.\nTo transfer transaction metadata from yum to DNF, run:\n'dnf install python-dnf-plugins-extras-migrate && dnf-2 migrate'\n\n(snip)\n\nInstalled:\n  libpcap.x86_64 14:1.7.3-1.fc22      tcpdump.x86_64 14:4.7.4-2.fc22\n\nComplete!\n```\n\n\u78ba\u8a8d\n\n```\n[root@core-01 ~]# tcpdump -s0 -A port 80\ntcpdump: verbose output suppressed, use -v or -vv for full protocol decode\nlistening on eth0, link-type EN10MB (Ethernet), capture size 262144 bytes\n07:05:16.294511 IP core-01.36947 > 160.16.73.241.http: Flags [S], seq 3568280055, win 29200, options [mss 1460,sackOK,TS val 197800 ecr 0,nop,wscale 7], length 0\nE..<._@.@..L\n.....I..S.P..........r..>.........\n............\n07:05:16.774151 IP 160.16.73.241.http > core-01.36947: Flags [S.], seq 64320001, ack 3568280056, win 65535, options [mss 1460], length 0\nE..,....@.....I.\n```\n\nCoreOS \u3067\u3082 tcpdump \u3067\u304d\u307e\u3057\u305f\u3002\u7d42\u308f\u3063\u305f\u3089 `exit` \u3067\u30b3\u30f3\u30c6\u30ca\u304b\u3089\u629c\u3051\u307e\u3059\u3002\n\u307e\u305f tcpdump \u3057\u305f\u304f\u306a\u3063\u305f\u3089 `/usr/bin/toolbox` \u3059\u308c\u3070\u30b3\u30f3\u30c6\u30ca\u304c\u7acb\u3061\u4e0a\u304c\u308a\u4f5c\u696d\u3067\u304d\u307e\u3059\u3002\n\n## \u304a\u308f\u308a\u306b\n\nCoreOS toolbox \u3092\u4f7f\u3063\u3066 CoreOS \u4e0a\u3067 tcpdump \u3059\u308b\u65b9\u6cd5\u3092\u7d39\u4ecb\u3057\u307e\u3057\u305f\u3002\n\n## REF\n- [coreos/toolbox](https://github.com/coreos/toolbox#use-a-custom-image)\n- [Install Debugging Tools](https://coreos.com/os/docs/latest/install-debugging-tools.html)\n- [docker - CoreOS \u3067\u30b7\u30b9\u30c6\u30e0\u30e1\u30c8\u30ea\u30af\u30b9\u3092\u53ce\u96c6\u3057\u3001\u30b0\u30e9\u30d5\u5316\u3059\u308b - Qiita](http://qiita.com/mopemope/items/34c07ae37592ae6407cf#3-1)\n  - toolbox \u306e\u6b63\u4f53\u306b\u3064\u3044\u3066\u306f\u3053\u3061\u3089\u306e\u8a18\u4e8b\u304c\u8a73\u3057\u3044\u3067\u3059\u3002\n", "tags": ["CoreOS"]}