{"tags": ["\u3055\u304f\u3089\u306e\u30af\u30e9\u30a6\u30c9", "tcpdump"], "context": "\n\n\u524d\u63d0\u7b49\n\u78ba\u8a8d\u3057\u305f\u65e5\uff1a2016\u5e743\u670816\u65e5\n\u5b9f\u884c\u3057\u305f\u30b3\u30de\u30f3\u30c9\uff1asudo tcpdump -n -i eth0 src net 61.211.224.144 mask 255.255.255.240\n\n\u30c0\u30f3\u30d7\u3055\u308c\u305f\u30d1\u30b1\u30c3\u30c8\u60c5\u5831\uff08IP\u30a2\u30c9\u30ec\u30b9\u306e\u4e00\u90e8\u3092\u30de\u30b9\u30af\u3057\u3066\u3044\u307e\u3059\uff09\n13:47:07.022931 IP 61.211.224.147 > 49.212.***.***: ICMP echo request, id 14329, seq 0, length 76\n13:47:07.031741 IP 61.211.224.147 > 49.212.***.***: ICMP echo request, id 14329, seq 1, length 76\n13:47:07.040499 IP 61.211.224.147 > 49.212.***.***: ICMP echo request, id 14329, seq 2, length 76\n13:47:07.049463 IP 61.211.224.147 > 49.212.***.***: ICMP echo request, id 14329, seq 3, length 76\n13:47:07.058104 IP 61.211.224.147 > 49.212.***.***: ICMP echo request, id 14329, seq 4, length 76\n13:47:26.195860 IP 61.211.224.147 > 49.212.***.***: ICMP echo request, id 29917, seq 0, length 76\n13:47:26.204890 IP 61.211.224.147 > 49.212.***.***: ICMP echo request, id 29917, seq 1, length 76\n13:47:26.213737 IP 61.211.224.147 > 49.212.***.***: ICMP echo request, id 29917, seq 2, length 76\n13:47:26.222590 IP 61.211.224.147 > 49.212.***.***: ICMP echo request, id 29917, seq 3, length 76\n13:47:26.231509 IP 61.211.224.147 > 49.212.***.***: ICMP echo request, id 29917, seq 4, length 76\n13:49:07.018277 IP 61.211.224.147 > 49.212.***.***: ICMP echo request, id 15570, seq 0, length 76\n13:49:07.027230 IP 61.211.224.147 > 49.212.***.***: ICMP echo request, id 15570, seq 1, length 76\n13:49:07.036316 IP 61.211.224.147 > 49.212.***.***: ICMP echo request, id 15570, seq 2, length 76\n13:49:07.045092 IP 61.211.224.147 > 49.212.***.***: ICMP echo request, id 15570, seq 3, length 76\n13:49:07.054170 IP 61.211.224.147 > 49.212.***.***: ICMP echo request, id 15570, seq 4, length 76\n13:49:26.217863 IP 61.211.224.147 > 49.212.***.***: ICMP echo request, id 31165, seq 0, length 76\n13:49:26.226838 IP 61.211.224.147 > 49.212.***.***: ICMP echo request, id 31165, seq 1, length 76\n13:49:26.235684 IP 61.211.224.147 > 49.212.***.***: ICMP echo request, id 31165, seq 2, length 76\n13:49:26.244470 IP 61.211.224.147 > 49.212.***.***: ICMP echo request, id 31165, seq 3, length 76\n13:49:26.253281 IP 61.211.224.147 > 49.212.***.***: ICMP echo request, id 31165, seq 4, length 76\n13:51:07.040728 IP 61.211.224.147 > 49.212.***.***: ICMP echo request, id 16840, seq 0, length 76\n13:51:07.049495 IP 61.211.224.147 > 49.212.***.***: ICMP echo request, id 16840, seq 1, length 76\n13:51:07.058136 IP 61.211.224.147 > 49.212.***.***: ICMP echo request, id 16840, seq 2, length 76\n13:51:07.066804 IP 61.211.224.147 > 49.212.***.***: ICMP echo request, id 16840, seq 3, length 76\n13:51:07.075492 IP 61.211.224.147 > 49.212.***.***: ICMP echo request, id 16840, seq 4, length 76\n13:51:26.239457 IP 61.211.224.147 > 49.212.***.***: ICMP echo request, id 32414, seq 0, length 76\n13:51:26.250630 IP 61.211.224.147 > 49.212.***.***: ICMP echo request, id 32414, seq 1, length 76\n13:51:26.259493 IP 61.211.224.147 > 49.212.***.***: ICMP echo request, id 32414, seq 2, length 76\n13:51:26.268414 IP 61.211.224.147 > 49.212.***.***: ICMP echo request, id 32414, seq 3, length 76\n13:51:26.277222 IP 61.211.224.147 > 49.212.***.***: ICMP echo request, id 32414, seq 4, length 76\n\n\n\n\u7d50\u679c\n\u6307\u5b9a\u3057\u305f\u76e3\u8996\u9593\u9694\uff08\u4eca\u56de\u306e\u30b1\u30fc\u30b9\u3067\u306f2\u5206\uff09\u3054\u3068\u306b\u300110\u500b\u306e\u30d1\u30b1\u30c3\u30c8\u3092\u53d7\u4fe1\u3057\u3066\u3044\u305f\u3002\n\n\u4e3b\u306b\u53c2\u8003\u306b\u3055\u305b\u3066\u3044\u305f\u3060\u3044\u305f\u60c5\u5831\uff08\u3042\u308a\u304c\u3068\u3046\u3054\u3056\u3044\u307e\u3059\uff09\n\ntcpdump \u306e\u4fbf\u5229\u306a\u30aa\u30d7\u30b7\u30e7\u30f3 - Qiita\n\u7ba1\u7406\u8005\u5fc5\u898b\uff01 \u30cd\u30c3\u30c8\u30ef\u30fc\u30af\u30fb\u30b3\u30de\u30f3\u30c9\u96c6 - tcpdump\u30b3\u30de\u30f3\u30c9\uff1aITpro\n\u30b7\u30f3\u30d7\u30eb\u76e3\u8996 | \u3055\u304f\u3089\u306e\u30af\u30e9\u30a6\u30c9\u30cb\u30e5\u30fc\u30b9\nSubnet Mask Cheat Sheet\n\n## \u524d\u63d0\u7b49\n\u78ba\u8a8d\u3057\u305f\u65e5\uff1a2016\u5e743\u670816\u65e5\n\u5b9f\u884c\u3057\u305f\u30b3\u30de\u30f3\u30c9\uff1a```sudo tcpdump -n -i eth0 src net 61.211.224.144 mask 255.255.255.240```\n\n## \u30c0\u30f3\u30d7\u3055\u308c\u305f\u30d1\u30b1\u30c3\u30c8\u60c5\u5831\uff08IP\u30a2\u30c9\u30ec\u30b9\u306e\u4e00\u90e8\u3092\u30de\u30b9\u30af\u3057\u3066\u3044\u307e\u3059\uff09\n```\n13:47:07.022931 IP 61.211.224.147 > 49.212.***.***: ICMP echo request, id 14329, seq 0, length 76\n13:47:07.031741 IP 61.211.224.147 > 49.212.***.***: ICMP echo request, id 14329, seq 1, length 76\n13:47:07.040499 IP 61.211.224.147 > 49.212.***.***: ICMP echo request, id 14329, seq 2, length 76\n13:47:07.049463 IP 61.211.224.147 > 49.212.***.***: ICMP echo request, id 14329, seq 3, length 76\n13:47:07.058104 IP 61.211.224.147 > 49.212.***.***: ICMP echo request, id 14329, seq 4, length 76\n13:47:26.195860 IP 61.211.224.147 > 49.212.***.***: ICMP echo request, id 29917, seq 0, length 76\n13:47:26.204890 IP 61.211.224.147 > 49.212.***.***: ICMP echo request, id 29917, seq 1, length 76\n13:47:26.213737 IP 61.211.224.147 > 49.212.***.***: ICMP echo request, id 29917, seq 2, length 76\n13:47:26.222590 IP 61.211.224.147 > 49.212.***.***: ICMP echo request, id 29917, seq 3, length 76\n13:47:26.231509 IP 61.211.224.147 > 49.212.***.***: ICMP echo request, id 29917, seq 4, length 76\n13:49:07.018277 IP 61.211.224.147 > 49.212.***.***: ICMP echo request, id 15570, seq 0, length 76\n13:49:07.027230 IP 61.211.224.147 > 49.212.***.***: ICMP echo request, id 15570, seq 1, length 76\n13:49:07.036316 IP 61.211.224.147 > 49.212.***.***: ICMP echo request, id 15570, seq 2, length 76\n13:49:07.045092 IP 61.211.224.147 > 49.212.***.***: ICMP echo request, id 15570, seq 3, length 76\n13:49:07.054170 IP 61.211.224.147 > 49.212.***.***: ICMP echo request, id 15570, seq 4, length 76\n13:49:26.217863 IP 61.211.224.147 > 49.212.***.***: ICMP echo request, id 31165, seq 0, length 76\n13:49:26.226838 IP 61.211.224.147 > 49.212.***.***: ICMP echo request, id 31165, seq 1, length 76\n13:49:26.235684 IP 61.211.224.147 > 49.212.***.***: ICMP echo request, id 31165, seq 2, length 76\n13:49:26.244470 IP 61.211.224.147 > 49.212.***.***: ICMP echo request, id 31165, seq 3, length 76\n13:49:26.253281 IP 61.211.224.147 > 49.212.***.***: ICMP echo request, id 31165, seq 4, length 76\n13:51:07.040728 IP 61.211.224.147 > 49.212.***.***: ICMP echo request, id 16840, seq 0, length 76\n13:51:07.049495 IP 61.211.224.147 > 49.212.***.***: ICMP echo request, id 16840, seq 1, length 76\n13:51:07.058136 IP 61.211.224.147 > 49.212.***.***: ICMP echo request, id 16840, seq 2, length 76\n13:51:07.066804 IP 61.211.224.147 > 49.212.***.***: ICMP echo request, id 16840, seq 3, length 76\n13:51:07.075492 IP 61.211.224.147 > 49.212.***.***: ICMP echo request, id 16840, seq 4, length 76\n13:51:26.239457 IP 61.211.224.147 > 49.212.***.***: ICMP echo request, id 32414, seq 0, length 76\n13:51:26.250630 IP 61.211.224.147 > 49.212.***.***: ICMP echo request, id 32414, seq 1, length 76\n13:51:26.259493 IP 61.211.224.147 > 49.212.***.***: ICMP echo request, id 32414, seq 2, length 76\n13:51:26.268414 IP 61.211.224.147 > 49.212.***.***: ICMP echo request, id 32414, seq 3, length 76\n13:51:26.277222 IP 61.211.224.147 > 49.212.***.***: ICMP echo request, id 32414, seq 4, length 76\n\n```\n## \u7d50\u679c\n\u6307\u5b9a\u3057\u305f\u76e3\u8996\u9593\u9694\uff08\u4eca\u56de\u306e\u30b1\u30fc\u30b9\u3067\u306f2\u5206\uff09\u3054\u3068\u306b\u300110\u500b\u306e\u30d1\u30b1\u30c3\u30c8\u3092\u53d7\u4fe1\u3057\u3066\u3044\u305f\u3002\n\n## \u4e3b\u306b\u53c2\u8003\u306b\u3055\u305b\u3066\u3044\u305f\u3060\u3044\u305f\u60c5\u5831\uff08\u3042\u308a\u304c\u3068\u3046\u3054\u3056\u3044\u307e\u3059\uff09\n- [tcpdump \u306e\u4fbf\u5229\u306a\u30aa\u30d7\u30b7\u30e7\u30f3 - Qiita](http://qiita.com/tossh/items/4cd33693965ef231bd2a)\n- [\u7ba1\u7406\u8005\u5fc5\u898b\uff01 \u30cd\u30c3\u30c8\u30ef\u30fc\u30af\u30fb\u30b3\u30de\u30f3\u30c9\u96c6 - tcpdump\u30b3\u30de\u30f3\u30c9\uff1aITpro](http://itpro.nikkeibp.co.jp/article/COLUMN/20070403/267311/)\n- [\u30b7\u30f3\u30d7\u30eb\u76e3\u8996 | \u3055\u304f\u3089\u306e\u30af\u30e9\u30a6\u30c9\u30cb\u30e5\u30fc\u30b9](http://cloud-news.sakura.ad.jp/simplemonitor/)\n- [Subnet Mask Cheat Sheet](https://www.aelius.com/njh/subnet_sheet.html)\n"}