{"context": " More than 1 year has passed since last update.\u30b9\u30c8\u30fc\u30ea\u30fc\u4ed5\u7acb\u3066\u3067\u66f8\u3044\u3066\u304a\u308a\u307e\u3059\u306e\u3067\u3001\u5bfe\u5fdc\u65b9\u6cd5\u306e\u307f\u3092\u77e5\u308a\u305f\u3044\u65b9\u306f\u30da\u30fc\u30b8\u6700\u4e0b\u90e8\u300c\u5bfe\u5fdc\u65b9\u6cd5\u300d\u3001\u300c\u307e\u3068\u3081\u300d\u3092\u53c2\u7167\u304f\u3060\u3055\u3044\u3002\n\n408\u304capache\u306e\u30ed\u30b0\u306b\u3081\u3063\u3061\u3083\u51fa\u3066\u308b\u3002\u3002\u3002\n(client) - ELB - EC2\n\n\u306a\u69cb\u6210\u3067\u52d5\u304b\u3057\u3066\u3044\u305f\u3093\u3067\u3059\u3051\u3069\u3001\u4e0b\u8a18\u306e\u3088\u3046\u306a\u30ed\u30b0\u304c50\u79d2\u7a0b\u304a\u304d\u306b\u51fa\u3066\u3044\u307e\u3057\u305f\n\naccess_log\nELB1 - - [31/Jul/2014:05:44:20 +0000] \"-\" 408 - \"-\" \"-\"\nELB2 - - [31/Jul/2014:05:44:21 +0000] \"-\" 408 - \"-\" \"-\"\nELB1 - - [31/Jul/2014:05:45:11 +0000] \"-\" 408 - \"-\" \"-\"\nELB2 - - [31/Jul/2014:05:45:13 +0000] \"-\" 408 - \"-\" \"-\"\nELB1 - - [31/Jul/2014:05:46:03 +0000] \"-\" 408 - \"-\" \"-\"\nELB2 - - [31/Jul/2014:05:46:05 +0000] \"-\" 408 - \"-\" \"-\"\n\n\n\nELB1, ELB2\u306f\u305d\u308c\u305e\u308cELB\u306eIP\u30a2\u30c9\u30ec\u30b9\n\n408...request timeout\u304b\u30fb\u30fb\u30fb\uff08\uff1d\"\uff1d\n\n\u8abf\u67fb\uff1a\u30b0\u30b0\u308b\n\u6700\u521d\u306f\u5b9a\u671f\u7684\u306b\u51fa\u3066\u3044\u308b\u306e\u3067\u300eELB\u306eHealth Check\u306a\u306e\u304b\u306a\u301c\uff1f\u300f\u3068\u601d\u3044\u8abf\u3079\u3066\u3044\u307e\u3057\u305f\u3002\n\u3059\u308b\u3068\u4ee5\u4e0b\u306e\u3088\u3046\u306a\u8a18\u4e8b\u9054\u306b\u51fa\u4f1a\u3044\u307e\u3057\u305f\u3002\n\ntumblr\u306e\u8a18\u4e8b\n\n\nELB\u304capache\u306b\u5bfe\u3057\u3066\u5f35\u308a\u3063\u3071\u306a\u3057\u306b\u3057\u3088\u3046\u3068\u3057\u3066\u308b\u4e88\u5099\u306e\u30b3\u30cd\u30af\u30b7\u30e7\u30f3\u304c\u3042\u308b\u3002\napache\u306fmod_requesttimeout\u3067\u305d\u308c\u3092\u5207\u65ad\u3059\u308b\u3002\napache\u306e\u30ed\u30b0\u306b408\u304c\u8a18\u9332\u3055\u308c\u308b\u3002\nELB\u306f\u307e\u305f\u63a5\u7d9a\u3057\u3066\u304f\u308b\u3002\u4ee5\u4e0b\u7e70\u308a\u8fd4\u3057\u3002\n\u305d\u306e\u7d50\u679c\u3001TIME_WAIT\u306a\u30b3\u30cd\u30af\u30b7\u30e7\u30f3\u304c\u5e38\u306b\u6e9c\u307e\u3063\u3066\u308b\u3002\n\n\u5b9f\u306f\u30b0\u30b0\u308b\u524d\u306b\u30d1\u30b1\u30c3\u30c8\u3092\u8efd\u304f\u773a\u3081\u3066\u3044\u305f\u306e\u3067\u3059\u304c\u3001\u78ba\u304b\u306b\u305d\u3093\u306a\u98a8\u306b\u898b\u3048\u3066\u3044\u307e\u3057\u305f\u3002\n\u305d\u308c\u306b\u5bfe\u3059\u308b\u3001\u8a2d\u5b9a\u65b9\u6cd5\u304camazon\u306eforum\u306b\u3042\u308a\u307e\u3057\u305f\u3002\n\nELB causing HTTP 408 errors\n\nRequestReadTimeout header=0 body=0\n\n\u5143\u3005mod_reqtimeout\u306fDoS\u5bfe\u7b56\u3068\u3057\u3066\u5c0e\u5165\u3055\u308c\u305f\u3082\u306e\u3067\u3001\u4e0a\u8a18\u8a2d\u5b9a\u3092\u3059\u308b\u3068disable\u306b\u306a\u3063\u3066\u3057\u307e\u3044\u307e\u3059\u3002\n\namazon\u3055\u3093\u306a\u3089DoS\u5bfe\u7b56\u3057\u3066\u3044\u308b\u306e\u3067\u306f\uff1f\namazon\u3055\u3093\u306a\u3089\u3001DoS\u5bfe\u7b56\u3092\u3057\u3066\u304f\u308c\u3066\u3044\u308b\u3088\u3046\u306a\u6c17\u3082\u3057\u305f\u306e\u3067\u3059\u304c\u3001\u3069\u3053\u306e\u30ec\u30a4\u30e4\u30fc\u3067\u3001\u3069\u3046\u3044\u3046\u3082\u306e\u3092\u3057\u3066\u304f\u308c\u3066\u3044\u308b\u306e\u304b\u306f\u5206\u304b\u3089\u306a\u3044\u69d8\u5b50\u3002\n\nDoS\u653b\u6483\u306e\u9632\u5fa1\u306b\u3064\u3044\u3066\n\n\n\u8aa0\u306b\u52dd\u624b\u306a\u304c\u3089\u516c\u958b\u60c5\u5831\u4ee5\u4e0a\u306e\u3082\u306e\u306f\u304a\u7b54\u3048\u3044\u305f\u3057\u304b\u306d\u307e\u3059\u3002\n\u3054\u7406\u89e3\u9802\u3051\u307e\u3059\u3088\u3046\u304a\u9858\u3044\u3044\u305f\u3057\u307e\u3059\u3002\n\n\nAmazon Web Services:\u30bb\u30ad\u30e5\u30ea\u30c6\u30a3\u30d7\u30ed\u30bb\u30b9\u306e\u6982\u8981 \u30bb\u30ad\u30e5\u30ea\u30c6\u30a3\u30d7\u30ed\u30bb\u30b9\u306e\u6982\u8981\n\n\nAmazon \u3092\u4e16\u754c\u6700\u5927\u306e\u30aa\u30f3\u30e9\u30a4\u30f3\u5c0f\n\u58f2\u696d\u8005\u3068\u3057\u305f\u30a8\u30f3\u30b8\u30cb\u30a2\u30ea\u30f3\u30b0\u6280\u8853\u3068\u3001\u540c\u3058\u30a8\u30f3\u30b8\u30cb\u30a2\u30ea\u30f3\u30b0\u6280\u8853\u3092\u5229\u7528\u3059\u308b\u3053\u3068\u304c\u51fa\u6765\u307e\u3059\u3002\u7279\u8a31\u53d6\u5f97\u6e08\u307f\u306e\u3001\nDDoS \u7de9\u548c\u6280\u8853\u3082\u9069\u7528\u3055\u308c\u3066\u3044\u307e\u3059\u3002\n\n\u3046\u30fc\u3093\u30fb\u30fb\u30fb\u30c9\u30a6\u30b7\u30e8\u30a6\uff08\uff1d\u201d\uff1d\n\nforum\u306e\u5bfe\u5fdc\u65b9\u6cd5\u3078\u306e\u611f\u60f3\n\u5148\u7a0b\u306eforum\u306b\u51fa\u3066\u3044\u305f\u300cheader=0 body=0\u300d\u3068\u3044\u3046\u8a2d\u5b9a\u3092\u3057\u3066\u3001mod_reqtimeout\u3092disable\u306b\u3059\u308b\u3050\u3089\u3044\u306a\u3089\u3001\u305d\u3082\u305d\u3082load_module\u3057\u306a\u304f\u3066\u826f\u3044\u3058\u3083\u306a\u3044\u304b\uff1f\n\n00-base.conf\nLoadModule reqtimeout_module modules/mod_reqtimeout.so\n\n\n\u305d\u308c\u306bDoS\u306e\u7de9\u548cmodule\u3092\u5916\u3059\u306e\u306f\u3001\u6700\u5f8c\u306e\u624b\u6bb5\u3067\u826f\u3044\u3088\u3046\u306a\u6c17\u3082\u3057\u307e\u3059\u3002\n\n\u8abf\u67fb\uff1a\u672c\u5f53\u306bHealth Check\u304c\u72af\u4eba\u306a\u306e\uff1f\n\u3069\u3046\u3057\u3088\u3046\u304b\u3068\u611a\u75f4\u3092\u6f0f\u3089\u3057\u3066\u3044\u305f\u3089\u3001\u300cHealth Check\u304c\u72af\u4eba\u306a\u3089\u305d\u306e\u30dd\u30fc\u30c8\u3060\u3051\u5c02\u7528\u306e\u3092\u4f5c\u308c\u3070\u826f\u3044\u3058\u3083\u306a\u3044\u300d\u3068\u3044\u3046\u30a2\u30c9\u30d0\u30a4\u30b9\u3092\u9802\u304d\u307e\u3057\u305f\u3002\n\u305d\u3053\u3067\u3001\u4ee5\u4e0b\u306e\u3088\u3046\u306a\u8a2d\u5b9a\u3092\u3057\u3066\u3001Health Check\u3067\u4f7f\u3046\u30dd\u30fc\u30c8\u3092\u30de\u30cd\u30fc\u30b8\u30e1\u30f3\u30c8\u30b3\u30f3\u30bd\u30fc\u30eb\u304b\u308930080\u306b\u5909\u66f4\u3057\u3066\u307f\u307e\u3057\u305f\u304c\u3001\u3084\u306f\u308a\u540c\u3058408\u304c\u51fa\u7d9a\u3051\u307e\u3059\u3002\n\ntest.conf\nLISTEN 30080\n<VirtualHost *:30080>\nKeepAlive On\nKeepAliveTimeout 120\nRequestReadTimeout header=0 body=0\n</VirtualHost>\n\n\n\u3053\u3053\u3067\u300e\u5b9f\u306f\u72af\u4eba\u5225\u4eba\u3058\u3083\u306d\uff1f\u300f\u3068\u3044\u3046\u601d\u3044\u304c\u51fa\u3066\u304d\u307e\u3059\u3002\n\u8a66\u3057\u306b\u3001AWS\u306e\u30de\u30cd\u30fc\u30b8\u30e1\u30f3\u30c8\u30b3\u30f3\u30bd\u30fc\u30eb\u304b\u3089\u3001Health Check\u306eInterval\u309230 seconds\u304b\u308960seconds\u306b\u3057\u307e\u3057\u305f\u304c\u3001\u306a\u305c\u304b\u7d0450\u79d2\u5468\u671f\u3067408\u304c\u51fa\u7d9a\u3051\u307e\u3059\u3002\n\u300eHealth Check\u3088\u3002\u7591\u3063\u3066\u60aa\u304b\u3063\u305f\u3002\u300f\n\u305d\u3046\u3044\u3048\u3070\u3001ELB\u306f\u30af\u30e9\u30a4\u30a2\u30f3\u30c8\u304b\u3089\u306e\u30a2\u30af\u30bb\u30b9\u306e\u9ad8\u901f\u5316\u3092\u3059\u308b\u305f\u3081\u3001\u30d0\u30c3\u30af\u30a8\u30f3\u30c9\u306eEC2\u3068\u30b3\u30cd\u30af\u30b7\u30e7\u30f3\u3092\u5f35\u308a\u3063\u3071\u306a\u3057\u306b\u3057\u307e\u3059\u3002\n\u30a2\u30ca\u30bf\u304c\u72af\u4eba\u304b\uff1f\uff01\n\u307e\u305f\u3001\u5f8c\u8ff0\u3057\u307e\u3059\u304c\u3001\u30d1\u30b1\u30c3\u30c8\u3092\u773a\u3081\u308b\u9650\u308a\u3001Health Check\u306f\u3061\u3083\u3093\u3068\u30b3\u30cd\u30af\u30b7\u30e7\u30f3\u3092\u958b\u653e\u3057\u3066\u3044\u307e\u3059\u3002\n\n\u30d1\u30b1\u30c3\u30c8\u3092\u773a\u3081\u308b\n\u6700\u521d\u306f\u4f55\u304c\u8d77\u304d\u3066\u3044\u305f\u306e\u304b\u5206\u304b\u3089\u306a\u304b\u3063\u305f\u306e\u3067\u3001\u5f8c\u3067wireshark\u3067\u3058\u3063\u304f\u308a\u773a\u3081\u3088\u3046\u3068\u4ee5\u4e0b\u306e\u30aa\u30d7\u30b7\u30e7\u30f3\u3067\u53ce\u96c6\u3057\u3066\u3044\u307e\u3057\u305f\u3002\nsudo tcpdump -i eth0 -s0 -n -v -w health_check.pcap\n\n\u7d50\u679c\u7684\u306b\u306f\u3001\u30b3\u30f3\u30bd\u30fc\u30eb\u4e0a\u3067\u773a\u3081\u308b\u7a0b\u5ea6\u3067\u826f\u304b\u3063\u305f\u3088\u3046\u306a\u306e\u3067\u3001\u4ee5\u4e0b\u3067\u306f\u305d\u306e\u30ed\u30b0\u3092\u8cbc\u3063\u3066\u304a\u304d\u307e\u3059\u3002\n\nhealth Check\n\u5206\u304b\u308a\u3084\u3059\u3044\u3088\u3046\u306b\u300130080\u30dd\u30fc\u30c8\u306b\u6765\u3066\u3082\u3089\u3046\u8a2d\u5b9a\u306b\u3057\u3066\u3044\u307e\u3059\u3002\n\uff08\u5b9f\u969b\u306b\u306f80\u306b\u6765\u3066\u3044\u307e\u3059\u304c\u3001apache\u3078\u306e\u901a\u4fe1\u3068\u6df7\u3056\u3063\u3066\u898b\u8f9b\u3044\u306e\u3067\uff09\nsudo tcpdump -i eth0 -n port 30080 and host ELB1\n\n\nELB1\u306fIP\u30a2\u30c9\u30ec\u30b9\n\n\ncapture\n07:10:17.398796 IP ELB1.7509 > EC2.30080: Flags [S], seq 1954705710, win 14600, options [mss 1460,sackOK,TS val 180580918 ecr 0,nop,wscale 8], length 0\n07:10:17.398814 IP EC2.30080 > ELB1.7509: Flags [S.], seq 1118619224, ack 1954705711, win 14480, options [mss 1460,sackOK,TS val 193444167 ecr 180580918,nop,wscale 7], length 0\n07:10:17.401008 IP ELB1.7509 > EC2.30080: Flags [.], ack 1, win 58, options [nop,nop,TS val 180580919 ecr 193444167], length 0\n07:10:17.403409 IP ELB1.7509 > EC2.30080: Flags [F.], seq 1, ack 1, win 58, options [nop,nop,TS val 180580919 ecr 193444167], length 0\n07:10:17.403701 IP EC2.30080 > ELB1.7509: Flags [F.], seq 1, ack 2, win 114, options [nop,nop,TS val 193444168 ecr 180580919], length 0\n07:10:17.405859 IP ELB1.7509 > EC2.30080: Flags [.], ack 2, win 58, options [nop,nop,TS val 180580920 ecr 193444168], length 0\n\n\n\u3057\u3070\u3089\u304f\u773a\u3081\u3066\u3044\u307e\u3057\u305f\u304c\u3001\u304d\u3063\u3061\u308a\u3068\u30b3\u30cd\u30af\u30b7\u30e7\u30f3\u306e\u958b\u653e\u3092\u3057\u3066\u3044\u307e\u3059\u3057\u3001seq\u3084ack\u306b\u3082\u4e0d\u81ea\u7136\u306a\u70b9\u306f\u3042\u308a\u307e\u305b\u3093\u3067\u3057\u305f\u3002\n\nELB\nsudo tcpdump -i eth0 -n port 80 and host ELB1\n\n\nELB1\u306fIP\u30a2\u30c9\u30ec\u30b9\n\n\ncapture\n06:53:34.351593 IP ELB1.15871 > EC2.http: Flags [S], seq 1752385158, win 14600, options [mss 1460,sackOK,TS val 180330156 ecr 0,nop,wscale 8], length 0\n06:53:34.351627 IP EC2.http > ELB1.15871: Flags [S.], seq 78396007, ack 1752385159, win 14480, options [mss 1460,sackOK,TS val 193193405 ecr 180330156,nop,wscale 7], length 0\n06:53:34.353787 IP ELB1.15871 > EC2.http: Flags [.], ack 1, win 58, options [nop,nop,TS val 180330157 ecr 193193405], length 0\n06:54:05.580781 IP EC2.http > ELB1.15871: Flags [S.], seq 78396007, ack 1752385159, win 14480, options [mss 1460,sackOK,TS val 193201213 ecr 180330157,nop,wscale 7], length 0\n06:54:05.583090 IP ELB1.15871 > EC2.http: Flags [.], ack 1, win 58, options [nop,nop,TS val 180337964 ecr 193201213,nop,nop,sack 1 {0:1}], length 0\n06:54:25.600906 IP EC2.http > ELB1.15871: Flags [F.], seq 1, ack 1, win 114, options [nop,nop,TS val 193206218 ecr 180337964], length 0\n06:54:25.603526 IP ELB1.15871 > EC2.http: Flags [F.], seq 1, ack 2, win 58, options [nop,nop,TS val 180342969 ecr 193206218], length 0\n06:54:25.603538 IP EC2.http > ELB1.15871: Flags [.], ack 2, win 114, options [nop,nop,TS val 193206218 ecr 180342969], length 0\n\n\n3way\u30cf\u30f3\u30c9\u30b7\u30a7\u30a4\u30af\u306e\u5f8c\u3001HTTP\u30c7\u30fc\u30bf\u304c\u6765\u306a\u3044\u305f\u3081\u306a\u306e\u304b\uff08\uff1f\uff09\u3001apache\u304c\u4e00\u5ea6SYN+ACK\u3092\u518d\u9001\u3057\u3066\u3044\u308b\u306e\u304c\u5065\u6c17\u3067\u3059\u306d\u3002\n\u305d\u306e\u5f8c\u3001\u3057\u3073\u308c\u3092\u5207\u3089\u3057\u3066apache\u304b\u3089FIN+ACK\u3092\u9001\u308a\u3064\u3051\u3066\u3044\u308b\u69d8\u5b50\u304c\u898b\u3066\u53d6\u308c\u307e\u3059\u3002\n\n\u5bfe\u5fdc\u65b9\u6cd5\n\u8abf\u67fb\u7d50\u679c\u3088\u308a\u4ee5\u4e0b\u306e\u4e8b\u304c\u5206\u304b\u308a\u307e\u3057\u305f\u3002\nTCP\u30b3\u30cd\u30af\u30b7\u30e7\u30f3\u3092\u5f35\u3063\u305f\u3042\u3068\u3001HTTP\u30c7\u30fc\u30bf\u304c\u6765\u306a\u3044\u305f\u3081\u3001mod_reqtimeout\u304cDoS\u3068\u5224\u5b9a\u3057\u3066\u3001apache\u304c\u30b3\u30cd\u30af\u30b7\u30e7\u30f3\u3092\u7d42\u4e86\u3055\u305b\u3066\u3044\u308b\u3002\n\n\u4ee5\u4e0a\u306e\u4e8b\u304b\u3089\u3001\u5bfe\u5fdc\u65b9\u6cd5\u306f2\u3064\u3002\n\nELB\u306eConnection Settings\u3092mod_reqtimeout\u306eheader\u306e\u521d\u671f\u5024\u3088\u308a\u77ed\u304f\u3059\u308b\nmod_reqtimeout\u306eheader\u306e\u5024\u3092\u9577\u304f\u3059\u308b\n\n\nConnection Settings\n\u300cConnection Settings: Idle Timeout\u300d\u3068\u3044\u3046\u8a2d\u5b9a\u304c\u3042\u308a\u307e\u3059\u3002\n\u30c7\u30d5\u30a9\u30eb\u30c8\u3067\u306f60\u3068\u306a\u3063\u3066\u3044\u305f\u306e\u3067\u3059\u304c\u3001mod_reqtimeout\u306eheader\u306e\u521d\u671f\u5024\u3067\u3042\u308b20-40\u3088\u308a\u77ed\u304f\u3057\u3066\u307f\u307e\u3057\u3087\u3046\u3002\n\u4eca\u56de\u306f30\u3092\u6307\u5b9a\u3057\u3066\u307f\u307e\u3057\u305f\u3068\u3053\u308d\u3001\u767a\u751f\u3057\u306a\u304f\u306a\u308a\u307e\u3057\u305f\u3002\n\u5b9f\u306f\u3001\u3053\u306e\u8a2d\u5b9a\u3001\u6700\u8fd1\u51fa\u6765\u308b\u3088\u3046\u306b\u306a\u3063\u305f\u305d\u3046\u3067\u3059\u3002(2014/07/14\uff1f)\n\u3010AWS\u767a\u8868\u3011Elastic Load Balancing\u306e\u30b3\u30cd\u30af\u30b7\u30e7\u30f3\u30bf\u30a4\u30e0\u30a2\u30a6\u30c8\u7ba1\u7406\n\nmod_reqtimeout\n\u518d\u5ea6\u4eca\u56de\u306e\u4ef6\u3092\u8003\u3048\u308b\u3068\u4ee5\u4e0b\u3067\u3059\u3002\n\nTCP\u30b3\u30cd\u30af\u30b7\u30e7\u30f3\u3092\u5f35\u3063\u305f\u306e\u306b\u3001HTTP\u304c\u6765\u306a\u3044\u304b\u3089\u56f0\u308b\u3002\n\u8a00\u3044\u63db\u3048\u308b\u3068\u3001TCP 3way\u30cf\u30f3\u30c9\u30b7\u30a7\u30a4\u30af\u304c\u5b8c\u4e86\u3057\u305f\u306e\u306b\u3001HTTP\u30d8\u30c3\u30c0\u30fc\u304c\u6765\u306a\u3044\u3002\n\u306a\u3089HTTP\u30d8\u30c3\u30c0\u30fc\u306b\u95a2\u3057\u3066\u306f\u30bf\u30a4\u30e0\u30a2\u30a6\u30c8\u3057\u306a\u3051\u308c\u3070\u826f\u3044\u3002\n\n\u5148\u306b\u66f8\u3044\u305f\u3088\u3046\u306b\u3001mod_reqtimeout\u306eheader\u306e\u521d\u671f\u5024\u306f20-40\u3067\u3059\u3002\n\ntest.conf\nRequestReadTimeout header=70\n\n\n\u3053\u308c\u3092\u8a2d\u5b9a\u3057\u3066\u3001httpd reload\u3059\u308b\u3068\u3001408\u304c\u30ed\u30b0\u306b\u51fa\u306a\u304f\u306a\u308a\u307e\u3057\u305f\u3002\n\u3067\u3082\u3001\u3053\u308c\u3060\u3068\u3001header\u3092\u9045\u304f\u9001\u3089\u308c\u308b\u306e\u3092\u8a31\u3059\u4e8b\u306b\u306f\u306a\u3063\u3061\u3083\u3046\u306e\u3067\u3001\u5148\u306e\u5bfe\u5fdc\u65b9\u6cd5\u306e\u65b9\u304c\u826f\u3044\u3067\u3059\u306d\u3002\n\n\u307e\u3068\u3081\nELB\u306e\u30d0\u30c3\u30af\u30a8\u30f3\u30c9EC2\u3067408\u304c\u4e00\u676f\u3067\u3066\u3057\u307e\u3046\u6642\u306f\u3001ELB\u306e\u300cConnection Settings Idle Timeout\u300d\u3092mod_reqtimeout\u306eheader\u3088\u308a\u3082\u77ed\u304f\u3057\u307e\u3057\u3087\u3046\uff01\uff01\n\u4e45\u3057\u3076\u308a\u306btcpdump\u3068\u4ef2\u826f\u304f\u3057\u3066\u305f\u301c\uff08\uff3e\uff3e\n\u3057\u304b\u3057\u3001ELB\u3055\u3093\u306f\u81ea\u52d5\u7684\u306b\u30b9\u30b1\u30fc\u30ea\u30f3\u30b0\u3059\u308b\u3068\u306f\u4f3a\u3063\u3066\u3044\u307e\u3057\u305f\u304c\u3001\u6700\u521d\u304b\u3089\u4e8c\u4eba\u639b\u304b\u308a\u3067\u8feb\u3063\u3066\u304d\u3066\u3044\u308b\u3093\u3067\u3059\u306d\u301c\u3002\n\n\u8ffd\u8a18\n\u6295\u7a3f\u5f8c\u306b\u6c17\u3065\u304d\u307e\u3057\u305f\u304c\u3001ELB\u304c\u30b3\u30cd\u30af\u30b7\u30e7\u30f3\u3092\u51fa\u6765\u308b\u9650\u308a\u4f7f\u3044\u56de\u3059\u3063\u3066\u3053\u3068\u306f\u3001Idle Timeout\u306e\u65b9\u306e\u5bfe\u5fdc\u3060\u3068\u3001\u63a5\u7d9a\u304c\u591a\u3044\u30b5\u30a4\u30c8\u3067\u306f\u30c0\u30e1\u304b\u3082\u3057\u308c\u307e\u305b\u3093\u306d\u30fb\u30fb\u30fb\u3002\n\u307e\u3060\u8a66\u3057\u3066\u3044\u307e\u305b\u3093\u304c\u3001\u30c0\u30e1\u306a\u3089\u3001mod_reqtimeout\u3092\u5916\u3059\u65b9\u306b\u3057\u306a\u3044\u3068\u30a4\u30b1\u30ca\u30a4\u304b\u3082\u3057\u308c\u307e\u305b\u3093\u3002\u3002\u3002orz\n\u69d8\u5b50\u898b\u3067\uff08\uff1d\uff57\uff1d\uff1b\n\u30b9\u30c8\u30fc\u30ea\u30fc\u4ed5\u7acb\u3066\u3067\u66f8\u3044\u3066\u304a\u308a\u307e\u3059\u306e\u3067\u3001\u5bfe\u5fdc\u65b9\u6cd5\u306e\u307f\u3092\u77e5\u308a\u305f\u3044\u65b9\u306f\u30da\u30fc\u30b8\u6700\u4e0b\u90e8\u300c\u5bfe\u5fdc\u65b9\u6cd5\u300d\u3001\u300c\u307e\u3068\u3081\u300d\u3092\u53c2\u7167\u304f\u3060\u3055\u3044\u3002\n\n# 408\u304capache\u306e\u30ed\u30b0\u306b\u3081\u3063\u3061\u3083\u51fa\u3066\u308b\u3002\u3002\u3002\n```text\n(client) - ELB - EC2\n```\n\u306a\u69cb\u6210\u3067\u52d5\u304b\u3057\u3066\u3044\u305f\u3093\u3067\u3059\u3051\u3069\u3001\u4e0b\u8a18\u306e\u3088\u3046\u306a\u30ed\u30b0\u304c50\u79d2\u7a0b\u304a\u304d\u306b\u51fa\u3066\u3044\u307e\u3057\u305f\n\n```text:access_log\nELB1 - - [31/Jul/2014:05:44:20 +0000] \"-\" 408 - \"-\" \"-\"\nELB2 - - [31/Jul/2014:05:44:21 +0000] \"-\" 408 - \"-\" \"-\"\nELB1 - - [31/Jul/2014:05:45:11 +0000] \"-\" 408 - \"-\" \"-\"\nELB2 - - [31/Jul/2014:05:45:13 +0000] \"-\" 408 - \"-\" \"-\"\nELB1 - - [31/Jul/2014:05:46:03 +0000] \"-\" 408 - \"-\" \"-\"\nELB2 - - [31/Jul/2014:05:46:05 +0000] \"-\" 408 - \"-\" \"-\"\n```\n* ELB1, ELB2\u306f\u305d\u308c\u305e\u308cELB\u306eIP\u30a2\u30c9\u30ec\u30b9\n\n408...request timeout\u304b\u30fb\u30fb\u30fb\uff08\uff1d\"\uff1d\n\n# \u8abf\u67fb\uff1a\u30b0\u30b0\u308b\n\u6700\u521d\u306f\u5b9a\u671f\u7684\u306b\u51fa\u3066\u3044\u308b\u306e\u3067\u300eELB\u306eHealth Check\u306a\u306e\u304b\u306a\u301c\uff1f\u300f\u3068\u601d\u3044\u8abf\u3079\u3066\u3044\u307e\u3057\u305f\u3002\n\u3059\u308b\u3068\u4ee5\u4e0b\u306e\u3088\u3046\u306a\u8a18\u4e8b\u9054\u306b\u51fa\u4f1a\u3044\u307e\u3057\u305f\u3002\n\n* [tumblr\u306e\u8a18\u4e8b](http://tumblr.structuredlist.com/post/15287659753/instead-i-believe-what-is-going-on-is-simply-that)\n\n> ELB\u304capache\u306b\u5bfe\u3057\u3066\u5f35\u308a\u3063\u3071\u306a\u3057\u306b\u3057\u3088\u3046\u3068\u3057\u3066\u308b\u4e88\u5099\u306e\u30b3\u30cd\u30af\u30b7\u30e7\u30f3\u304c\u3042\u308b\u3002\napache\u306fmod_requesttimeout\u3067\u305d\u308c\u3092\u5207\u65ad\u3059\u308b\u3002\napache\u306e\u30ed\u30b0\u306b408\u304c\u8a18\u9332\u3055\u308c\u308b\u3002\nELB\u306f\u307e\u305f\u63a5\u7d9a\u3057\u3066\u304f\u308b\u3002\u4ee5\u4e0b\u7e70\u308a\u8fd4\u3057\u3002\n\u305d\u306e\u7d50\u679c\u3001TIME_WAIT\u306a\u30b3\u30cd\u30af\u30b7\u30e7\u30f3\u304c\u5e38\u306b\u6e9c\u307e\u3063\u3066\u308b\u3002\n\n\u5b9f\u306f\u30b0\u30b0\u308b\u524d\u306b\u30d1\u30b1\u30c3\u30c8\u3092\u8efd\u304f\u773a\u3081\u3066\u3044\u305f\u306e\u3067\u3059\u304c\u3001\u78ba\u304b\u306b\u305d\u3093\u306a\u98a8\u306b\u898b\u3048\u3066\u3044\u307e\u3057\u305f\u3002\n\u305d\u308c\u306b\u5bfe\u3059\u308b\u3001\u8a2d\u5b9a\u65b9\u6cd5\u304camazon\u306eforum\u306b\u3042\u308a\u307e\u3057\u305f\u3002\n\n* [ELB causing HTTP 408 errors](https://forums.aws.amazon.com/thread.jspa?messageID=307846)\n\n```apache\nRequestReadTimeout header=0 body=0\n```\n\n\u5143\u3005[mod_reqtimeout](http://httpd.apache.org/docs/trunk/mod/mod_reqtimeout.html)\u306fDoS\u5bfe\u7b56\u3068\u3057\u3066\u5c0e\u5165\u3055\u308c\u305f\u3082\u306e\u3067\u3001\u4e0a\u8a18\u8a2d\u5b9a\u3092\u3059\u308b\u3068disable\u306b\u306a\u3063\u3066\u3057\u307e\u3044\u307e\u3059\u3002\n\n## amazon\u3055\u3093\u306a\u3089DoS\u5bfe\u7b56\u3057\u3066\u3044\u308b\u306e\u3067\u306f\uff1f\namazon\u3055\u3093\u306a\u3089\u3001DoS\u5bfe\u7b56\u3092\u3057\u3066\u304f\u308c\u3066\u3044\u308b\u3088\u3046\u306a\u6c17\u3082\u3057\u305f\u306e\u3067\u3059\u304c\u3001\u3069\u3053\u306e\u30ec\u30a4\u30e4\u30fc\u3067\u3001\u3069\u3046\u3044\u3046\u3082\u306e\u3092\u3057\u3066\u304f\u308c\u3066\u3044\u308b\u306e\u304b\u306f\u5206\u304b\u3089\u306a\u3044\u69d8\u5b50\u3002\n\n* [DoS\u653b\u6483\u306e\u9632\u5fa1\u306b\u3064\u3044\u3066](https://forums.aws.amazon.com/thread.jspa?threadID=87747)\n\n> \u8aa0\u306b\u52dd\u624b\u306a\u304c\u3089\u516c\u958b\u60c5\u5831\u4ee5\u4e0a\u306e\u3082\u306e\u306f\u304a\u7b54\u3048\u3044\u305f\u3057\u304b\u306d\u307e\u3059\u3002\n\u3054\u7406\u89e3\u9802\u3051\u307e\u3059\u3088\u3046\u304a\u9858\u3044\u3044\u305f\u3057\u307e\u3059\u3002\n\n* [Amazon Web Services:\u30bb\u30ad\u30e5\u30ea\u30c6\u30a3\u30d7\u30ed\u30bb\u30b9\u306e\u6982\u8981 \u30bb\u30ad\u30e5\u30ea\u30c6\u30a3\u30d7\u30ed\u30bb\u30b9\u306e\u6982\u8981](http://awsmedia.s3.amazonaws.com/jp/jp_AWS_Security_Whitepaper.pdf)\n\n> Amazon \u3092\u4e16\u754c\u6700\u5927\u306e\u30aa\u30f3\u30e9\u30a4\u30f3\u5c0f\n\u58f2\u696d\u8005\u3068\u3057\u305f\u30a8\u30f3\u30b8\u30cb\u30a2\u30ea\u30f3\u30b0\u6280\u8853\u3068\u3001\u540c\u3058\u30a8\u30f3\u30b8\u30cb\u30a2\u30ea\u30f3\u30b0\u6280\u8853\u3092\u5229\u7528\u3059\u308b\u3053\u3068\u304c\u51fa\u6765\u307e\u3059\u3002\u7279\u8a31\u53d6\u5f97\u6e08\u307f\u306e\u3001\nDDoS \u7de9\u548c\u6280\u8853\u3082\u9069\u7528\u3055\u308c\u3066\u3044\u307e\u3059\u3002\n\n\u3046\u30fc\u3093\u30fb\u30fb\u30fb\u30c9\u30a6\u30b7\u30e8\u30a6\uff08\uff1d\u201d\uff1d\n\n## forum\u306e\u5bfe\u5fdc\u65b9\u6cd5\u3078\u306e\u611f\u60f3\n\u5148\u7a0b\u306eforum\u306b\u51fa\u3066\u3044\u305f\u300cheader=0 body=0\u300d\u3068\u3044\u3046\u8a2d\u5b9a\u3092\u3057\u3066\u3001mod_reqtimeout\u3092disable\u306b\u3059\u308b\u3050\u3089\u3044\u306a\u3089\u3001\u305d\u3082\u305d\u3082load_module\u3057\u306a\u304f\u3066\u826f\u3044\u3058\u3083\u306a\u3044\u304b\uff1f\n\n```apache:00-base.conf\nLoadModule reqtimeout_module modules/mod_reqtimeout.so\n```\n\n\u305d\u308c\u306bDoS\u306e\u7de9\u548cmodule\u3092\u5916\u3059\u306e\u306f\u3001\u6700\u5f8c\u306e\u624b\u6bb5\u3067\u826f\u3044\u3088\u3046\u306a\u6c17\u3082\u3057\u307e\u3059\u3002\n\n# \u8abf\u67fb\uff1a\u672c\u5f53\u306bHealth Check\u304c\u72af\u4eba\u306a\u306e\uff1f\n\u3069\u3046\u3057\u3088\u3046\u304b\u3068\u611a\u75f4\u3092\u6f0f\u3089\u3057\u3066\u3044\u305f\u3089\u3001\u300cHealth Check\u304c\u72af\u4eba\u306a\u3089\u305d\u306e\u30dd\u30fc\u30c8\u3060\u3051\u5c02\u7528\u306e\u3092\u4f5c\u308c\u3070\u826f\u3044\u3058\u3083\u306a\u3044\u300d\u3068\u3044\u3046\u30a2\u30c9\u30d0\u30a4\u30b9\u3092\u9802\u304d\u307e\u3057\u305f\u3002\n\u305d\u3053\u3067\u3001\u4ee5\u4e0b\u306e\u3088\u3046\u306a\u8a2d\u5b9a\u3092\u3057\u3066\u3001Health Check\u3067\u4f7f\u3046\u30dd\u30fc\u30c8\u3092\u30de\u30cd\u30fc\u30b8\u30e1\u30f3\u30c8\u30b3\u30f3\u30bd\u30fc\u30eb\u304b\u308930080\u306b\u5909\u66f4\u3057\u3066\u307f\u307e\u3057\u305f\u304c\u3001\u3084\u306f\u308a\u540c\u3058408\u304c\u51fa\u7d9a\u3051\u307e\u3059\u3002\n\n```apache:test.conf\nLISTEN 30080\n<VirtualHost *:30080>\nKeepAlive On\nKeepAliveTimeout 120\nRequestReadTimeout header=0 body=0\n</VirtualHost>\n```\n\n\u3053\u3053\u3067\u300e\u5b9f\u306f\u72af\u4eba\u5225\u4eba\u3058\u3083\u306d\uff1f\u300f\u3068\u3044\u3046\u601d\u3044\u304c\u51fa\u3066\u304d\u307e\u3059\u3002\n\u8a66\u3057\u306b\u3001AWS\u306e\u30de\u30cd\u30fc\u30b8\u30e1\u30f3\u30c8\u30b3\u30f3\u30bd\u30fc\u30eb\u304b\u3089\u3001Health Check\u306eInterval\u309230 seconds\u304b\u308960seconds\u306b\u3057\u307e\u3057\u305f\u304c\u3001\u306a\u305c\u304b\u7d0450\u79d2\u5468\u671f\u3067408\u304c\u51fa\u7d9a\u3051\u307e\u3059\u3002\n\n\u300eHealth Check\u3088\u3002\u7591\u3063\u3066\u60aa\u304b\u3063\u305f\u3002\u300f\n\n\u305d\u3046\u3044\u3048\u3070\u3001ELB\u306f\u30af\u30e9\u30a4\u30a2\u30f3\u30c8\u304b\u3089\u306e\u30a2\u30af\u30bb\u30b9\u306e\u9ad8\u901f\u5316\u3092\u3059\u308b\u305f\u3081\u3001\u30d0\u30c3\u30af\u30a8\u30f3\u30c9\u306eEC2\u3068\u30b3\u30cd\u30af\u30b7\u30e7\u30f3\u3092\u5f35\u308a\u3063\u3071\u306a\u3057\u306b\u3057\u307e\u3059\u3002\n**\u30a2\u30ca\u30bf\u304c\u72af\u4eba\u304b\uff1f\uff01**\n\n\u307e\u305f\u3001\u5f8c\u8ff0\u3057\u307e\u3059\u304c\u3001\u30d1\u30b1\u30c3\u30c8\u3092\u773a\u3081\u308b\u9650\u308a\u3001Health Check\u306f\u3061\u3083\u3093\u3068\u30b3\u30cd\u30af\u30b7\u30e7\u30f3\u3092\u958b\u653e\u3057\u3066\u3044\u307e\u3059\u3002\n\n## \u30d1\u30b1\u30c3\u30c8\u3092\u773a\u3081\u308b\n\u6700\u521d\u306f\u4f55\u304c\u8d77\u304d\u3066\u3044\u305f\u306e\u304b\u5206\u304b\u3089\u306a\u304b\u3063\u305f\u306e\u3067\u3001\u5f8c\u3067wireshark\u3067\u3058\u3063\u304f\u308a\u773a\u3081\u3088\u3046\u3068\u4ee5\u4e0b\u306e\u30aa\u30d7\u30b7\u30e7\u30f3\u3067\u53ce\u96c6\u3057\u3066\u3044\u307e\u3057\u305f\u3002\n\n```bash\nsudo tcpdump -i eth0 -s0 -n -v -w health_check.pcap\n```\n\n\u7d50\u679c\u7684\u306b\u306f\u3001\u30b3\u30f3\u30bd\u30fc\u30eb\u4e0a\u3067\u773a\u3081\u308b\u7a0b\u5ea6\u3067\u826f\u304b\u3063\u305f\u3088\u3046\u306a\u306e\u3067\u3001\u4ee5\u4e0b\u3067\u306f\u305d\u306e\u30ed\u30b0\u3092\u8cbc\u3063\u3066\u304a\u304d\u307e\u3059\u3002\n\n### health Check\n\u5206\u304b\u308a\u3084\u3059\u3044\u3088\u3046\u306b\u300130080\u30dd\u30fc\u30c8\u306b\u6765\u3066\u3082\u3089\u3046\u8a2d\u5b9a\u306b\u3057\u3066\u3044\u307e\u3059\u3002\n\uff08\u5b9f\u969b\u306b\u306f80\u306b\u6765\u3066\u3044\u307e\u3059\u304c\u3001apache\u3078\u306e\u901a\u4fe1\u3068\u6df7\u3056\u3063\u3066\u898b\u8f9b\u3044\u306e\u3067\uff09\n\n```bash\nsudo tcpdump -i eth0 -n port 30080 and host ELB1\n```\n* ELB1\u306fIP\u30a2\u30c9\u30ec\u30b9\n\n```text:capture\n07:10:17.398796 IP ELB1.7509 > EC2.30080: Flags [S], seq 1954705710, win 14600, options [mss 1460,sackOK,TS val 180580918 ecr 0,nop,wscale 8], length 0\n07:10:17.398814 IP EC2.30080 > ELB1.7509: Flags [S.], seq 1118619224, ack 1954705711, win 14480, options [mss 1460,sackOK,TS val 193444167 ecr 180580918,nop,wscale 7], length 0\n07:10:17.401008 IP ELB1.7509 > EC2.30080: Flags [.], ack 1, win 58, options [nop,nop,TS val 180580919 ecr 193444167], length 0\n07:10:17.403409 IP ELB1.7509 > EC2.30080: Flags [F.], seq 1, ack 1, win 58, options [nop,nop,TS val 180580919 ecr 193444167], length 0\n07:10:17.403701 IP EC2.30080 > ELB1.7509: Flags [F.], seq 1, ack 2, win 114, options [nop,nop,TS val 193444168 ecr 180580919], length 0\n07:10:17.405859 IP ELB1.7509 > EC2.30080: Flags [.], ack 2, win 58, options [nop,nop,TS val 180580920 ecr 193444168], length 0\n```\n\u3057\u3070\u3089\u304f\u773a\u3081\u3066\u3044\u307e\u3057\u305f\u304c\u3001\u304d\u3063\u3061\u308a\u3068\u30b3\u30cd\u30af\u30b7\u30e7\u30f3\u306e\u958b\u653e\u3092\u3057\u3066\u3044\u307e\u3059\u3057\u3001seq\u3084ack\u306b\u3082\u4e0d\u81ea\u7136\u306a\u70b9\u306f\u3042\u308a\u307e\u305b\u3093\u3067\u3057\u305f\u3002\n\n### ELB\n\n```bash\nsudo tcpdump -i eth0 -n port 80 and host ELB1\n```\n* ELB1\u306fIP\u30a2\u30c9\u30ec\u30b9\n\n```text:capture\n06:53:34.351593 IP ELB1.15871 > EC2.http: Flags [S], seq 1752385158, win 14600, options [mss 1460,sackOK,TS val 180330156 ecr 0,nop,wscale 8], length 0\n06:53:34.351627 IP EC2.http > ELB1.15871: Flags [S.], seq 78396007, ack 1752385159, win 14480, options [mss 1460,sackOK,TS val 193193405 ecr 180330156,nop,wscale 7], length 0\n06:53:34.353787 IP ELB1.15871 > EC2.http: Flags [.], ack 1, win 58, options [nop,nop,TS val 180330157 ecr 193193405], length 0\n06:54:05.580781 IP EC2.http > ELB1.15871: Flags [S.], seq 78396007, ack 1752385159, win 14480, options [mss 1460,sackOK,TS val 193201213 ecr 180330157,nop,wscale 7], length 0\n06:54:05.583090 IP ELB1.15871 > EC2.http: Flags [.], ack 1, win 58, options [nop,nop,TS val 180337964 ecr 193201213,nop,nop,sack 1 {0:1}], length 0\n06:54:25.600906 IP EC2.http > ELB1.15871: Flags [F.], seq 1, ack 1, win 114, options [nop,nop,TS val 193206218 ecr 180337964], length 0\n06:54:25.603526 IP ELB1.15871 > EC2.http: Flags [F.], seq 1, ack 2, win 58, options [nop,nop,TS val 180342969 ecr 193206218], length 0\n06:54:25.603538 IP EC2.http > ELB1.15871: Flags [.], ack 2, win 114, options [nop,nop,TS val 193206218 ecr 180342969], length 0\n```\n3way\u30cf\u30f3\u30c9\u30b7\u30a7\u30a4\u30af\u306e\u5f8c\u3001HTTP\u30c7\u30fc\u30bf\u304c\u6765\u306a\u3044\u305f\u3081\u306a\u306e\u304b\uff08\uff1f\uff09\u3001apache\u304c\u4e00\u5ea6SYN+ACK\u3092\u518d\u9001\u3057\u3066\u3044\u308b\u306e\u304c\u5065\u6c17\u3067\u3059\u306d\u3002\n\u305d\u306e\u5f8c\u3001\u3057\u3073\u308c\u3092\u5207\u3089\u3057\u3066apache\u304b\u3089FIN+ACK\u3092\u9001\u308a\u3064\u3051\u3066\u3044\u308b\u69d8\u5b50\u304c\u898b\u3066\u53d6\u308c\u307e\u3059\u3002\n\n# \u5bfe\u5fdc\u65b9\u6cd5\n\u8abf\u67fb\u7d50\u679c\u3088\u308a\u4ee5\u4e0b\u306e\u4e8b\u304c\u5206\u304b\u308a\u307e\u3057\u305f\u3002\n\n```text\nTCP\u30b3\u30cd\u30af\u30b7\u30e7\u30f3\u3092\u5f35\u3063\u305f\u3042\u3068\u3001HTTP\u30c7\u30fc\u30bf\u304c\u6765\u306a\u3044\u305f\u3081\u3001mod_reqtimeout\u304cDoS\u3068\u5224\u5b9a\u3057\u3066\u3001apache\u304c\u30b3\u30cd\u30af\u30b7\u30e7\u30f3\u3092\u7d42\u4e86\u3055\u305b\u3066\u3044\u308b\u3002\n```\n\n\u4ee5\u4e0a\u306e\u4e8b\u304b\u3089\u3001\u5bfe\u5fdc\u65b9\u6cd5\u306f2\u3064\u3002\n\n* ELB\u306eConnection Settings\u3092mod_reqtimeout\u306eheader\u306e\u521d\u671f\u5024\u3088\u308a\u77ed\u304f\u3059\u308b\n* mod_reqtimeout\u306eheader\u306e\u5024\u3092\u9577\u304f\u3059\u308b\n\n## Connection Settings\n\u300cConnection Settings: Idle Timeout\u300d\u3068\u3044\u3046\u8a2d\u5b9a\u304c\u3042\u308a\u307e\u3059\u3002\n\u30c7\u30d5\u30a9\u30eb\u30c8\u3067\u306f60\u3068\u306a\u3063\u3066\u3044\u305f\u306e\u3067\u3059\u304c\u3001mod_reqtimeout\u306eheader\u306e\u521d\u671f\u5024\u3067\u3042\u308b20-40\u3088\u308a\u77ed\u304f\u3057\u3066\u307f\u307e\u3057\u3087\u3046\u3002\n\u4eca\u56de\u306f30\u3092\u6307\u5b9a\u3057\u3066\u307f\u307e\u3057\u305f\u3068\u3053\u308d\u3001\u767a\u751f\u3057\u306a\u304f\u306a\u308a\u307e\u3057\u305f\u3002\n\n\u5b9f\u306f\u3001\u3053\u306e\u8a2d\u5b9a\u3001\u6700\u8fd1\u51fa\u6765\u308b\u3088\u3046\u306b\u306a\u3063\u305f\u305d\u3046\u3067\u3059\u3002(2014/07/14\uff1f)\n[\u3010AWS\u767a\u8868\u3011Elastic Load Balancing\u306e\u30b3\u30cd\u30af\u30b7\u30e7\u30f3\u30bf\u30a4\u30e0\u30a2\u30a6\u30c8\u7ba1\u7406](http://aws.typepad.com/aws_japan/2014/07/elb-idle-timeout-control.html)\n\n## mod_reqtimeout\n\u518d\u5ea6\u4eca\u56de\u306e\u4ef6\u3092\u8003\u3048\u308b\u3068\u4ee5\u4e0b\u3067\u3059\u3002\n\n1. TCP\u30b3\u30cd\u30af\u30b7\u30e7\u30f3\u3092\u5f35\u3063\u305f\u306e\u306b\u3001HTTP\u304c\u6765\u306a\u3044\u304b\u3089\u56f0\u308b\u3002\n1. \u8a00\u3044\u63db\u3048\u308b\u3068\u3001TCP 3way\u30cf\u30f3\u30c9\u30b7\u30a7\u30a4\u30af\u304c\u5b8c\u4e86\u3057\u305f\u306e\u306b\u3001HTTP\u30d8\u30c3\u30c0\u30fc\u304c\u6765\u306a\u3044\u3002\n1. \u306a\u3089HTTP\u30d8\u30c3\u30c0\u30fc\u306b\u95a2\u3057\u3066\u306f\u30bf\u30a4\u30e0\u30a2\u30a6\u30c8\u3057\u306a\u3051\u308c\u3070\u826f\u3044\u3002\n\n\u5148\u306b\u66f8\u3044\u305f\u3088\u3046\u306b\u3001mod_reqtimeout\u306eheader\u306e\u521d\u671f\u5024\u306f20-40\u3067\u3059\u3002\n\n```apache:test.conf\nRequestReadTimeout header=70\n```\n\u3053\u308c\u3092\u8a2d\u5b9a\u3057\u3066\u3001httpd reload\u3059\u308b\u3068\u3001408\u304c\u30ed\u30b0\u306b\u51fa\u306a\u304f\u306a\u308a\u307e\u3057\u305f\u3002\n\u3067\u3082\u3001\u3053\u308c\u3060\u3068\u3001header\u3092\u9045\u304f\u9001\u3089\u308c\u308b\u306e\u3092\u8a31\u3059\u4e8b\u306b\u306f\u306a\u3063\u3061\u3083\u3046\u306e\u3067\u3001\u5148\u306e\u5bfe\u5fdc\u65b9\u6cd5\u306e\u65b9\u304c\u826f\u3044\u3067\u3059\u306d\u3002\n\n# \u307e\u3068\u3081\nELB\u306e\u30d0\u30c3\u30af\u30a8\u30f3\u30c9EC2\u3067408\u304c\u4e00\u676f\u3067\u3066\u3057\u307e\u3046\u6642\u306f\u3001ELB\u306e\u300cConnection Settings Idle Timeout\u300d\u3092mod_reqtimeout\u306eheader\u3088\u308a\u3082\u77ed\u304f\u3057\u307e\u3057\u3087\u3046\uff01\uff01\n\n\u4e45\u3057\u3076\u308a\u306btcpdump\u3068\u4ef2\u826f\u304f\u3057\u3066\u305f\u301c\uff08\uff3e\uff3e\n\n\u3057\u304b\u3057\u3001ELB\u3055\u3093\u306f\u81ea\u52d5\u7684\u306b\u30b9\u30b1\u30fc\u30ea\u30f3\u30b0\u3059\u308b\u3068\u306f\u4f3a\u3063\u3066\u3044\u307e\u3057\u305f\u304c\u3001\u6700\u521d\u304b\u3089\u4e8c\u4eba\u639b\u304b\u308a\u3067\u8feb\u3063\u3066\u304d\u3066\u3044\u308b\u3093\u3067\u3059\u306d\u301c\u3002\n\n# \u8ffd\u8a18\n\u6295\u7a3f\u5f8c\u306b\u6c17\u3065\u304d\u307e\u3057\u305f\u304c\u3001ELB\u304c\u30b3\u30cd\u30af\u30b7\u30e7\u30f3\u3092\u51fa\u6765\u308b\u9650\u308a\u4f7f\u3044\u56de\u3059\u3063\u3066\u3053\u3068\u306f\u3001Idle Timeout\u306e\u65b9\u306e\u5bfe\u5fdc\u3060\u3068\u3001\u63a5\u7d9a\u304c\u591a\u3044\u30b5\u30a4\u30c8\u3067\u306f\u30c0\u30e1\u304b\u3082\u3057\u308c\u307e\u305b\u3093\u306d\u30fb\u30fb\u30fb\u3002\n\u307e\u3060\u8a66\u3057\u3066\u3044\u307e\u305b\u3093\u304c\u3001\u30c0\u30e1\u306a\u3089\u3001mod_reqtimeout\u3092\u5916\u3059\u65b9\u306b\u3057\u306a\u3044\u3068\u30a4\u30b1\u30ca\u30a4\u304b\u3082\u3057\u308c\u307e\u305b\u3093\u3002\u3002\u3002orz\n\n\u69d8\u5b50\u898b\u3067\uff08\uff1d\uff57\uff1d\uff1b\n", "tags": ["AWS", "elb", "Apache"]}