{"context": " More than 1 year has passed since last update.\u74b0\u5883\u306f\u30ed\u30fc\u30ab\u30eb\u3067\u8d77\u52d5\u3057\u3066\u3044\u308b Redis \u3092\u5bfe\u8c61\u3068\u3057\u3066\u3044\u307e\u3059\n$ sudo tcpdump -i lo -n -s0 -A dst port 6379\ntcpdump: verbose output suppressed, use -v or -vv for full protocol decode\nlistening on lo, link-type EN10MB (Ethernet), capture size 65535 bytes\n20:30:09.851425 IP 127.0.0.1.43933 > 127.0.0.1.6379: Flags [P.], seq 3011382500:3011382541, ack 2674910830, win 1452, options [nop,nop,TS val 757280422 ecr 757279172], length 41\nE..]..@.@................~...o.n.....Q.....\n-#..-#).*2\n$4\nLPOP\n$20\nresque:queue:message\n\n20:30:09.851491 IP 127.0.0.1.43933 > 127.0.0.1.6379: Flags [.], ack 6, win 1452, options [nop,nop,TS val 757280422 ecr 757280422], length 0\nE..4..@.@................~^M^M.o.s.....(.....\n-#..-#..\n20:30:10.418119 IP 127.0.0.1.34696 > 127.0.0.1.6379: Flags [S], seq 2124522743, win 43690, options [mss 65495,sackOK,TS val 757280563 ecr 0,nop,wscale 7], length 0\nE..<..@.@...............~............0.........\n-#/3........\n20:30:10.418139 IP 127.0.0.1.34696 > 127.0.0.1.6379: Flags [.], ack 1279911756, win 342, options [nop,nop,TS val 757280563 ecr 757280563], length 0\nE..4..@.@...............~...LI.L...V.(.....\n-#/3-#/3\n20:30:10.418202 IP 127.0.0.1.34696 > 127.0.0.1.6379: Flags [P.], seq 0:26, ack 1, win 342, options [nop,nop,TS val 757280563 ecr 757280563], length 26\nE..N..@.@...............~...LI.L...V.B.....\n-#/3-#/3*2\n$6\nclient\n$4\nlist\n\n\u3053\u3093\u306a\u611f\u3058\u3067\u3001\u3069\u3093\u306a\u30b3\u30de\u30f3\u30c9\u767a\u884c\u3057\u3066\u308b\u304b\u78ba\u8a8d\u3067\u304d\u308b\n\u74b0\u5883\u306f\u30ed\u30fc\u30ab\u30eb\u3067\u8d77\u52d5\u3057\u3066\u3044\u308b Redis \u3092\u5bfe\u8c61\u3068\u3057\u3066\u3044\u307e\u3059\n\n```bash\n$ sudo tcpdump -i lo -n -s0 -A dst port 6379\ntcpdump: verbose output suppressed, use -v or -vv for full protocol decode\nlistening on lo, link-type EN10MB (Ethernet), capture size 65535 bytes\n20:30:09.851425 IP 127.0.0.1.43933 > 127.0.0.1.6379: Flags [P.], seq 3011382500:3011382541, ack 2674910830, win 1452, options [nop,nop,TS val 757280422 ecr 757279172], length 41\nE..]..@.@................~...o.n.....Q.....\n-#..-#).*2\n$4\nLPOP\n$20\nresque:queue:message\n\n20:30:09.851491 IP 127.0.0.1.43933 > 127.0.0.1.6379: Flags [.], ack 6, win 1452, options [nop,nop,TS val 757280422 ecr 757280422], length 0\nE..4..@.@................~^M^M.o.s.....(.....\n-#..-#..\n20:30:10.418119 IP 127.0.0.1.34696 > 127.0.0.1.6379: Flags [S], seq 2124522743, win 43690, options [mss 65495,sackOK,TS val 757280563 ecr 0,nop,wscale 7], length 0\nE..<..@.@...............~............0.........\n-#/3........\n20:30:10.418139 IP 127.0.0.1.34696 > 127.0.0.1.6379: Flags [.], ack 1279911756, win 342, options [nop,nop,TS val 757280563 ecr 757280563], length 0\nE..4..@.@...............~...LI.L...V.(.....\n-#/3-#/3\n20:30:10.418202 IP 127.0.0.1.34696 > 127.0.0.1.6379: Flags [P.], seq 0:26, ack 1, win 342, options [nop,nop,TS val 757280563 ecr 757280563], length 26\nE..N..@.@...............~...LI.L...V.B.....\n-#/3-#/3*2\n$6\nclient\n$4\nlist\n```\n\n\u3053\u3093\u306a\u611f\u3058\u3067\u3001\u3069\u3093\u306a\u30b3\u30de\u30f3\u30c9\u767a\u884c\u3057\u3066\u308b\u304b\u78ba\u8a8d\u3067\u304d\u308b\n", "tags": ["Redis", "tcpdump"]}