{"context": "\n\nTCP\u306e\u30ad\u30fc\u30d7\u30a2\u30e9\u30a4\u30d6(TCP keepalive)\nTCP\u3067\u30c7\u30fc\u30bf\u3092\u8ee2\u9001\u3059\u308b\u5834\u5408\u3001\u30c7\u30fc\u30bf\u306e\u8ee2\u9001\u3092\u884c\u3046\u524d\u306b\u30b3\u30cd\u30af\u30b7\u30e7\u30f3\u304c\u78ba\u7acb\u3055\u308c\u3066\u3044\u308b\u5fc5\u8981\u304c\u3042\u308a\u307e\u3059\u3002\n\u4e00\u65b9\u3067\u3001TCP\u306f\u72b6\u614b\u3092\u6301\u3064(\u30b9\u30c6\u30fc\u30c8\u30d5\u30eb\u306a)\u30d7\u30ed\u30c8\u30b3\u30eb\u3067\u3042\u308a\u3001\u30b5\u30fc\u30d0\u30fb\u30af\u30e9\u30a4\u30a2\u30f3\u30c8\u305d\u308c\u305e\u308c\u304c\u72b6\u614b\u3092\u6301\u3064\u305f\u3081\u3001\u30cf\u30fc\u30d5\u30b3\u30cd\u30af\u30b7\u30e7\u30f3\u30fb\u30cf\u30fc\u30d5\u30aa\u30fc\u30d7\u30f3\u306e\u72b6\u614b\u306b\u306a\u308a\u3048\u307e\u3059\u3002\n\u30a2\u30d7\u30ea\u30b1\u30fc\u30b7\u30e7\u30f3\u3067TCP\u306e\u30ad\u30fc\u30d7\u30a2\u30e9\u30a4\u30d6\u304c\u6709\u52b9\u306a\u5834\u5408\u306f\u3001\u5b9a\u671f\u7684\u306b\u30b3\u30cd\u30af\u30b7\u30e7\u30f3\u304c\u6709\u52b9\u3067\u3042\u308b\u3053\u3068\u3092\u78ba\u8a8d\u3059\u308b\u30d1\u30b1\u30c3\u30c8\u3092\u9001\u4fe1\u3057\u3001\u4e0a\u8a18\u306e\u3088\u3046\u306aTCP\u306e\u901a\u4fe1\u304c\u4e0d\u53ef\u306e\u72b6\u614b\u3092\u691c\u77e5\u3057\u3001\u305d\u306e\u30b3\u30cd\u30af\u30b7\u30e7\u30f3\u3092\u5f37\u5236\u7684\u306b\u9589\u3058\u308b\u3053\u3068\u304c\u53ef\u80fd\u3067\u3059\u3002\nTCP\u306e\u30cf\u30fc\u30d5\u30b3\u30cd\u30af\u30b7\u30e7\u30f3\u30fb\u30cf\u30fc\u30d5\u30aa\u30fc\u30d7\u30f3\u306b\u3064\u3044\u3066\u306e\u8a73\u7d30\u306f\u4ee5\u4e0b\u306e\u30a8\u30f3\u30c8\u30ea\u3092\u53c2\u7167\u3057\u3066\u304f\u3060\u3055\u3044\u3002\ntcpdump\u3068iptables\u3067\u7406\u89e3\u3059\u308bTCP\u306e\u30cf\u30fc\u30d5\u30b3\u30cd\u30af\u30b7\u30e7\u30f3\u30fb\u30cf\u30fc\u30d5\u30aa\u30fc\u30d7\u30f3\n\u307e\u305f\u3001TCP\u306e\u30b3\u30cd\u30af\u30b7\u30e7\u30f3\u306e\u57fa\u672c\u306b\u3064\u3044\u3066\u306e\u8a73\u7d30\u306f\u4ee5\u4e0b\u306e\u30a8\u30f3\u30c8\u30ea\u3092\u53c2\u7167\u3057\u3066\u304f\u3060\u3055\u3044\u3002\ntcpdump\u3067\u7406\u89e3\u3059\u308bTCP\u306e\u30b3\u30cd\u30af\u30b7\u30e7\u30f3\n\u4e0a\u8a18\u3001TCP\u306e\u30ad\u30fc\u30d7\u30a2\u30e9\u30a4\u30d6(TCP keepalive)\u306e\u632f\u308b\u821e\u3044\u3092iptables\u30b3\u30de\u30f3\u30c9\u3068tcpdump\u30b3\u30de\u30f3\u30c9\u3067\u5b9f\u969b\u306b\u78ba\u8a8d\u3057\u3066\u884c\u304d\u307e\u3059\u3002\n\ntcpdump\u3068iptables\u3067\u7406\u89e3\u3059\u308bTCP\u306e\u30ad\u30fc\u30d7\u30a2\u30e9\u30a4\u30d6(TCP keepalive)\n\n0.\u524d\u6e96\u5099\n\u672c\u30a8\u30f3\u30c8\u30ea\u3067\u306f\u3001\u4ee5\u4e0b\u306eLinux\u30b3\u30de\u30f3\u30c9\u3092\u4f7f\u7528\u3057\u307e\u3059\u3002\n\ntcpdump\n\n\n\u30cd\u30c3\u30c8\u30ef\u30fc\u30af\u4e0a\u306e\u30d1\u30b1\u30c3\u30c8\u3092\u51fa\u529b\u3059\u308b\u305f\u3081\u306b\u4f7f\u7528\u3057\u307e\u3059\u3002\n\n\nnc,curl\n\n\ntcp\u30b5\u30fc\u30d0\u30fc/\u30af\u30e9\u30a4\u30a2\u30f3\u30c8\u3068\u3057\u3066\u4f7f\u7528\u3057\u307e\u3059\u3002\n\n\nnetstat\n\n\n\u30b3\u30cd\u30af\u30b7\u30e7\u30f3\u306e\u72b6\u614b\u3092\u78ba\u8a8d\u3059\u308b\u305f\u3081\u306b\u4f7f\u7528\u3057\u307e\u3059\u3002\n\n\niptables\n\n\n\u30b3\u30cd\u30af\u30b7\u30e7\u30f3\u78ba\u7acb\u8981\u6c42\u3092DROP\u3059\u308b\u305f\u3081\u306b\u4f7f\u7528\u3057\u307e\u3059\u3002\n\n\n\n\u4e0a\u8a18\u30b3\u30de\u30f3\u30c9\u304c\u30a4\u30f3\u30b9\u30c8\u30fc\u30eb\u3055\u308c\u3066\u3044\u306a\u3044\u5834\u5408\u3001\u4ee5\u4e0b\u306e\u30b3\u30de\u30f3\u30c9\u3067\u30a4\u30f3\u30b9\u30c8\u30fc\u30eb\u3057\u307e\u3059\u3002\n$ sudo yum -y install tcpdump nc curl net-tools iptables\n\n\n1. \u30b3\u30cd\u30af\u30b7\u30e7\u30f3\u306e\u78ba\u8a8d\u3001iptables\u306e\u524d\u6e96\u5099\n\u4ee5\u4e0b\u306e\u30a8\u30f3\u30c8\u30ea\u306e1.2.\u306e\u624b\u9806\u3092\u5b9f\u65bd\u3057\u3066\u3001\u30b3\u30cd\u30af\u30b7\u30e7\u30f3\u306e\u78ba\u8a8d\u3001iptables\u306e\u524d\u6e96\u5099\u307e\u3067\u3092\u78ba\u8a8d\u3057\u3066\u304f\u3060\u3055\u3044\u3002\ntcpdump\u3068iptables\u3067\u7406\u89e3\u3059\u308bTCP\u306e\u30b3\u30cd\u30af\u30b7\u30e7\u30f3\u30bf\u30a4\u30e0\u30a2\u30a6\u30c8 (connection timeout)\n\n1. \u30b3\u30cd\u30af\u30b7\u30e7\u30f3\u306e\u78ba\u8a8d\n2. iptables\u306e\u524d\u6e96\u5099\n\n\n2. tcp keepalive\u95a2\u9023\u306e\u30ab\u30fc\u30cd\u30eb\u30d1\u30e9\u30e1\u30fc\u30bf\u306e\u78ba\u8a8d\u3001\u66f4\u65b0\nTCP keepalive\u306f\u4ee5\u4e0b\u306e\u30ab\u30fc\u30cd\u30eb\u30d1\u30e9\u30e1\u30fc\u30bf\u3067\u632f\u308b\u821e\u3044\u3092\u8a2d\u5b9a\u53ef\u80fd\u3067\u3059\u3002\n\u4ee5\u4e0b\u306e\u30b3\u30de\u30f3\u30c9\u3067\u3001TCP keepalive\u306b\u95a2\u3059\u308b\u30ab\u30fc\u30cd\u30eb\u30d1\u30e9\u30e1\u30fc\u30bf\u3092\u78ba\u8a8d\u3057\u307e\u3059\u3002\n$ sysctl -a | grep tcp_keepalive\nnet.ipv4.tcp_keepalive_time = 7200\nnet.ipv4.tcp_keepalive_probes = 9\nnet.ipv4.tcp_keepalive_intvl = 75\n$ \n\n\u305d\u308c\u305e\u308c\u4ee5\u4e0b\u3092\u8868\u3057\u307e\u3059\u3002\n\n\n\n\u30ab\u30fc\u30cd\u30eb\u30d1\u30e9\u30e1\u30fc\u30bf\n\u6982\u8981\n\n\n\n\nnet.ipv4.tcp_keepalive_time\nkeepalive packet\u3092\u9001\u4fe1\u3059\u308b\u307e\u3067\u306e\u6642\u9593\u3092\u79d2\u5358\u4f4d\u3067\u6307\u5b9a\u3057\u307e\u3059   \u3002\u30c7\u30d5\u30a9\u30eb\u30c8\u306f2\u6642\u9593(7200\u79d2)\n\n\nnet.ipv4.tcp_keepalive_probes\nkeepalive packet\u3092\u9001\u4fe1\u3059\u308b\u56de\u6570\u3092\u6307\u5b9a\u3057\u307e\u3059\u3002\u30c7\u30d5\u30a9\u30eb\u30c8\u306f9\u56de\n\n\nnet.ipv4.tcp_keepalive_intvl\nkeepalive packet\u3092\u9001\u4fe1\u3059\u308b\u9593\u9694\u3092\u79d2\u5358\u4f4d\u3067\u6307\u5b9a\u3057\u307e\u3059\u3002\u30c7\u30d5\u30a9\u30eb\u30c8\u306f75\u79d2\n\n\n\n\u30c7\u30d5\u30a9\u30eb\u30c8\u5024\u3067\u306f\u3001\u78ba\u8a8d\u306e\u305f\u30812\u6642\u9593\u4ee5\u4e0a(7200\u79d2 + (75\u79d2 x 9\u56de))\u5f85\u3064\u5fc5\u8981\u304c\u3042\u308a\u307e\u3059\u3002\u305d\u306e\u305f\u3081\u3001\u672c\u30a8\u30f3\u30c8\u30ea\u3067\u306f\u4ee5\u4e0b\u306e\u8a2d\u5b9a\u5909\u66f4\u3092\u884c\u3044\u307e\u3059\u3002\n(\u672c\u624b\u9806\u3067\u306esysctl\u306e\u64cd\u4f5c\u306f\u3001\u8a66\u9a13\u74b0\u5883\u3084\u30ed\u30fc\u30ab\u30eb\u306eVM\u7b49\u306e\u8a66\u9a13\u74b0\u5883\u3092\u60f3\u5b9a\u3057\u3066\u3044\u307e\u3059\u3002\u672c\u8a2d\u5b9a\u5909\u66f4\u306f\u3001\u305d\u306e\u30db\u30b9\u30c8\u4e0a\u306e\u4ed6\u306e\u30a2\u30d7\u30ea\u30b1\u30fc\u30b7\u30e7\u30f3\u306e\u632f\u308b\u821e\u3044\u3082\u5909\u66f4\u3057\u3066\u3057\u307e\u3046\u305f\u3081\u6ce8\u610f\u3057\u3066\u304f\u3060\u3055\u3044\u3002)\n$ sudo sysctl -w \\\n> net.ipv4.tcp_keepalive_time=30 \\\n> net.ipv4.tcp_keepalive_probes=3 \\\n> net.ipv4.tcp_keepalive_intvl=3 \nnet.ipv4.tcp_keepalive_time = 30\nnet.ipv4.tcp_keepalive_probes = 3\nnet.ipv4.tcp_keepalive_intvl = 3\n\n\u4e0a\u8a18\u306e\u8a2d\u5b9a\u3067\u306f\u3001\u30a2\u30d7\u30ea\u30b1\u30fc\u30b7\u30e7\u30f3\u3067tcp keepalive\u304c\u6709\u52b9\u306a\u5834\u5408\u3001TCP\u30b3\u30cd\u30af\u30b7\u30e7\u30f3\u3067\u901a\u4fe1\u304c\u306a\u3044\u72b6\u614b\u304b\u308930\u79d2\u7d4c\u904e\u3059\u308b\u3068keepalive packet\u3092\u9001\u4fe1\u3057\u307e\u3059\u3002\u305d\u306e\u5f8c3\u79d2\u6bce\u306b2\u56de(\u5408\u8a083\u56de)\u306ekeepalive packet\u3092\u9001\u4fe1\u3057\u5fdc\u7b54\u304c\u306a\u3044\u5834\u5408\u306f\u3001\u305d\u306e\u30b3\u30cd\u30af\u30b7\u30e7\u30f3\u3092Close\u3057\u307e\u3059\u3002\n\n3. tcpkeepalive\u6a5f\u80fd\u304c\u5b9f\u88c5\u3055\u308c\u305ftcp\u30af\u30e9\u30a4\u30a2\u30f3\u30c8\u306e\u8d77\u52d5\u3002\u30b3\u30cd\u30af\u30b7\u30e7\u30f3\u306e\u78ba\u7387\u3002\ncurl\u30b3\u30de\u30f3\u30c9\u3067TCP\u30af\u30e9\u30a4\u30a2\u30f3\u30c8\u3092\u8d77\u52d5\u3057\u3001\u30ed\u30fc\u30ab\u30eb\u3067\u8d77\u52d5\u3057\u3066\u3044\u308b1.\u306eTCP\u30b5\u30fc\u30d0\u306b\u63a5\u7d9a\u3057\u307e\u3059\u3002\n$ curl --local-port 22345 127.0.0.1:12345\n\ncurl: (7) bind failed with errno 98: Address already in use\n\n\u304c\u8fd4\u3063\u3066\u304d\u305f\u5834\u5408\u306f\u3001--local-port\u306e\u5f15\u6570\u306eport\u3092\u5909\u3048\u3066\u5b9f\u884c\u3057\u3066\u304f\u3060\u3055\u3044\u3002\nnetstat\u30b3\u30de\u30f3\u30c9\u3067nc\u3068curl\u306e\u30b3\u30cd\u30af\u30b7\u30e7\u30f3\u304c\u78ba\u7acb\u3055\u308c\u3066\u3044\u308b(ESTABLISH\u306b\u306a\u3063\u3066\u3044\u308b)\u4e8b\u3092\u78ba\u8a8d\u3057\u307e\u3059\u3002\n$ sudo netstat -anp | grep 12345\ntcp  0  0 0.0.0.0:12345    0.0.0.0:*        LISTEN      <PID>/nc             \ntcp  0  0 127.0.0.1:12345  127.0.0.1:22345  ESTABLISHED <PID>/nc             \ntcp  0  0 127.0.0.1:22345  127.0.0.1:12345  ESTABLISHED <PID>/curl           \n$ \n\n\u3053\u308c\u3067\u3001\u30b3\u30cd\u30af\u30b7\u30e7\u30f3\u306e\u78ba\u7acb\u304a\u3088\u3073keepalive packet\u3092\u76ee\u8996\u3059\u308b\u6e96\u5099\u304c\u5b8c\u4e86\u3057\u307e\u3057\u305f\u3002\n\n4. tcpdump\u3067keepalive packet\u3092\u76ee\u8996\u3059\u308b\ntcpdump\u30b3\u30de\u30f3\u30c9\u3067local interface\u306etcp\u306eport 12345\u3092\u6307\u5b9a\u3057\u3066\u5b9f\u884c\u3057\u307e\u3059\u3002\n$ sudo tcpdump -i lo -nnn -p tcp port 12345\n...\n17:16:22.217222 IP 127.0.0.1.22345 > 127.0.0.1.12345: Flags [.], ... length 0\n17:16:22.217238 IP 127.0.0.1.12345 > 127.0.0.1.22345: Flags [.], ... length 0\n#30sec\n17:16:52.218130 IP 127.0.0.1.22345 > 127.0.0.1.12345: Flags [.], ... length 0\n17:16:52.218154 IP 127.0.0.1.12345 > 127.0.0.1.22345: Flags [.], ... length 0\n#30sec\n17:17:22.218192 IP 127.0.0.1.22345 > 127.0.0.1.12345: Flags [.], ... length 0\n17:17:22.218204 IP 127.0.0.1.12345 > 127.0.0.1.22345: Flags [.], ... length 0\n\ntcpdump\u306e\u51fa\u529b\u3092\u78ba\u8a8d\u3057\u307e\u3059\u30023.\u3067\u8a2d\u5b9a\u3057\u305f30\u79d2\u6bce(net.ipv4.tcp_keepalive_time)\u306b\u30af\u30e9\u30a4\u30a2\u30f3\u30c8(source ip 22345)\u304b\u3089length 0\u306epacket\u304c\u9001\u4fe1\u3055\u308c\u3001\u30b5\u30fc\u30d0\u30fc\u304c\u5fdc\u7b54\u3092\u8fd4\u3057\u3066\u3044\u307e\u3059\u3002\n\u3053\u306epacket\u304ckeepalive packet\u3067\u3059\u3002\n\n5. tcpdump\u3067tcp keepalive\u306b\u3088\u308b\u30b3\u30cd\u30af\u30b7\u30e7\u30f3Close\u3092\u76ee\u8996\u3059\u308b\niptables\u3067\u3001\u4e0a\u8a18\u306eport\u756a\u53f7\u306edestination port\u306e\u30d1\u30b1\u30c3\u30c8\u5ec3\u68c4(DROP)\u306e\u305f\u3081\u306e\u30eb\u30fc\u30eb\u3092\u8a2d\u5b9a\u3057\u307e\u3059\u3002\n$ sudo iptables -A INPUT -p tcp -d 127.0.0.1 --dport 12345 -j DROP\n\n\u4e0a\u8a18\u306e\u30eb\u30fc\u30eb\u3092\u8a2d\u5b9a\u3059\u308b\u3068\u3001\u30af\u30e9\u30a4\u30a2\u30f3\u30c8\u304b\u3089\u30b5\u30fc\u30d0(dest ip 12345)\u306etcp keepalive packet\u304c\u7834\u68c4\u3055\u308c\u308b\u305f\u3081\u3001\u5fdc\u7b54\u304c\u8fd4\u3063\u3066\u304d\u307e\u305b\u3093\u3002\n\u4ee5\u4e0b\u306ftcpdump\u306e\u51fa\u529b\u3067\u3059\u3002\n18:29:22.307203 IP 127.0.0.1.22345 > 127.0.0.1.12345: Flags [.], ... length 0\n#3sec\n18:29:25.307994 IP 127.0.0.1.22345 > 127.0.0.1.12345: Flags [.], ... length 0\n#3sec\n18:29:28.308245 IP 127.0.0.1.22345 > 127.0.0.1.12345: Flags [.], ... length 0\n#3sec\n18:29:31.309769 IP 127.0.0.1.22345 > 127.0.0.1.12345: Flags [R.], ... length 0\n\n\u30af\u30e9\u30a4\u30a2\u30f3\u30c8\u306f\u30013\u79d2\u6bce(net.ipv4.tcp_keepalive_intvl)\u306b\u5408\u8a08\u30673\u56de(net.ipv4.tcp_keepalive_probes)\u306etcp keepalive packet\u3092\u9001\u4fe1\u3057\u305f\u306e\u3061\u3001RSET packet\u3092\u9001\u4fe1\u3057\u30b3\u30cd\u30af\u30b7\u30e7\u30f3\u3092\u5f37\u5236\u7684\u306bclose\u3057\u307e\u3059\u3002\ncurl\u306e\u30bf\u30fc\u30df\u30ca\u30eb\u3067\u306f\u4ee5\u4e0b\u304c\u8fd4\u308a\u307e\u3059\u3002\ncurl: (56) Failure when receiving data from the peer\n\n\u4e0a\u8a18\u306e\u3088\u3046\u306bTCP keepalive\u3092\u5b9f\u88c5\u3057\u305f\u30a2\u30d7\u30ea\u30b1\u30fc\u30b7\u30e7\u30f3\u3067\u306f\u6a5f\u80fd\u3092\u6709\u52b9\u306b\u3059\u308b\u3053\u3068\u306b\u3088\u308a\u3001\u30cf\u30fc\u30d5\u30af\u30ed\u30fc\u30ba\u30fb\u30cf\u30fc\u30d5\u30b3\u30cd\u30af\u30b7\u30e7\u30f3\u3092\u691c\u77e5\u3057\u3001\u89e3\u6d88\u3059\u308b\u3053\u3068\u304c\u53ef\u80fd\u3067\u3059\u3002\nTCP keepalive\u306e\u8a73\u7d30\u306f\u4ee5\u4e0b\u30da\u30fc\u30b8\u304c\u53c2\u8003\u306b\u306a\u308a\u307e\u3059\u3002\nhttp://tldp.org/HOWTO/TCP-Keepalive-HOWTO/index.html\n## TCP\u306e\u30ad\u30fc\u30d7\u30a2\u30e9\u30a4\u30d6(TCP keepalive)\n\nTCP\u3067\u30c7\u30fc\u30bf\u3092\u8ee2\u9001\u3059\u308b\u5834\u5408\u3001\u30c7\u30fc\u30bf\u306e\u8ee2\u9001\u3092\u884c\u3046\u524d\u306b\u30b3\u30cd\u30af\u30b7\u30e7\u30f3\u304c\u78ba\u7acb\u3055\u308c\u3066\u3044\u308b\u5fc5\u8981\u304c\u3042\u308a\u307e\u3059\u3002\n\u4e00\u65b9\u3067\u3001TCP\u306f\u72b6\u614b\u3092\u6301\u3064(\u30b9\u30c6\u30fc\u30c8\u30d5\u30eb\u306a)\u30d7\u30ed\u30c8\u30b3\u30eb\u3067\u3042\u308a\u3001\u30b5\u30fc\u30d0\u30fb\u30af\u30e9\u30a4\u30a2\u30f3\u30c8\u305d\u308c\u305e\u308c\u304c\u72b6\u614b\u3092\u6301\u3064\u305f\u3081\u3001\u30cf\u30fc\u30d5\u30b3\u30cd\u30af\u30b7\u30e7\u30f3\u30fb\u30cf\u30fc\u30d5\u30aa\u30fc\u30d7\u30f3\u306e\u72b6\u614b\u306b\u306a\u308a\u3048\u307e\u3059\u3002\n\n\u30a2\u30d7\u30ea\u30b1\u30fc\u30b7\u30e7\u30f3\u3067TCP\u306e\u30ad\u30fc\u30d7\u30a2\u30e9\u30a4\u30d6\u304c\u6709\u52b9\u306a\u5834\u5408\u306f\u3001\u5b9a\u671f\u7684\u306b\u30b3\u30cd\u30af\u30b7\u30e7\u30f3\u304c\u6709\u52b9\u3067\u3042\u308b\u3053\u3068\u3092\u78ba\u8a8d\u3059\u308b\u30d1\u30b1\u30c3\u30c8\u3092\u9001\u4fe1\u3057\u3001\u4e0a\u8a18\u306e\u3088\u3046\u306aTCP\u306e\u901a\u4fe1\u304c\u4e0d\u53ef\u306e\u72b6\u614b\u3092\u691c\u77e5\u3057\u3001\u305d\u306e\u30b3\u30cd\u30af\u30b7\u30e7\u30f3\u3092\u5f37\u5236\u7684\u306b\u9589\u3058\u308b\u3053\u3068\u304c\u53ef\u80fd\u3067\u3059\u3002\n\nTCP\u306e\u30cf\u30fc\u30d5\u30b3\u30cd\u30af\u30b7\u30e7\u30f3\u30fb\u30cf\u30fc\u30d5\u30aa\u30fc\u30d7\u30f3\u306b\u3064\u3044\u3066\u306e\u8a73\u7d30\u306f\u4ee5\u4e0b\u306e\u30a8\u30f3\u30c8\u30ea\u3092\u53c2\u7167\u3057\u3066\u304f\u3060\u3055\u3044\u3002\n[tcpdump\u3068iptables\u3067\u7406\u89e3\u3059\u308bTCP\u306e\u30cf\u30fc\u30d5\u30b3\u30cd\u30af\u30b7\u30e7\u30f3\u30fb\u30cf\u30fc\u30d5\u30aa\u30fc\u30d7\u30f3](http://qiita.com/keikmobile/items/16deac8a5093bd0ae7bb)\n\n\u307e\u305f\u3001TCP\u306e\u30b3\u30cd\u30af\u30b7\u30e7\u30f3\u306e\u57fa\u672c\u306b\u3064\u3044\u3066\u306e\u8a73\u7d30\u306f\u4ee5\u4e0b\u306e\u30a8\u30f3\u30c8\u30ea\u3092\u53c2\u7167\u3057\u3066\u304f\u3060\u3055\u3044\u3002\n[tcpdump\u3067\u7406\u89e3\u3059\u308bTCP\u306e\u30b3\u30cd\u30af\u30b7\u30e7\u30f3](http://qiita.com/keikmobile/items/93cf6dc5b95019c6a442)\n\n\u4e0a\u8a18\u3001TCP\u306e\u30ad\u30fc\u30d7\u30a2\u30e9\u30a4\u30d6(TCP keepalive)\u306e\u632f\u308b\u821e\u3044\u3092iptables\u30b3\u30de\u30f3\u30c9\u3068tcpdump\u30b3\u30de\u30f3\u30c9\u3067\u5b9f\u969b\u306b\u78ba\u8a8d\u3057\u3066\u884c\u304d\u307e\u3059\u3002\n\n## tcpdump\u3068iptables\u3067\u7406\u89e3\u3059\u308bTCP\u306e\u30ad\u30fc\u30d7\u30a2\u30e9\u30a4\u30d6(TCP keepalive)\n\n### 0.\u524d\u6e96\u5099\n\n\u672c\u30a8\u30f3\u30c8\u30ea\u3067\u306f\u3001\u4ee5\u4e0b\u306eLinux\u30b3\u30de\u30f3\u30c9\u3092\u4f7f\u7528\u3057\u307e\u3059\u3002\n\n* tcpdump\n * \u30cd\u30c3\u30c8\u30ef\u30fc\u30af\u4e0a\u306e\u30d1\u30b1\u30c3\u30c8\u3092\u51fa\u529b\u3059\u308b\u305f\u3081\u306b\u4f7f\u7528\u3057\u307e\u3059\u3002\n* nc,curl\n * tcp\u30b5\u30fc\u30d0\u30fc/\u30af\u30e9\u30a4\u30a2\u30f3\u30c8\u3068\u3057\u3066\u4f7f\u7528\u3057\u307e\u3059\u3002\n* netstat\n * \u30b3\u30cd\u30af\u30b7\u30e7\u30f3\u306e\u72b6\u614b\u3092\u78ba\u8a8d\u3059\u308b\u305f\u3081\u306b\u4f7f\u7528\u3057\u307e\u3059\u3002\n* iptables\n * \u30b3\u30cd\u30af\u30b7\u30e7\u30f3\u78ba\u7acb\u8981\u6c42\u3092DROP\u3059\u308b\u305f\u3081\u306b\u4f7f\u7528\u3057\u307e\u3059\u3002\n\n\u4e0a\u8a18\u30b3\u30de\u30f3\u30c9\u304c\u30a4\u30f3\u30b9\u30c8\u30fc\u30eb\u3055\u308c\u3066\u3044\u306a\u3044\u5834\u5408\u3001\u4ee5\u4e0b\u306e\u30b3\u30de\u30f3\u30c9\u3067\u30a4\u30f3\u30b9\u30c8\u30fc\u30eb\u3057\u307e\u3059\u3002\n\n```\n$ sudo yum -y install tcpdump nc curl net-tools iptables\n```\n\n### 1. \u30b3\u30cd\u30af\u30b7\u30e7\u30f3\u306e\u78ba\u8a8d\u3001iptables\u306e\u524d\u6e96\u5099\n\n\u4ee5\u4e0b\u306e\u30a8\u30f3\u30c8\u30ea\u306e1.2.\u306e\u624b\u9806\u3092\u5b9f\u65bd\u3057\u3066\u3001\u30b3\u30cd\u30af\u30b7\u30e7\u30f3\u306e\u78ba\u8a8d\u3001iptables\u306e\u524d\u6e96\u5099\u307e\u3067\u3092\u78ba\u8a8d\u3057\u3066\u304f\u3060\u3055\u3044\u3002\n\n[tcpdump\u3068iptables\u3067\u7406\u89e3\u3059\u308bTCP\u306e\u30b3\u30cd\u30af\u30b7\u30e7\u30f3\u30bf\u30a4\u30e0\u30a2\u30a6\u30c8 (connection timeout)](http://qiita.com/keikmobile/items/5be0a4c5781797c9cf35)\n\n* 1. \u30b3\u30cd\u30af\u30b7\u30e7\u30f3\u306e\u78ba\u8a8d\n* 2. iptables\u306e\u524d\u6e96\u5099\n\n### 2. tcp keepalive\u95a2\u9023\u306e\u30ab\u30fc\u30cd\u30eb\u30d1\u30e9\u30e1\u30fc\u30bf\u306e\u78ba\u8a8d\u3001\u66f4\u65b0\n\nTCP keepalive\u306f\u4ee5\u4e0b\u306e\u30ab\u30fc\u30cd\u30eb\u30d1\u30e9\u30e1\u30fc\u30bf\u3067\u632f\u308b\u821e\u3044\u3092\u8a2d\u5b9a\u53ef\u80fd\u3067\u3059\u3002\n\u4ee5\u4e0b\u306e\u30b3\u30de\u30f3\u30c9\u3067\u3001TCP keepalive\u306b\u95a2\u3059\u308b\u30ab\u30fc\u30cd\u30eb\u30d1\u30e9\u30e1\u30fc\u30bf\u3092\u78ba\u8a8d\u3057\u307e\u3059\u3002\n\n```\n$ sysctl -a | grep tcp_keepalive\nnet.ipv4.tcp_keepalive_time = 7200\nnet.ipv4.tcp_keepalive_probes = 9\nnet.ipv4.tcp_keepalive_intvl = 75\n$ \n```\n\u305d\u308c\u305e\u308c\u4ee5\u4e0b\u3092\u8868\u3057\u307e\u3059\u3002\n\n| \u30ab\u30fc\u30cd\u30eb\u30d1\u30e9\u30e1\u30fc\u30bf | \u6982\u8981 |\n|:--|:--|\n|net.ipv4.tcp_keepalive_time  |keepalive packet\u3092\u9001\u4fe1\u3059\u308b\u307e\u3067\u306e\u6642\u9593\u3092\u79d2\u5358\u4f4d\u3067\u6307\u5b9a\u3057\u307e\u3059   \u3002\u30c7\u30d5\u30a9\u30eb\u30c8\u306f2\u6642\u9593(7200\u79d2)|\n|net.ipv4.tcp_keepalive_probes|keepalive packet\u3092\u9001\u4fe1\u3059\u308b\u56de\u6570\u3092\u6307\u5b9a\u3057\u307e\u3059\u3002\u30c7\u30d5\u30a9\u30eb\u30c8\u306f9\u56de|\n|net.ipv4.tcp_keepalive_intvl |keepalive packet\u3092\u9001\u4fe1\u3059\u308b\u9593\u9694\u3092\u79d2\u5358\u4f4d\u3067\u6307\u5b9a\u3057\u307e\u3059\u3002\u30c7\u30d5\u30a9\u30eb\u30c8\u306f75\u79d2|\n\n\u30c7\u30d5\u30a9\u30eb\u30c8\u5024\u3067\u306f\u3001\u78ba\u8a8d\u306e\u305f\u30812\u6642\u9593\u4ee5\u4e0a(7200\u79d2 + (75\u79d2 x 9\u56de))\u5f85\u3064\u5fc5\u8981\u304c\u3042\u308a\u307e\u3059\u3002\u305d\u306e\u305f\u3081\u3001\u672c\u30a8\u30f3\u30c8\u30ea\u3067\u306f\u4ee5\u4e0b\u306e\u8a2d\u5b9a\u5909\u66f4\u3092\u884c\u3044\u307e\u3059\u3002\n(\u672c\u624b\u9806\u3067\u306esysctl\u306e\u64cd\u4f5c\u306f\u3001\u8a66\u9a13\u74b0\u5883\u3084\u30ed\u30fc\u30ab\u30eb\u306eVM\u7b49\u306e\u8a66\u9a13\u74b0\u5883\u3092\u60f3\u5b9a\u3057\u3066\u3044\u307e\u3059\u3002\u672c\u8a2d\u5b9a\u5909\u66f4\u306f\u3001\u305d\u306e\u30db\u30b9\u30c8\u4e0a\u306e\u4ed6\u306e\u30a2\u30d7\u30ea\u30b1\u30fc\u30b7\u30e7\u30f3\u306e\u632f\u308b\u821e\u3044\u3082\u5909\u66f4\u3057\u3066\u3057\u307e\u3046\u305f\u3081\u6ce8\u610f\u3057\u3066\u304f\u3060\u3055\u3044\u3002)\n\n```\n$ sudo sysctl -w \\\n> net.ipv4.tcp_keepalive_time=30 \\\n> net.ipv4.tcp_keepalive_probes=3 \\\n> net.ipv4.tcp_keepalive_intvl=3 \nnet.ipv4.tcp_keepalive_time = 30\nnet.ipv4.tcp_keepalive_probes = 3\nnet.ipv4.tcp_keepalive_intvl = 3\n```\n\n\u4e0a\u8a18\u306e\u8a2d\u5b9a\u3067\u306f\u3001\u30a2\u30d7\u30ea\u30b1\u30fc\u30b7\u30e7\u30f3\u3067tcp keepalive\u304c\u6709\u52b9\u306a\u5834\u5408\u3001TCP\u30b3\u30cd\u30af\u30b7\u30e7\u30f3\u3067\u901a\u4fe1\u304c\u306a\u3044\u72b6\u614b\u304b\u308930\u79d2\u7d4c\u904e\u3059\u308b\u3068keepalive packet\u3092\u9001\u4fe1\u3057\u307e\u3059\u3002\u305d\u306e\u5f8c3\u79d2\u6bce\u306b2\u56de(\u5408\u8a083\u56de)\u306ekeepalive packet\u3092\u9001\u4fe1\u3057\u5fdc\u7b54\u304c\u306a\u3044\u5834\u5408\u306f\u3001\u305d\u306e\u30b3\u30cd\u30af\u30b7\u30e7\u30f3\u3092Close\u3057\u307e\u3059\u3002\n\n### 3. tcpkeepalive\u6a5f\u80fd\u304c\u5b9f\u88c5\u3055\u308c\u305ftcp\u30af\u30e9\u30a4\u30a2\u30f3\u30c8\u306e\u8d77\u52d5\u3002\u30b3\u30cd\u30af\u30b7\u30e7\u30f3\u306e\u78ba\u7387\u3002\n\ncurl\u30b3\u30de\u30f3\u30c9\u3067TCP\u30af\u30e9\u30a4\u30a2\u30f3\u30c8\u3092\u8d77\u52d5\u3057\u3001\u30ed\u30fc\u30ab\u30eb\u3067\u8d77\u52d5\u3057\u3066\u3044\u308b1.\u306eTCP\u30b5\u30fc\u30d0\u306b\u63a5\u7d9a\u3057\u307e\u3059\u3002\n\n```\n$ curl --local-port 22345 127.0.0.1:12345\n```\n\n```\ncurl: (7) bind failed with errno 98: Address already in use\n```\n\n\u304c\u8fd4\u3063\u3066\u304d\u305f\u5834\u5408\u306f\u3001--local-port\u306e\u5f15\u6570\u306eport\u3092\u5909\u3048\u3066\u5b9f\u884c\u3057\u3066\u304f\u3060\u3055\u3044\u3002\n\nnetstat\u30b3\u30de\u30f3\u30c9\u3067nc\u3068curl\u306e\u30b3\u30cd\u30af\u30b7\u30e7\u30f3\u304c\u78ba\u7acb\u3055\u308c\u3066\u3044\u308b(ESTABLISH\u306b\u306a\u3063\u3066\u3044\u308b)\u4e8b\u3092\u78ba\u8a8d\u3057\u307e\u3059\u3002\n\n```\n$ sudo netstat -anp | grep 12345\ntcp  0  0 0.0.0.0:12345    0.0.0.0:*        LISTEN      <PID>/nc             \ntcp  0  0 127.0.0.1:12345  127.0.0.1:22345  ESTABLISHED <PID>/nc             \ntcp  0  0 127.0.0.1:22345  127.0.0.1:12345  ESTABLISHED <PID>/curl           \n$ \n```\n\n\u3053\u308c\u3067\u3001\u30b3\u30cd\u30af\u30b7\u30e7\u30f3\u306e\u78ba\u7acb\u304a\u3088\u3073keepalive packet\u3092\u76ee\u8996\u3059\u308b\u6e96\u5099\u304c\u5b8c\u4e86\u3057\u307e\u3057\u305f\u3002\n\n### 4. tcpdump\u3067keepalive packet\u3092\u76ee\u8996\u3059\u308b\n\ntcpdump\u30b3\u30de\u30f3\u30c9\u3067local interface\u306etcp\u306eport 12345\u3092\u6307\u5b9a\u3057\u3066\u5b9f\u884c\u3057\u307e\u3059\u3002\n\n```\n$ sudo tcpdump -i lo -nnn -p tcp port 12345\n...\n17:16:22.217222 IP 127.0.0.1.22345 > 127.0.0.1.12345: Flags [.], ... length 0\n17:16:22.217238 IP 127.0.0.1.12345 > 127.0.0.1.22345: Flags [.], ... length 0\n#30sec\n17:16:52.218130 IP 127.0.0.1.22345 > 127.0.0.1.12345: Flags [.], ... length 0\n17:16:52.218154 IP 127.0.0.1.12345 > 127.0.0.1.22345: Flags [.], ... length 0\n#30sec\n17:17:22.218192 IP 127.0.0.1.22345 > 127.0.0.1.12345: Flags [.], ... length 0\n17:17:22.218204 IP 127.0.0.1.12345 > 127.0.0.1.22345: Flags [.], ... length 0\n```\n\ntcpdump\u306e\u51fa\u529b\u3092\u78ba\u8a8d\u3057\u307e\u3059\u30023.\u3067\u8a2d\u5b9a\u3057\u305f30\u79d2\u6bce(net.ipv4.tcp_keepalive_time)\u306b\u30af\u30e9\u30a4\u30a2\u30f3\u30c8(source ip 22345)\u304b\u3089length 0\u306epacket\u304c\u9001\u4fe1\u3055\u308c\u3001\u30b5\u30fc\u30d0\u30fc\u304c\u5fdc\u7b54\u3092\u8fd4\u3057\u3066\u3044\u307e\u3059\u3002\n\u3053\u306epacket\u304ckeepalive packet\u3067\u3059\u3002\n\n### 5. tcpdump\u3067tcp keepalive\u306b\u3088\u308b\u30b3\u30cd\u30af\u30b7\u30e7\u30f3Close\u3092\u76ee\u8996\u3059\u308b\n\niptables\u3067\u3001\u4e0a\u8a18\u306eport\u756a\u53f7\u306edestination port\u306e\u30d1\u30b1\u30c3\u30c8\u5ec3\u68c4(DROP)\u306e\u305f\u3081\u306e\u30eb\u30fc\u30eb\u3092\u8a2d\u5b9a\u3057\u307e\u3059\u3002\n\n```\n$ sudo iptables -A INPUT -p tcp -d 127.0.0.1 --dport 12345 -j DROP\n```\n\n\u4e0a\u8a18\u306e\u30eb\u30fc\u30eb\u3092\u8a2d\u5b9a\u3059\u308b\u3068\u3001\u30af\u30e9\u30a4\u30a2\u30f3\u30c8\u304b\u3089\u30b5\u30fc\u30d0(dest ip 12345)\u306etcp keepalive packet\u304c\u7834\u68c4\u3055\u308c\u308b\u305f\u3081\u3001\u5fdc\u7b54\u304c\u8fd4\u3063\u3066\u304d\u307e\u305b\u3093\u3002\n\u4ee5\u4e0b\u306ftcpdump\u306e\u51fa\u529b\u3067\u3059\u3002\n\n```\n18:29:22.307203 IP 127.0.0.1.22345 > 127.0.0.1.12345: Flags [.], ... length 0\n#3sec\n18:29:25.307994 IP 127.0.0.1.22345 > 127.0.0.1.12345: Flags [.], ... length 0\n#3sec\n18:29:28.308245 IP 127.0.0.1.22345 > 127.0.0.1.12345: Flags [.], ... length 0\n#3sec\n18:29:31.309769 IP 127.0.0.1.22345 > 127.0.0.1.12345: Flags [R.], ... length 0\n```\n\n\u30af\u30e9\u30a4\u30a2\u30f3\u30c8\u306f\u30013\u79d2\u6bce(net.ipv4.tcp_keepalive_intvl)\u306b\u5408\u8a08\u30673\u56de(net.ipv4.tcp_keepalive_probes)\u306etcp keepalive packet\u3092\u9001\u4fe1\u3057\u305f\u306e\u3061\u3001RSET packet\u3092\u9001\u4fe1\u3057\u30b3\u30cd\u30af\u30b7\u30e7\u30f3\u3092\u5f37\u5236\u7684\u306bclose\u3057\u307e\u3059\u3002\n\ncurl\u306e\u30bf\u30fc\u30df\u30ca\u30eb\u3067\u306f\u4ee5\u4e0b\u304c\u8fd4\u308a\u307e\u3059\u3002\n\n``` \ncurl: (56) Failure when receiving data from the peer\n```\n\n\u4e0a\u8a18\u306e\u3088\u3046\u306bTCP keepalive\u3092\u5b9f\u88c5\u3057\u305f\u30a2\u30d7\u30ea\u30b1\u30fc\u30b7\u30e7\u30f3\u3067\u306f\u6a5f\u80fd\u3092\u6709\u52b9\u306b\u3059\u308b\u3053\u3068\u306b\u3088\u308a\u3001\u30cf\u30fc\u30d5\u30af\u30ed\u30fc\u30ba\u30fb\u30cf\u30fc\u30d5\u30b3\u30cd\u30af\u30b7\u30e7\u30f3\u3092\u691c\u77e5\u3057\u3001\u89e3\u6d88\u3059\u308b\u3053\u3068\u304c\u53ef\u80fd\u3067\u3059\u3002\n\nTCP keepalive\u306e\u8a73\u7d30\u306f\u4ee5\u4e0b\u30da\u30fc\u30b8\u304c\u53c2\u8003\u306b\u306a\u308a\u307e\u3059\u3002\nhttp://tldp.org/HOWTO/TCP-Keepalive-HOWTO/index.html\n", "tags": ["TCP", "tcpdump", "iptables"]}