{"context": "\n\nTCP\u306e\u30b3\u30cd\u30af\u30b7\u30e7\u30f3\u62d2\u5426 (connection refused)\nTCP\u3067\u30c7\u30fc\u30bf\u3092\u8ee2\u9001\u3059\u308b\u5834\u5408\u3001\u30c7\u30fc\u30bf\u306e\u8ee2\u9001\u3092\u884c\u3046\u524d\u306b\u30b3\u30cd\u30af\u30b7\u30e7\u30f3\u3092\u78ba\u7acb\u3059\u308b\u5fc5\u8981\u304c\u3042\u308a\u307e\u3059\u3002\nTCP\u306e\u30b3\u30cd\u30af\u30b7\u30e7\u30f3\u62d2\u5426\u306f\u3001TCP\u30af\u30e9\u30a4\u30a2\u30f3\u30c8\u304c\u30b3\u30cd\u30af\u30b7\u30e7\u30f3\u78ba\u7acb\u8981\u6c42\u306b\u5bfe\u3057\u3066\u3001\u30b3\u30cd\u30af\u30b7\u30e7\u30f3\u3092\u62d2\u5426\u3059\u308b\u8981\u6c42\u304c\u8fd4\u3063\u305f\u5834\u5408\u306b\u767a\u751f\u3057\u307e\u3059\u3002\nTCP\u306e\u30b3\u30cd\u30af\u30b7\u30e7\u30f3\u306b\u3064\u3044\u3066\u306e\u8a73\u7d30\u306f\u4ee5\u4e0b\u306e\u30a8\u30f3\u30c8\u30ea\u3092\u53c2\u7167\u3057\u3066\u304f\u3060\u3055\u3044\u3002\ntcpdump\u3067\u7406\u89e3\u3059\u308bTCP\u306e\u30b3\u30cd\u30af\u30b7\u30e7\u30f3\n\u4e0a\u8a18\u306e\u30b3\u30cd\u30af\u30b7\u30e7\u30f3\u78ba\u7acb\u8981\u6c42\u306b\u5bfe\u3057\u3066\u3001\u30b3\u30cd\u30af\u30b7\u30e7\u30f3\u3092\u62d2\u5426\u3059\u308b\u8981\u6c42\u304c\u8fd4\u308b\u632f\u308b\u821e\u3044\u3092tcpdump\u30b3\u30de\u30f3\u30c9\u3067\u5b9f\u969b\u306b\u78ba\u8a8d\u3057\u3066\u884c\u304d\u307e\u3059\u3002\n\ntcpdump\u3067\u7406\u89e3\u3059\u308bTCP\u306e\u30b3\u30cd\u30af\u30b7\u30e7\u30f3\u62d2\u5426 (connection refused)\n\n\u4f7f\u7528\u3059\u308b\u30cd\u30c3\u30c8\u30ef\u30fc\u30af\u30b3\u30de\u30f3\u30c9\n\u672c\u30a8\u30f3\u30c8\u30ea\u3067\u306f\u3001\u4ee5\u4e0b\u306eLinux\u30b3\u30de\u30f3\u30c9\u3092\u4f7f\u7528\u3057\u307e\u3059\u3002\n\ntcpdump\n\n\n\u30cd\u30c3\u30c8\u30ef\u30fc\u30af\u4e0a\u306e\u30d1\u30b1\u30c3\u30c8\u3092\u51fa\u529b\u3059\u308b\u305f\u3081\u306b\u4f7f\u7528\u3057\u307e\u3059\u3002\n\n\nnc,telnet\n\n\ntcp\u30b5\u30fc\u30d0\u30fc/\u30af\u30e9\u30a4\u30a2\u30f3\u30c8\u3068\u3057\u3066\u4f7f\u7528\u3057\u307e\u3059\u3002\n\n\nnetstat\n\n\n\u30b3\u30cd\u30af\u30b7\u30e7\u30f3\u306e\u72b6\u614b\u3092\u78ba\u8a8d\u3059\u308b\u305f\u3081\u306b\u4f7f\u7528\u3057\u307e\u3059\u3002\n\n\n\n\u4e0a\u8a18\u30b3\u30de\u30f3\u30c9\u304c\u30a4\u30f3\u30b9\u30c8\u30fc\u30eb\u3055\u308c\u3066\u3044\u306a\u3044\u5834\u5408\u3001\u4ee5\u4e0b\u306e\u30b3\u30de\u30f3\u30c9\u3067\u30a4\u30f3\u30b9\u30c8\u30fc\u30eb\u3057\u307e\u3059\u3002\n$ sudo yum -y install tcpdump nc telnet net-tools\n\n\n1. \u30b3\u30cd\u30af\u30b7\u30e7\u30f3\u78ba\u7acb\u306e\u62d2\u5426\n\u4e00\u756a\u5358\u7d14\u306b\u30b3\u30cd\u30af\u30b7\u30e7\u30f3\u78ba\u7acb\u306e\u62d2\u5426\u3092\u78ba\u8a8d\u3059\u308b\u65b9\u6cd5\u306fListen\u3057\u3066\u3044\u306a\u3044port\u306b\u30b3\u30cd\u30af\u30b7\u30e7\u30f3\u78ba\u7acb\u8981\u6c42\u3092\u767a\u884c\u3059\u308b\u3053\u3068\u3067\u3059\u3002\n\u3053\u3053\u3067\u306f\u300112345port\u306b\u30b3\u30cd\u30af\u30b7\u30e7\u30f3\u78ba\u7acb\u8981\u6c42\u3092\u767a\u884c\u3057\u307e\u3059\u3002\n$ telnet 127.0.0.1 12345\nTrying 127.0.0.1...\ntelnet: connect to address 127.0.0.1: Connection refused\n$ \n\n\u5373\u6642\u306bTCP\u306e\u30b3\u30cd\u30af\u30b7\u30e7\u30f3\u62d2\u5426(Connection refused)\u304c\u767a\u751f\u3057\u307e\u3059\u3002\n\u3053\u308c\u3067\u3001TCP\u306e\u30b3\u30cd\u30af\u30b7\u30e7\u30f3\u62d2\u5426\u3092tcpdump\u3067\u78ba\u8a8d\u3059\u308b\u6e96\u5099\u304c\u3067\u304d\u307e\u3057\u305f\u3002\n\n2. tcpdump\u3067\u306e\u30b3\u30cd\u30af\u30b7\u30e7\u30f3\u62d2\u5426\u3092\u76ee\u8996\u3059\u308b\u3002\ntcpdump\u30b3\u30de\u30f3\u30c9\u3067local interface\u306eport12345\u3092\u6307\u5b9a\u3057\u3066\u5b9f\u884c\u3057\u307e\u3059\u3002\n$ sudo tcpdump -i lo -nnn port 12345\ntcpdump: verbose output suppressed, use -v or -vv for full protocol decode\nlistening on lo, link-type EN10MB (Ethernet), capture size 65535 bytes\n\n1.\u306e\u624b\u9806\u3068\u540c\u69d8\u306btelnet\u30b3\u30de\u30f3\u30c9\u3092\u5b9f\u884c\u3057\u307e\u3059\u3002\n$ telnet 127.0.0.1 12345\nTrying 127.0.0.1...\ntelnet: connect to address 127.0.0.1: Connection refused\n$ \n\ntcpdump\u306e\u51fa\u529b\u3092\u78ba\u8a8d\u3057\u307e\u3059\u3002\n12:43:40.125255 IP 127.0.0.1.60642 > 127.0.0.1.12345: Flags [S], seq <seq num> ...\n12:43:40.125277 IP 127.0.0.1.12345 > 127.0.0.1.60642: Flags [R.], seq 0, ...\n\n\u4e0a\u8a18\u306etcpdump\u306e\u51fa\u529b\u30d5\u30a9\u30fc\u30de\u30c3\u30c8\u306f\u4ee5\u4e0b\u306e\u901a\u308a\u3067\u3059\u3002\ntimestamp src > dst: flags data-seqno\n\n\ntimestamp: \u30bf\u30a4\u30e0\u30b9\u30bf\u30f3\u30d7\nsrc: \u9001\u4fe1\u5143IP.\u30dd\u30fc\u30c8\ndst: \u9001\u4fe1\u5148IP.\u30dd\u30fc\u30c8\nflags: \u30d5\u30e9\u30b0 S (SYN), R(RST), \u2018.\u2019 (no flags)\ndata-seqno: \u30b7\u30fc\u30b1\u30f3\u30b9\u756a\u53f7(\u4e0a\u8a18\u306fSYN\u30d1\u30b1\u30c3\u30c8\u306e\u307f\u306a\u306e\u3067\u521d\u671f\u30b7\u30fc\u30b1\u30f3\u30b9\u756a\u53f7) \n\n\u4e0a\u8a18\u306e\u30d1\u30b1\u30c3\u30c8\u30ad\u30e3\u30d7\u30c1\u30e3\u306f\u3001TCP\u30af\u30e9\u30a2\u30f3\u30c8\u304c\u30b3\u30cd\u30af\u30b7\u30e7\u30f3\u78ba\u7acb\u8981\u6c42(SYN)\u3092\u9001\u4fe1\u3057\u305f\u304c\u3001\u5bfe\u8c61\u306eport\u304cListen\u3057\u3066\u3044\u306a\u3044\u305f\u3081\u3001\u30b3\u30cd\u30af\u30b7\u30e7\u30f3\u62d2\u5426(RST)\u304c\u8fd4\u3063\u305f\u3053\u3068\u3092\u793a\u3057\u307e\u3059\u3002\n\u4ee5\u4e0b\u306f\u30b7\u30fc\u30b1\u30f3\u30b9\u306e\u6982\u8981\u3067\u3059\u3002\n\n## TCP\u306e\u30b3\u30cd\u30af\u30b7\u30e7\u30f3\u62d2\u5426 (connection refused)\n\nTCP\u3067\u30c7\u30fc\u30bf\u3092\u8ee2\u9001\u3059\u308b\u5834\u5408\u3001\u30c7\u30fc\u30bf\u306e\u8ee2\u9001\u3092\u884c\u3046\u524d\u306b\u30b3\u30cd\u30af\u30b7\u30e7\u30f3\u3092\u78ba\u7acb\u3059\u308b\u5fc5\u8981\u304c\u3042\u308a\u307e\u3059\u3002\nTCP\u306e\u30b3\u30cd\u30af\u30b7\u30e7\u30f3\u62d2\u5426\u306f\u3001TCP\u30af\u30e9\u30a4\u30a2\u30f3\u30c8\u304c\u30b3\u30cd\u30af\u30b7\u30e7\u30f3\u78ba\u7acb\u8981\u6c42\u306b\u5bfe\u3057\u3066\u3001\u30b3\u30cd\u30af\u30b7\u30e7\u30f3\u3092\u62d2\u5426\u3059\u308b\u8981\u6c42\u304c\u8fd4\u3063\u305f\u5834\u5408\u306b\u767a\u751f\u3057\u307e\u3059\u3002\n\nTCP\u306e\u30b3\u30cd\u30af\u30b7\u30e7\u30f3\u306b\u3064\u3044\u3066\u306e\u8a73\u7d30\u306f\u4ee5\u4e0b\u306e\u30a8\u30f3\u30c8\u30ea\u3092\u53c2\u7167\u3057\u3066\u304f\u3060\u3055\u3044\u3002\n\n[tcpdump\u3067\u7406\u89e3\u3059\u308bTCP\u306e\u30b3\u30cd\u30af\u30b7\u30e7\u30f3](http://qiita.com/keikmobile/items/93cf6dc5b95019c6a442)\n\n\n\u4e0a\u8a18\u306e\u30b3\u30cd\u30af\u30b7\u30e7\u30f3\u78ba\u7acb\u8981\u6c42\u306b\u5bfe\u3057\u3066\u3001\u30b3\u30cd\u30af\u30b7\u30e7\u30f3\u3092\u62d2\u5426\u3059\u308b\u8981\u6c42\u304c\u8fd4\u308b\u632f\u308b\u821e\u3044\u3092tcpdump\u30b3\u30de\u30f3\u30c9\u3067\u5b9f\u969b\u306b\u78ba\u8a8d\u3057\u3066\u884c\u304d\u307e\u3059\u3002\n\n## tcpdump\u3067\u7406\u89e3\u3059\u308bTCP\u306e\u30b3\u30cd\u30af\u30b7\u30e7\u30f3\u62d2\u5426 (connection refused)\n\n#### \u4f7f\u7528\u3059\u308b\u30cd\u30c3\u30c8\u30ef\u30fc\u30af\u30b3\u30de\u30f3\u30c9\n\n\u672c\u30a8\u30f3\u30c8\u30ea\u3067\u306f\u3001\u4ee5\u4e0b\u306eLinux\u30b3\u30de\u30f3\u30c9\u3092\u4f7f\u7528\u3057\u307e\u3059\u3002\n\n* tcpdump\n * \u30cd\u30c3\u30c8\u30ef\u30fc\u30af\u4e0a\u306e\u30d1\u30b1\u30c3\u30c8\u3092\u51fa\u529b\u3059\u308b\u305f\u3081\u306b\u4f7f\u7528\u3057\u307e\u3059\u3002\n* nc,telnet\n * tcp\u30b5\u30fc\u30d0\u30fc/\u30af\u30e9\u30a4\u30a2\u30f3\u30c8\u3068\u3057\u3066\u4f7f\u7528\u3057\u307e\u3059\u3002\n* netstat\n * \u30b3\u30cd\u30af\u30b7\u30e7\u30f3\u306e\u72b6\u614b\u3092\u78ba\u8a8d\u3059\u308b\u305f\u3081\u306b\u4f7f\u7528\u3057\u307e\u3059\u3002\n\n\u4e0a\u8a18\u30b3\u30de\u30f3\u30c9\u304c\u30a4\u30f3\u30b9\u30c8\u30fc\u30eb\u3055\u308c\u3066\u3044\u306a\u3044\u5834\u5408\u3001\u4ee5\u4e0b\u306e\u30b3\u30de\u30f3\u30c9\u3067\u30a4\u30f3\u30b9\u30c8\u30fc\u30eb\u3057\u307e\u3059\u3002\n\n```\n$ sudo yum -y install tcpdump nc telnet net-tools\n```\n\n### 1. \u30b3\u30cd\u30af\u30b7\u30e7\u30f3\u78ba\u7acb\u306e\u62d2\u5426\n\n\u4e00\u756a\u5358\u7d14\u306b\u30b3\u30cd\u30af\u30b7\u30e7\u30f3\u78ba\u7acb\u306e\u62d2\u5426\u3092\u78ba\u8a8d\u3059\u308b\u65b9\u6cd5\u306fListen\u3057\u3066\u3044\u306a\u3044port\u306b\u30b3\u30cd\u30af\u30b7\u30e7\u30f3\u78ba\u7acb\u8981\u6c42\u3092\u767a\u884c\u3059\u308b\u3053\u3068\u3067\u3059\u3002\n\u3053\u3053\u3067\u306f\u300112345port\u306b\u30b3\u30cd\u30af\u30b7\u30e7\u30f3\u78ba\u7acb\u8981\u6c42\u3092\u767a\u884c\u3057\u307e\u3059\u3002\n\n```\n$ telnet 127.0.0.1 12345\nTrying 127.0.0.1...\ntelnet: connect to address 127.0.0.1: Connection refused\n$ \n```\n\n\u5373\u6642\u306bTCP\u306e\u30b3\u30cd\u30af\u30b7\u30e7\u30f3\u62d2\u5426(Connection refused)\u304c\u767a\u751f\u3057\u307e\u3059\u3002\n\u3053\u308c\u3067\u3001TCP\u306e\u30b3\u30cd\u30af\u30b7\u30e7\u30f3\u62d2\u5426\u3092tcpdump\u3067\u78ba\u8a8d\u3059\u308b\u6e96\u5099\u304c\u3067\u304d\u307e\u3057\u305f\u3002\n\n### 2. tcpdump\u3067\u306e\u30b3\u30cd\u30af\u30b7\u30e7\u30f3\u62d2\u5426\u3092\u76ee\u8996\u3059\u308b\u3002\n\ntcpdump\u30b3\u30de\u30f3\u30c9\u3067local interface\u306eport12345\u3092\u6307\u5b9a\u3057\u3066\u5b9f\u884c\u3057\u307e\u3059\u3002\n\n```\n$ sudo tcpdump -i lo -nnn port 12345\ntcpdump: verbose output suppressed, use -v or -vv for full protocol decode\nlistening on lo, link-type EN10MB (Ethernet), capture size 65535 bytes\n```\n\n1.\u306e\u624b\u9806\u3068\u540c\u69d8\u306btelnet\u30b3\u30de\u30f3\u30c9\u3092\u5b9f\u884c\u3057\u307e\u3059\u3002\n\n```\n$ telnet 127.0.0.1 12345\nTrying 127.0.0.1...\ntelnet: connect to address 127.0.0.1: Connection refused\n$ \n```\n\ntcpdump\u306e\u51fa\u529b\u3092\u78ba\u8a8d\u3057\u307e\u3059\u3002\n\n```\n12:43:40.125255 IP 127.0.0.1.60642 > 127.0.0.1.12345: Flags [S], seq <seq num> ...\n12:43:40.125277 IP 127.0.0.1.12345 > 127.0.0.1.60642: Flags [R.], seq 0, ...\n```\n\n\u4e0a\u8a18\u306etcpdump\u306e\u51fa\u529b\u30d5\u30a9\u30fc\u30de\u30c3\u30c8\u306f\u4ee5\u4e0b\u306e\u901a\u308a\u3067\u3059\u3002\n\n```\ntimestamp src > dst: flags data-seqno\n```\n* timestamp: \u30bf\u30a4\u30e0\u30b9\u30bf\u30f3\u30d7\n* src: \u9001\u4fe1\u5143IP.\u30dd\u30fc\u30c8\n* dst: \u9001\u4fe1\u5148IP.\u30dd\u30fc\u30c8\n* flags: \u30d5\u30e9\u30b0 S (SYN), R(RST), \u2018.\u2019 (no flags)\n* data-seqno: \u30b7\u30fc\u30b1\u30f3\u30b9\u756a\u53f7(\u4e0a\u8a18\u306fSYN\u30d1\u30b1\u30c3\u30c8\u306e\u307f\u306a\u306e\u3067\u521d\u671f\u30b7\u30fc\u30b1\u30f3\u30b9\u756a\u53f7) \n\n\u4e0a\u8a18\u306e\u30d1\u30b1\u30c3\u30c8\u30ad\u30e3\u30d7\u30c1\u30e3\u306f\u3001TCP\u30af\u30e9\u30a2\u30f3\u30c8\u304c\u30b3\u30cd\u30af\u30b7\u30e7\u30f3\u78ba\u7acb\u8981\u6c42(SYN)\u3092\u9001\u4fe1\u3057\u305f\u304c\u3001\u5bfe\u8c61\u306eport\u304cListen\u3057\u3066\u3044\u306a\u3044\u305f\u3081\u3001\u30b3\u30cd\u30af\u30b7\u30e7\u30f3\u62d2\u5426(RST)\u304c\u8fd4\u3063\u305f\u3053\u3068\u3092\u793a\u3057\u307e\u3059\u3002\n\n\u4ee5\u4e0b\u306f\u30b7\u30fc\u30b1\u30f3\u30b9\u306e\u6982\u8981\u3067\u3059\u3002\n\n![tcp_rst.png](https://qiita-image-store.s3.amazonaws.com/0/22861/a030546f-31c2-6461-2150-7a278eb63d2f.png)\n\n", "tags": ["TCP", "tcpdump", "iptables"]}