{"tags": ["tcpdump", "TCP"], "context": "\n\nTCP\u306e\u30b3\u30cd\u30af\u30b7\u30e7\u30f3\u3092\u7406\u89e3\u3059\u308b\u3068\n\u672c\u30a8\u30f3\u30c8\u30ea\u3067\u306f\u3001RHEL,CentOS 6\u3067tcpdump\u30b3\u30de\u30f3\u30c9\u4f7f\u3063\u3066\u898b\u3048\u308b\u5f62\u3067TCP\u306e\u30b3\u30cd\u30af\u30b7\u30e7\u30f3\u306b\u3064\u3044\u3066\u5b66\u3073\u307e\u3059\u3002TCP\u306e\u30b3\u30cd\u30af\u30b7\u30e7\u30f3\u3092\u7406\u89e3\u3059\u308b\u3068\u4e3b\u306b\u4ee5\u4e0b\u306e\u30e1\u30ea\u30c3\u30c8\u304c\u3042\u308a\u307e\u3059\u3002\n\nNW\u95a2\u9023(\u4e3b\u306bTCP\u30b3\u30cd\u30af\u30b7\u30e7\u30f3\u307e\u308f\u308a)\u306e\u30c8\u30e9\u30d6\u30eb\u30b7\u30e5\u30fc\u30c6\u30a3\u30f3\u30b0\u529b\u304c\u5411\u4e0a\u3059\u308b\u3002\nNW\u95a2\u9023(\u4e3b\u306bTCP\u30b3\u30cd\u30af\u30b7\u30e7\u30f3\u307e\u308f\u308a)\u306e\u30c6\u30b9\u30c8\u30b1\u30fc\u30b9\u89b3\u70b9\u3092\u7fd2\u5f97\u3067\u304d\u308b\u3002\nNW\u95a2\u9023\u306e\u5171\u901a\u8a00\u8a9e\u304c\u7fd2\u5f97\u3067\u304d\u308b\u3002\n\n\u95a2\u9023\u30a8\u30f3\u30c8\u30ea\n\ntcpdump\u3067\u7406\u89e3\u3059\u308bTCP\u306e\u30b3\u30cd\u30af\u30b7\u30e7\u30f3\u62d2\u5426 (connection refused)\ntcpdump\u3068iptables\u3067\u7406\u89e3\u3059\u308bTCP\u306e\u30b3\u30cd\u30af\u30b7\u30e7\u30f3\u30bf\u30a4\u30e0\u30a2\u30a6\u30c8 (connection timeout)\ntcpdump\u3068iptables\u3067\u7406\u89e3\u3059\u308bTCP\u306e\u30cf\u30fc\u30d5\u30b3\u30cd\u30af\u30b7\u30e7\u30f3\u30fb\u30cf\u30fc\u30d5\u30aa\u30fc\u30d7\u30f3\n\n\nTCP\u306e\u30b3\u30cd\u30af\u30b7\u30e7\u30f3\nTCP\u3067\u30c7\u30fc\u30bf\u3092\u8ee2\u9001\u3059\u308b\u5834\u5408\u3001\u30c7\u30fc\u30bf\u306e\u8ee2\u9001\u3092\u884c\u3046\u524d\u306b\u30b3\u30cd\u30af\u30b7\u30e7\u30f3\u3092\u78ba\u7acb\u3059\u308b\u5fc5\u8981\u304c\u3042\u308a\u307e\u3059\u3002\nTCP\u306e\u30b3\u30cd\u30af\u30b7\u30e7\u30f3\u3092\u78ba\u7acb\u3059\u308b\u969b\u306f\u3001\u4ee5\u4e0b\u306e\u6d41\u308c\u3067\u51e6\u7406\u304c\u884c\u308f\u308c\u307e\u3059\u3002\n\nTCP\u30af\u30e9\u30a4\u30a2\u30f3\u30c8\u306f\u3001TCP\u30b5\u30fc\u30d0\u30fc\u306b\u30b3\u30cd\u30af\u30b7\u30e7\u30f3\u78ba\u7acb\u8981\u6c42\u3092\u9001\u4fe1\u3059\u308b\u3002\n\u30b3\u30cd\u30af\u30b7\u30e7\u30f3\u78ba\u7acb\u8981\u6c42\u3092\u53d7\u3051\u305fTCP\u30b5\u30fc\u30d0\u30fc\u306f\u3001TCP\u30af\u30e9\u30a2\u30f3\u30c8\u306b\u78ba\u8a8d\u5fdc\u7b54\u3068\u30b3\u30cd\u30af\u30b7\u30e7\u30f3\u78ba\u7acb\u8981\u6c42\u3092\u8fd4\u3057\u307e\u3059\u3002\n\u30b3\u30cd\u30af\u30b7\u30e7\u30f3\u78ba\u7acb\u8981\u6c42\u3092\u53d7\u3051\u305fTCP\u30af\u30e9\u30a4\u30a2\u30f3\u30c8\u306f\u3001TCP\u30b5\u30fc\u30d0\u30fc\u306b\u78ba\u8a8d\u5fdc\u7b54\u3092\u8fd4\u3057\u307e\u3059\u3002\n\n\u4e0a\u8a18\u306e\u6d41\u308c\u3092tcpdump\u30b3\u30de\u30f3\u30c9\u3067\u5b9f\u969b\u306b\u78ba\u8a8d\u3057\u3066\u884c\u304d\u307e\u3059\u3002\n\ntcpdump\u3067\u7406\u89e3\u3059\u308bTCP\u306e\u30b3\u30cd\u30af\u30b7\u30e7\u30f3\n\n0. \u524d\u6e96\u5099\n\n\u4f7f\u7528\u3059\u308b\u30cd\u30c3\u30c8\u30ef\u30fc\u30af\u30b3\u30de\u30f3\u30c9\n\u672c\u30a8\u30f3\u30c8\u30ea\u3067\u306f\u3001\u4ee5\u4e0b\u306eLinux\u30b3\u30de\u30f3\u30c9\u3092\u4f7f\u7528\u3057\u307e\u3059\u3002\n\ntcpdump\n\n\n\u30cd\u30c3\u30c8\u30ef\u30fc\u30af\u4e0a\u306e\u30d1\u30b1\u30c3\u30c8\u3092\u51fa\u529b\u3059\u308b\u305f\u3081\u306b\u4f7f\u7528\u3057\u307e\u3059\u3002\n\n\nnc,telnet\n\n\ntcp\u30b5\u30fc\u30d0\u30fc/\u30af\u30e9\u30a4\u30a2\u30f3\u30c8\u3068\u3057\u3066\u4f7f\u7528\u3057\u307e\u3059\u3002\n\n\nnetstat\n\n\n\u30b3\u30cd\u30af\u30b7\u30e7\u30f3\u306e\u72b6\u614b\u3092\u78ba\u8a8d\u3059\u308b\u305f\u3081\u306b\u4f7f\u7528\u3057\u307e\u3059\u3002\n\n\n\n\u4e0a\u8a18\u30b3\u30de\u30f3\u30c9\u304c\u30a4\u30f3\u30b9\u30c8\u30fc\u30eb\u3055\u308c\u3066\u3044\u306a\u3044\u5834\u5408\u3001\u4ee5\u4e0b\u306e\u30b3\u30de\u30f3\u30c9\u3067\u30a4\u30f3\u30b9\u30c8\u30fc\u30eb\u3057\u307e\u3059\u3002\n$ sudo yum -y install tcpdump nc telnet net-tools \n\n\n1. TCP\u30b5\u30fc\u30d0\u306e\u8d77\u52d5\nnc\u30b3\u30de\u30f3\u30c9\u306el\u30aa\u30d7\u30b7\u30e7\u30f3\u3092\u4f7f\u7528\u3057\u4efb\u610f\u306eport\u756a\u53f7\u3067TCP\u30b5\u30fc\u30d0\u3092\u8d77\u52d5\u3057\u307e\u3059\u3002\u3053\u3053\u3067\u306f12345\u756a\u3092\u4f7f\u3044\u307e\u3059\u3002\n$ nc -lk 12345\n\n\u5225\u30bf\u30fc\u30df\u30ca\u30eb\u3092\u958b\u304d\u3001netstat\u30b3\u30de\u30f3\u30c9\u306712345 port\u304cLISTEN\u3055\u308c\u3066\u3044\u308b\u4e8b\u3092\u78ba\u8a8d\u3057\u307e\u3059\u3002\n$ netstat -anp | grep 12345\ntcp  0  0  0.0.0.0:12345  0.0.0.0:*  LISTEN  <PID>/nc             \n\n\n1\u5217\u76ee\u306fprotcol\u3092\u793a\u3057\u307e\u3059\u3002tcp\u3067\u3042\u308b\u4e8b\u3092\u78ba\u8a8d\u3057\u3066\u304f\u3060\u3055\u3044\u3002\n4\u5217\u76ee\u306flocal\u30a2\u30c9\u30ec\u30b9\u3068port\u3092\u793a\u3057\u307e\u3059\u3002port\u304c12345\u3067\u3042\u308b\u4e8b\u3092\u78ba\u8a8d\u3057\u3066\u304f\u3060\u3055\u3044\n6\u5217\u76ee\u306f\u30bd\u30b1\u30c3\u30c8\u306e\u72b6\u614b\u3092\u793a\u3057\u307e\u3059\u3002LISTEN\u3067\u3042\u308b\u4e8b\u3092\u78ba\u8a8d\u3057\u3066\u304f\u3060\u3055\u3044\u3002\n\n\u3053\u308c\u3067\u3001TCP\u30b3\u30cd\u30af\u30b7\u30e7\u30f3\u3092\u53d7\u3051\u4ed8\u3051\u308b\u6e96\u5099\u304c\u5b8c\u4e86\u3057\u307e\u3057\u305f\u3002\n\n2. TCP\u30af\u30e9\u30a4\u30a2\u30f3\u30c8\u306e\u8d77\u52d5\u3001\u30b3\u30cd\u30af\u30b7\u30e7\u30f3\u306e\u78ba\u7acb\u3002\ntelnet\u307e\u305f\u306fnc\u30b3\u30de\u30f3\u30c9\u3067TCP\u30af\u30e9\u30a4\u30a2\u30f3\u30c8\u3092\u8d77\u52d5\u3057\u3001\u30ed\u30fc\u30ab\u30eb\u3067\u8d77\u52d5\u3057\u3066\u3044\u308b1.\u306eTCP\u30b5\u30fc\u30d0\u306b\u63a5\u7d9a\u3057\u307e\u3059\u3002\n$ telnet 127.0.0.1 12345\nTrying 127.0.0.1...\nConnected to 127.0.0.1.\nEscape character is '^]'.\n\n\n\u5225\u30bf\u30fc\u30df\u30ca\u30eb\u3092\u958b\u304d\u3001netstat\u30b3\u30de\u30f3\u30c9\u3067nc\u3068telnet\u306e\u30b3\u30cd\u30af\u30b7\u30e7\u30f3\u304c\u78ba\u7acb\u3055\u308c\u3066\u3044\u308b(ESTABLISH\u306b\u306a\u3063\u3066\u3044\u308b)\u4e8b\u3092\u78ba\u8a8d\u3057\u307e\u3059\u3002\n$ netstat -anp | grep 12345\ntcp  0  0 0.0.0.0:12345     0.0.0.0:*        LISTEN      <PID>/nc\ntcp  0  0 127.0.0.1:<port>  127.0.0.1:12345  ESTABLISHED <PID>/telnet\ntcp  0  0 127.0.0.1:12345   127.0.0.1:<port> ESTABLISHED <PID>/nc \n\n2\u884c\u76ee\u304cTCP\u30af\u30e9\u30a4\u30a2\u30f3\u30c8\u3067\u3042\u308btelnet\u306e\u30d7\u30ed\u30bb\u30b9\u306e\u30bd\u30b1\u30c3\u30c8\u3067\u3059\u3002\n* 5\u5217\u76ee\u306fForeign\u30a2\u30c9\u30ec\u30b9\u3092\u793a\u3057\u307e\u3059\u3002nc\u306eLISTEN\u3057\u3066\u3044\u308b12345port\u3067\u3042\u308b\u4e8b\u3092\u78ba\u8a8d\u3057\u3066\u304f\u3060\u3055\u3044\u3002\n* 6\u5217\u76ee\u306f\u30bd\u30b1\u30c3\u30c8\u306e\u72b6\u614b\u3092\u793a\u3057\u307e\u3059\u3002ESTABLISH\u3067\u3042\u308b\u4e8b\u3092\u78ba\u8a8d\u3057\u3066\u304f\u3060\u3055\u3044\u3002\ntelnet\u5b9f\u884c\u4e2d\u306e\u30bf\u30fc\u30df\u30ca\u30eb\u306b\u623b\u308a\u3001Ctrl+[\u3068quit\u30b3\u30de\u30f3\u30c9\u3067\u63a5\u7d9a\u3092Close\u3057\u307e\u3059\u3002\n$ telnet 127.0.0.1 12345\nTrying 127.0.0.1...\nConnected to 127.0.0.1.\nEscape character is '^]'.\n^]\ntelnet> quit\nConnection closed.\n$ \n\n\u3053\u308c\u3067\u3001\u30b3\u30cd\u30af\u30b7\u30e7\u30f3\u306e\u78ba\u7acb\u304c\u3067\u304d\u308b\u3053\u3068\u306e\u30c6\u30b9\u30c8\u304c\u5b8c\u4e86\u3057\u307e\u3057\u305f\u3002\n\n3. tcpdump\u3067\u30b3\u30cd\u30af\u30b7\u30e7\u30f3\u78ba\u7acb\u306e3wayhandshake(3\u30a6\u30a7\u30a4\u30fb\u30cf\u30f3\u30c9\u30b7\u30a7\u30a4\u30af)\u3092\u76ee\u8996\u3059\u308b\n1.\u3067\u8d77\u52d5\u3057\u305fTCP\u30b5\u30fc\u30d0\u304c\u8d77\u52d5\u3057\u3066\u3044\u308b\u4e8b\u3092\u78ba\u8a8d\u3057\u307e\u3059\u3002\n$ netstat -anp | grep 12345\ntcp  0  0  0.0.0.0:12345  0.0.0.0:*  LISTEN  <PID>/nc             \n\ntcpdump\u30b3\u30de\u30f3\u30c9\u3067local interface\u306eport12345\u3092\u6307\u5b9a\u3057\u3066\u5b9f\u884c\u3057\u307e\u3059\u3002\n$ sudo tcpdump -i lo -nnn port 12345\ntcpdump: verbose output suppressed, use -v or -vv for full protocol decode\nlistening on lo, link-type EN10MB (Ethernet), capture size 65535 bytes\n\ntelnet\u307e\u305f\u306fnc\u30b3\u30de\u30f3\u30c9\u3067TCP\u30af\u30e9\u30a4\u30a2\u30f3\u30c8\u3092\u8d77\u52d5\u3057\u3001\u30ed\u30fc\u30ab\u30eb\u3067\u8d77\u52d5\u3057\u3066\u3044\u308b1.\u306eTCP\u30b5\u30fc\u30d0\u306b\u63a5\u7d9a\u3057\u307e\u3059\u3002\n$ telnet 127.0.0.1 12345\nTrying 127.0.0.1...\nConnected to 127.0.0.1.\nEscape character is '^]'.\n\n\ntcpdump\u306e\u51fa\u529b\u3092\u78ba\u8a8d\u3057\u307e\u3059\u3002\n08:52:48.685189 IP 127.0.0.1.<port> > 127.0.0.1.12345:  Flags [S], seq ...\n08:52:48.685221 IP 127.0.0.1.12345  > 127.0.0.1.<port>: Flags [S.], seq ...\n08:52:48.685237 IP 127.0.0.1.<port> > 127.0.0.1.12345:  Flags [.], ack ...\n\n\u4e0a\u8a18\u306etcpdump\u306e\u51fa\u529b\u30d5\u30a9\u30fc\u30de\u30c3\u30c8\u306f\u4ee5\u4e0b\u3067\u3059\u3002\ntimestamp src > dst: flags  \n\n\ntimestamp: \u30bf\u30a4\u30e0\u30b9\u30bf\u30f3\u30d7\nsrc: \u9001\u4fe1\u5143IP.\u30dd\u30fc\u30c8\ndst: \u9001\u4fe1\u5148IP.\u30dd\u30fc\u30c8\nflags: \u30d5\u30e9\u30b0 S (SYN), \u2018.\u2019 (no flags)\n\n\u4e0a\u8a18\u306e\u30d1\u30b1\u30c3\u30c8\u30ad\u30e3\u30d7\u30c1\u30e3\u306fTCP\u30af\u30e9\u30a2\u30f3\u30c8\u30fb\u30b5\u30fc\u30d0\u30fc\u306e\u305d\u308c\u305e\u308c\u4ee5\u4e0b\u306e\u632f\u308b\u821e\u3044\u3092\u793a\u3057\u307e\u3059\u3002\n\nTCP\u30af\u30e9\u30a4\u30a2\u30f3\u30c8(telnet)\u304cTCP\u30b5\u30fc\u30d0\u30fc(nc)\u306bSYN\u30d1\u30b1\u30c3\u30c8\u3092\u9001\u4fe1\u3059\u308b\u3002(SYN-SENT)\nTCP\u30b5\u30fc\u30d0\u30fc(nc)\u304cTCP\u30af\u30e9\u30a4\u30a2\u30f3\u30c8(telnet)\u306bSYN+ACK\u30d1\u30b1\u30c3\u30c8\u304c\u9001\u4fe1\u3059\u308b\u3002(SYN-RECEIVED)\nTCP\u30af\u30e9\u30a4\u30a2\u30f3\u30c8(telnet)\u304cTCP\u30b5\u30fc\u30d0\u30fc(nc)\u306bACK\u30d1\u30b1\u30c3\u30c8\u304c\u9001\u4fe1\u3059\u308b\u3002(ESTABLISH)\n\n\u4ee5\u4e0b\u306f\u30b7\u30fc\u30b1\u30f3\u30b9\u306e\u6982\u8981\u56f3\u3067\u3059\u3002\n\n\u5225\u30bf\u30fc\u30df\u30ca\u30eb\u3092\u958b\u304d\u3001netstat\u30b3\u30de\u30f3\u30c9\u3067nc\u3068telnet\u306e\u30b3\u30cd\u30af\u30b7\u30e7\u30f3\u304c\u78ba\u7acb\u3055\u308c\u3066\u3044\u308b(ESTABLISH\u306b\u306a\u3063\u3066\u3044\u308b)\u4e8b\u3092\u78ba\u8a8d\u3057\u307e\u3059\u3002\n$ netstat -anp | grep 12345\ntcp  0  0 0.0.0.0:12345     0.0.0.0:*        LISTEN      <PID>/nc\ntcp  0  0 127.0.0.1:<port>  127.0.0.1:12345  ESTABLISHED <PID>/telnet\ntcp  0  0 127.0.0.1:12345   127.0.0.1:<port> ESTABLISHED <PID>/nc \n\n\n4. tcpdump\u3067\u30b3\u30cd\u30af\u30b7\u30e7\u30f3\u306e\u7d42\u4e86\u3092\u76ee\u8996\u3059\u308b\ntcpdump\u30b3\u30de\u30f3\u30c9\u306f\u7d42\u4e86\u3057\u306a\u3044\u307e\u307e\u3001telnet\u5b9f\u884c\u4e2d\u306e\u30bf\u30fc\u30df\u30ca\u30eb\u306b\u623b\u308a\u3001Ctrl+[\u3068quit\u30b3\u30de\u30f3\u30c9\u3067\u63a5\u7d9a\u3092Close\u3057\u307e\u3059\u3002\n$ telnet 127.0.0.1 12345\nTrying 127.0.0.1...\nConnected to 127.0.0.1.\nEscape character is '^]'.\n^]\ntelnet> quit\nConnection closed.\n$ \n\ntcpdump\u306e\u51fa\u529b\u3092\u78ba\u8a8d\u3057\u307e\u3059\u3002\n09:11:41.290540 IP 127.0.0.1.<port> > 127.0.0.1.12345:  Flags [F.], seq 1,\n09:11:41.290800 IP 127.0.0.1.12345  > 127.0.0.1.<port>: Flags [F.], seq 1,\n09:11:41.290814 IP 127.0.0.1.<port> > 127.0.0.1.12345:  Flags [.], ack 2,\n\n\u4e0a\u8a18\u306etcpdump\u306e\u51fa\u529b\u30d5\u30a9\u30fc\u30de\u30c3\u30c8\u306f\u4ee5\u4e0b\u3067\u3059\u3002\ntimestamp src > dst: flags  \n\n\ntimestamp: \u30bf\u30a4\u30e0\u30b9\u30bf\u30f3\u30d7\nsrc: \u9001\u4fe1\u5143IP.\u30dd\u30fc\u30c8\ndst: \u9001\u4fe1\u5148IP.\u30dd\u30fc\u30c8\nflags: \u30d5\u30e9\u30b0 F (FIN), \u2018.\u2019 (no flags)\n\nTCP\u30af\u30e9\u30a4\u30a2\u30f3\u30c8(telnet)\u3001TCP\u30b5\u30fc\u30d0\u30fc(nc)\u53cc\u65b9\u3067\u3001FIN/ACK\u3092\u9001\u4fe1\u3057\u3001\u30b3\u30cd\u30af\u30b7\u30e7\u30f3\u3092\u7d42\u4e86\u3057\u307e\u3059\u3002\n## TCP\u306e\u30b3\u30cd\u30af\u30b7\u30e7\u30f3\u3092\u7406\u89e3\u3059\u308b\u3068\n\n\u672c\u30a8\u30f3\u30c8\u30ea\u3067\u306f\u3001RHEL,CentOS 6\u3067tcpdump\u30b3\u30de\u30f3\u30c9\u4f7f\u3063\u3066\u898b\u3048\u308b\u5f62\u3067TCP\u306e\u30b3\u30cd\u30af\u30b7\u30e7\u30f3\u306b\u3064\u3044\u3066\u5b66\u3073\u307e\u3059\u3002TCP\u306e\u30b3\u30cd\u30af\u30b7\u30e7\u30f3\u3092\u7406\u89e3\u3059\u308b\u3068\u4e3b\u306b\u4ee5\u4e0b\u306e\u30e1\u30ea\u30c3\u30c8\u304c\u3042\u308a\u307e\u3059\u3002\n\n* NW\u95a2\u9023(\u4e3b\u306bTCP\u30b3\u30cd\u30af\u30b7\u30e7\u30f3\u307e\u308f\u308a)\u306e\u30c8\u30e9\u30d6\u30eb\u30b7\u30e5\u30fc\u30c6\u30a3\u30f3\u30b0\u529b\u304c\u5411\u4e0a\u3059\u308b\u3002\n* NW\u95a2\u9023(\u4e3b\u306bTCP\u30b3\u30cd\u30af\u30b7\u30e7\u30f3\u307e\u308f\u308a)\u306e\u30c6\u30b9\u30c8\u30b1\u30fc\u30b9\u89b3\u70b9\u3092\u7fd2\u5f97\u3067\u304d\u308b\u3002\n* NW\u95a2\u9023\u306e\u5171\u901a\u8a00\u8a9e\u304c\u7fd2\u5f97\u3067\u304d\u308b\u3002\n\n\u95a2\u9023\u30a8\u30f3\u30c8\u30ea\n\n * [tcpdump\u3067\u7406\u89e3\u3059\u308bTCP\u306e\u30b3\u30cd\u30af\u30b7\u30e7\u30f3\u62d2\u5426 (connection refused)](http://qiita.com/keikmobile/items/407e2f51f23e50839983)\n * [tcpdump\u3068iptables\u3067\u7406\u89e3\u3059\u308bTCP\u306e\u30b3\u30cd\u30af\u30b7\u30e7\u30f3\u30bf\u30a4\u30e0\u30a2\u30a6\u30c8 (connection timeout)](http://qiita.com/keikmobile/items/5be0a4c5781797c9cf35)\n * [tcpdump\u3068iptables\u3067\u7406\u89e3\u3059\u308bTCP\u306e\u30cf\u30fc\u30d5\u30b3\u30cd\u30af\u30b7\u30e7\u30f3\u30fb\u30cf\u30fc\u30d5\u30aa\u30fc\u30d7\u30f3](http://qiita.com/keikmobile/items/16deac8a5093bd0ae7bb)\n\n## TCP\u306e\u30b3\u30cd\u30af\u30b7\u30e7\u30f3\n\nTCP\u3067\u30c7\u30fc\u30bf\u3092\u8ee2\u9001\u3059\u308b\u5834\u5408\u3001\u30c7\u30fc\u30bf\u306e\u8ee2\u9001\u3092\u884c\u3046\u524d\u306b\u30b3\u30cd\u30af\u30b7\u30e7\u30f3\u3092\u78ba\u7acb\u3059\u308b\u5fc5\u8981\u304c\u3042\u308a\u307e\u3059\u3002\nTCP\u306e\u30b3\u30cd\u30af\u30b7\u30e7\u30f3\u3092\u78ba\u7acb\u3059\u308b\u969b\u306f\u3001\u4ee5\u4e0b\u306e\u6d41\u308c\u3067\u51e6\u7406\u304c\u884c\u308f\u308c\u307e\u3059\u3002\n\n1. TCP\u30af\u30e9\u30a4\u30a2\u30f3\u30c8\u306f\u3001TCP\u30b5\u30fc\u30d0\u30fc\u306b\u30b3\u30cd\u30af\u30b7\u30e7\u30f3\u78ba\u7acb\u8981\u6c42\u3092\u9001\u4fe1\u3059\u308b\u3002\n2. \u30b3\u30cd\u30af\u30b7\u30e7\u30f3\u78ba\u7acb\u8981\u6c42\u3092\u53d7\u3051\u305fTCP\u30b5\u30fc\u30d0\u30fc\u306f\u3001TCP\u30af\u30e9\u30a2\u30f3\u30c8\u306b\u78ba\u8a8d\u5fdc\u7b54\u3068\u30b3\u30cd\u30af\u30b7\u30e7\u30f3\u78ba\u7acb\u8981\u6c42\u3092\u8fd4\u3057\u307e\u3059\u3002\n3. \u30b3\u30cd\u30af\u30b7\u30e7\u30f3\u78ba\u7acb\u8981\u6c42\u3092\u53d7\u3051\u305fTCP\u30af\u30e9\u30a4\u30a2\u30f3\u30c8\u306f\u3001TCP\u30b5\u30fc\u30d0\u30fc\u306b\u78ba\u8a8d\u5fdc\u7b54\u3092\u8fd4\u3057\u307e\u3059\u3002\n\n\u4e0a\u8a18\u306e\u6d41\u308c\u3092tcpdump\u30b3\u30de\u30f3\u30c9\u3067\u5b9f\u969b\u306b\u78ba\u8a8d\u3057\u3066\u884c\u304d\u307e\u3059\u3002\n\n## tcpdump\u3067\u7406\u89e3\u3059\u308bTCP\u306e\u30b3\u30cd\u30af\u30b7\u30e7\u30f3\n\n### 0. \u524d\u6e96\u5099 \n\n#### \u4f7f\u7528\u3059\u308b\u30cd\u30c3\u30c8\u30ef\u30fc\u30af\u30b3\u30de\u30f3\u30c9\n\n\u672c\u30a8\u30f3\u30c8\u30ea\u3067\u306f\u3001\u4ee5\u4e0b\u306eLinux\u30b3\u30de\u30f3\u30c9\u3092\u4f7f\u7528\u3057\u307e\u3059\u3002\n\n* tcpdump\n * \u30cd\u30c3\u30c8\u30ef\u30fc\u30af\u4e0a\u306e\u30d1\u30b1\u30c3\u30c8\u3092\u51fa\u529b\u3059\u308b\u305f\u3081\u306b\u4f7f\u7528\u3057\u307e\u3059\u3002\n* nc,telnet\n * tcp\u30b5\u30fc\u30d0\u30fc/\u30af\u30e9\u30a4\u30a2\u30f3\u30c8\u3068\u3057\u3066\u4f7f\u7528\u3057\u307e\u3059\u3002\n* netstat\n * \u30b3\u30cd\u30af\u30b7\u30e7\u30f3\u306e\u72b6\u614b\u3092\u78ba\u8a8d\u3059\u308b\u305f\u3081\u306b\u4f7f\u7528\u3057\u307e\u3059\u3002\n\n\u4e0a\u8a18\u30b3\u30de\u30f3\u30c9\u304c\u30a4\u30f3\u30b9\u30c8\u30fc\u30eb\u3055\u308c\u3066\u3044\u306a\u3044\u5834\u5408\u3001\u4ee5\u4e0b\u306e\u30b3\u30de\u30f3\u30c9\u3067\u30a4\u30f3\u30b9\u30c8\u30fc\u30eb\u3057\u307e\u3059\u3002\n\n```\n$ sudo yum -y install tcpdump nc telnet net-tools \n```\n\n### 1. TCP\u30b5\u30fc\u30d0\u306e\u8d77\u52d5\n\nnc\u30b3\u30de\u30f3\u30c9\u306el\u30aa\u30d7\u30b7\u30e7\u30f3\u3092\u4f7f\u7528\u3057\u4efb\u610f\u306eport\u756a\u53f7\u3067TCP\u30b5\u30fc\u30d0\u3092\u8d77\u52d5\u3057\u307e\u3059\u3002\u3053\u3053\u3067\u306f12345\u756a\u3092\u4f7f\u3044\u307e\u3059\u3002\n\n```\n$ nc -lk 12345\n```\n\n\u5225\u30bf\u30fc\u30df\u30ca\u30eb\u3092\u958b\u304d\u3001netstat\u30b3\u30de\u30f3\u30c9\u306712345 port\u304cLISTEN\u3055\u308c\u3066\u3044\u308b\u4e8b\u3092\u78ba\u8a8d\u3057\u307e\u3059\u3002\n\n```\n$ netstat -anp | grep 12345\ntcp  0  0  0.0.0.0:12345  0.0.0.0:*  LISTEN  <PID>/nc             \n```\n\n* 1\u5217\u76ee\u306fprotcol\u3092\u793a\u3057\u307e\u3059\u3002tcp\u3067\u3042\u308b\u4e8b\u3092\u78ba\u8a8d\u3057\u3066\u304f\u3060\u3055\u3044\u3002\n* 4\u5217\u76ee\u306flocal\u30a2\u30c9\u30ec\u30b9\u3068port\u3092\u793a\u3057\u307e\u3059\u3002port\u304c12345\u3067\u3042\u308b\u4e8b\u3092\u78ba\u8a8d\u3057\u3066\u304f\u3060\u3055\u3044\n* 6\u5217\u76ee\u306f\u30bd\u30b1\u30c3\u30c8\u306e\u72b6\u614b\u3092\u793a\u3057\u307e\u3059\u3002LISTEN\u3067\u3042\u308b\u4e8b\u3092\u78ba\u8a8d\u3057\u3066\u304f\u3060\u3055\u3044\u3002\n\n\u3053\u308c\u3067\u3001TCP\u30b3\u30cd\u30af\u30b7\u30e7\u30f3\u3092\u53d7\u3051\u4ed8\u3051\u308b\u6e96\u5099\u304c\u5b8c\u4e86\u3057\u307e\u3057\u305f\u3002\n\n### 2. TCP\u30af\u30e9\u30a4\u30a2\u30f3\u30c8\u306e\u8d77\u52d5\u3001\u30b3\u30cd\u30af\u30b7\u30e7\u30f3\u306e\u78ba\u7acb\u3002\n\ntelnet\u307e\u305f\u306fnc\u30b3\u30de\u30f3\u30c9\u3067TCP\u30af\u30e9\u30a4\u30a2\u30f3\u30c8\u3092\u8d77\u52d5\u3057\u3001\u30ed\u30fc\u30ab\u30eb\u3067\u8d77\u52d5\u3057\u3066\u3044\u308b1.\u306eTCP\u30b5\u30fc\u30d0\u306b\u63a5\u7d9a\u3057\u307e\u3059\u3002\n\n```\n$ telnet 127.0.0.1 12345\nTrying 127.0.0.1...\nConnected to 127.0.0.1.\nEscape character is '^]'.\n\n```\n\n\u5225\u30bf\u30fc\u30df\u30ca\u30eb\u3092\u958b\u304d\u3001netstat\u30b3\u30de\u30f3\u30c9\u3067nc\u3068telnet\u306e\u30b3\u30cd\u30af\u30b7\u30e7\u30f3\u304c\u78ba\u7acb\u3055\u308c\u3066\u3044\u308b(ESTABLISH\u306b\u306a\u3063\u3066\u3044\u308b)\u4e8b\u3092\u78ba\u8a8d\u3057\u307e\u3059\u3002\n\n```\n$ netstat -anp | grep 12345\ntcp  0  0 0.0.0.0:12345     0.0.0.0:*        LISTEN      <PID>/nc\ntcp  0  0 127.0.0.1:<port>  127.0.0.1:12345  ESTABLISHED <PID>/telnet\ntcp  0  0 127.0.0.1:12345   127.0.0.1:<port> ESTABLISHED <PID>/nc \n```\n\n2\u884c\u76ee\u304cTCP\u30af\u30e9\u30a4\u30a2\u30f3\u30c8\u3067\u3042\u308btelnet\u306e\u30d7\u30ed\u30bb\u30b9\u306e\u30bd\u30b1\u30c3\u30c8\u3067\u3059\u3002\n* 5\u5217\u76ee\u306fForeign\u30a2\u30c9\u30ec\u30b9\u3092\u793a\u3057\u307e\u3059\u3002nc\u306eLISTEN\u3057\u3066\u3044\u308b12345port\u3067\u3042\u308b\u4e8b\u3092\u78ba\u8a8d\u3057\u3066\u304f\u3060\u3055\u3044\u3002\n* 6\u5217\u76ee\u306f\u30bd\u30b1\u30c3\u30c8\u306e\u72b6\u614b\u3092\u793a\u3057\u307e\u3059\u3002ESTABLISH\u3067\u3042\u308b\u4e8b\u3092\u78ba\u8a8d\u3057\u3066\u304f\u3060\u3055\u3044\u3002\n\ntelnet\u5b9f\u884c\u4e2d\u306e\u30bf\u30fc\u30df\u30ca\u30eb\u306b\u623b\u308a\u3001Ctrl+[\u3068quit\u30b3\u30de\u30f3\u30c9\u3067\u63a5\u7d9a\u3092Close\u3057\u307e\u3059\u3002\n\n```\n$ telnet 127.0.0.1 12345\nTrying 127.0.0.1...\nConnected to 127.0.0.1.\nEscape character is '^]'.\n^]\ntelnet> quit\nConnection closed.\n$ \n```\n\n\u3053\u308c\u3067\u3001\u30b3\u30cd\u30af\u30b7\u30e7\u30f3\u306e\u78ba\u7acb\u304c\u3067\u304d\u308b\u3053\u3068\u306e\u30c6\u30b9\u30c8\u304c\u5b8c\u4e86\u3057\u307e\u3057\u305f\u3002\n\n### 3. tcpdump\u3067\u30b3\u30cd\u30af\u30b7\u30e7\u30f3\u78ba\u7acb\u306e3wayhandshake(3\u30a6\u30a7\u30a4\u30fb\u30cf\u30f3\u30c9\u30b7\u30a7\u30a4\u30af)\u3092\u76ee\u8996\u3059\u308b\n\n1.\u3067\u8d77\u52d5\u3057\u305fTCP\u30b5\u30fc\u30d0\u304c\u8d77\u52d5\u3057\u3066\u3044\u308b\u4e8b\u3092\u78ba\u8a8d\u3057\u307e\u3059\u3002\n\n```\n$ netstat -anp | grep 12345\ntcp  0  0  0.0.0.0:12345  0.0.0.0:*  LISTEN  <PID>/nc             \n```\n\ntcpdump\u30b3\u30de\u30f3\u30c9\u3067local interface\u306eport12345\u3092\u6307\u5b9a\u3057\u3066\u5b9f\u884c\u3057\u307e\u3059\u3002\n\n```\n$ sudo tcpdump -i lo -nnn port 12345\ntcpdump: verbose output suppressed, use -v or -vv for full protocol decode\nlistening on lo, link-type EN10MB (Ethernet), capture size 65535 bytes\n```\n\ntelnet\u307e\u305f\u306fnc\u30b3\u30de\u30f3\u30c9\u3067TCP\u30af\u30e9\u30a4\u30a2\u30f3\u30c8\u3092\u8d77\u52d5\u3057\u3001\u30ed\u30fc\u30ab\u30eb\u3067\u8d77\u52d5\u3057\u3066\u3044\u308b1.\u306eTCP\u30b5\u30fc\u30d0\u306b\u63a5\u7d9a\u3057\u307e\u3059\u3002\n\n```\n$ telnet 127.0.0.1 12345\nTrying 127.0.0.1...\nConnected to 127.0.0.1.\nEscape character is '^]'.\n\n```\n\ntcpdump\u306e\u51fa\u529b\u3092\u78ba\u8a8d\u3057\u307e\u3059\u3002\n\n```\n08:52:48.685189 IP 127.0.0.1.<port> > 127.0.0.1.12345:  Flags [S], seq ...\n08:52:48.685221 IP 127.0.0.1.12345  > 127.0.0.1.<port>: Flags [S.], seq ...\n08:52:48.685237 IP 127.0.0.1.<port> > 127.0.0.1.12345:  Flags [.], ack ...\n```\n\n\u4e0a\u8a18\u306etcpdump\u306e\u51fa\u529b\u30d5\u30a9\u30fc\u30de\u30c3\u30c8\u306f\u4ee5\u4e0b\u3067\u3059\u3002\n\n```\ntimestamp src > dst: flags  \n```\n* timestamp: \u30bf\u30a4\u30e0\u30b9\u30bf\u30f3\u30d7\n* src: \u9001\u4fe1\u5143IP.\u30dd\u30fc\u30c8\n* dst: \u9001\u4fe1\u5148IP.\u30dd\u30fc\u30c8\n* flags: \u30d5\u30e9\u30b0 S (SYN), \u2018.\u2019 (no flags)\n\n\u4e0a\u8a18\u306e\u30d1\u30b1\u30c3\u30c8\u30ad\u30e3\u30d7\u30c1\u30e3\u306fTCP\u30af\u30e9\u30a2\u30f3\u30c8\u30fb\u30b5\u30fc\u30d0\u30fc\u306e\u305d\u308c\u305e\u308c\u4ee5\u4e0b\u306e\u632f\u308b\u821e\u3044\u3092\u793a\u3057\u307e\u3059\u3002\n\n1. TCP\u30af\u30e9\u30a4\u30a2\u30f3\u30c8(telnet)\u304cTCP\u30b5\u30fc\u30d0\u30fc(nc)\u306bSYN\u30d1\u30b1\u30c3\u30c8\u3092\u9001\u4fe1\u3059\u308b\u3002(SYN-SENT)\n2. TCP\u30b5\u30fc\u30d0\u30fc(nc)\u304cTCP\u30af\u30e9\u30a4\u30a2\u30f3\u30c8(telnet)\u306bSYN+ACK\u30d1\u30b1\u30c3\u30c8\u304c\u9001\u4fe1\u3059\u308b\u3002(SYN-RECEIVED)\n3. TCP\u30af\u30e9\u30a4\u30a2\u30f3\u30c8(telnet)\u304cTCP\u30b5\u30fc\u30d0\u30fc(nc)\u306bACK\u30d1\u30b1\u30c3\u30c8\u304c\u9001\u4fe1\u3059\u308b\u3002(ESTABLISH)\n\n\u4ee5\u4e0b\u306f\u30b7\u30fc\u30b1\u30f3\u30b9\u306e\u6982\u8981\u56f3\u3067\u3059\u3002\n\n![tcp3wayhandshack.png](https://qiita-image-store.s3.amazonaws.com/0/22861/4f5abd9f-55b1-4e14-544b-c75bf4cbe9fe.png)\n\n\u5225\u30bf\u30fc\u30df\u30ca\u30eb\u3092\u958b\u304d\u3001netstat\u30b3\u30de\u30f3\u30c9\u3067nc\u3068telnet\u306e\u30b3\u30cd\u30af\u30b7\u30e7\u30f3\u304c\u78ba\u7acb\u3055\u308c\u3066\u3044\u308b(ESTABLISH\u306b\u306a\u3063\u3066\u3044\u308b)\u4e8b\u3092\u78ba\u8a8d\u3057\u307e\u3059\u3002\n\n```\n$ netstat -anp | grep 12345\ntcp  0  0 0.0.0.0:12345     0.0.0.0:*        LISTEN      <PID>/nc\ntcp  0  0 127.0.0.1:<port>  127.0.0.1:12345  ESTABLISHED <PID>/telnet\ntcp  0  0 127.0.0.1:12345   127.0.0.1:<port> ESTABLISHED <PID>/nc \n```\n\n### 4. tcpdump\u3067\u30b3\u30cd\u30af\u30b7\u30e7\u30f3\u306e\u7d42\u4e86\u3092\u76ee\u8996\u3059\u308b\n\ntcpdump\u30b3\u30de\u30f3\u30c9\u306f\u7d42\u4e86\u3057\u306a\u3044\u307e\u307e\u3001telnet\u5b9f\u884c\u4e2d\u306e\u30bf\u30fc\u30df\u30ca\u30eb\u306b\u623b\u308a\u3001Ctrl+[\u3068quit\u30b3\u30de\u30f3\u30c9\u3067\u63a5\u7d9a\u3092Close\u3057\u307e\u3059\u3002\n\n```\n$ telnet 127.0.0.1 12345\nTrying 127.0.0.1...\nConnected to 127.0.0.1.\nEscape character is '^]'.\n^]\ntelnet> quit\nConnection closed.\n$ \n```\n\ntcpdump\u306e\u51fa\u529b\u3092\u78ba\u8a8d\u3057\u307e\u3059\u3002\n\n```\n09:11:41.290540 IP 127.0.0.1.<port> > 127.0.0.1.12345:  Flags [F.], seq 1,\n09:11:41.290800 IP 127.0.0.1.12345  > 127.0.0.1.<port>: Flags [F.], seq 1,\n09:11:41.290814 IP 127.0.0.1.<port> > 127.0.0.1.12345:  Flags [.], ack 2,\n```\n\n\u4e0a\u8a18\u306etcpdump\u306e\u51fa\u529b\u30d5\u30a9\u30fc\u30de\u30c3\u30c8\u306f\u4ee5\u4e0b\u3067\u3059\u3002\n\n```\ntimestamp src > dst: flags  \n```\n* timestamp: \u30bf\u30a4\u30e0\u30b9\u30bf\u30f3\u30d7\n* src: \u9001\u4fe1\u5143IP.\u30dd\u30fc\u30c8\n* dst: \u9001\u4fe1\u5148IP.\u30dd\u30fc\u30c8\n* flags: \u30d5\u30e9\u30b0 F (FIN), \u2018.\u2019 (no flags)\n\nTCP\u30af\u30e9\u30a4\u30a2\u30f3\u30c8(telnet)\u3001TCP\u30b5\u30fc\u30d0\u30fc(nc)\u53cc\u65b9\u3067\u3001FIN/ACK\u3092\u9001\u4fe1\u3057\u3001\u30b3\u30cd\u30af\u30b7\u30e7\u30f3\u3092\u7d42\u4e86\u3057\u307e\u3059\u3002\n"}