{"tags": ["TCP", "tcpdump", "iptables"], "context": "\n\nTCP\u306e\u30b3\u30cd\u30af\u30b7\u30e7\u30f3\u30bf\u30a4\u30e0\u30a2\u30a6\u30c8\nTCP\u3067\u30c7\u30fc\u30bf\u3092\u8ee2\u9001\u3059\u308b\u5834\u5408\u3001\u30c7\u30fc\u30bf\u306e\u8ee2\u9001\u3092\u884c\u3046\u524d\u306b\u30b3\u30cd\u30af\u30b7\u30e7\u30f3\u3092\u78ba\u7acb\u3059\u308b\u5fc5\u8981\u304c\u3042\u308a\u307e\u3059\u3002\nTCP\u306e\u30b3\u30cd\u30af\u30b7\u30e7\u30f3\u30bf\u30a4\u30e0\u30a2\u30a6\u30c8\u306f\u3001TCP\u30af\u30e9\u30a4\u30a2\u30f3\u30c8\u304c\u30b3\u30cd\u30af\u30b7\u30e7\u30f3\u78ba\u7acb\u8981\u6c42\u3092\u767a\u884c\u3057\u305f\u5f8c\u3001TCP\u30b5\u30fc\u30d0\u30fc\u304b\u3089\u4e00\u5b9a\u6642\u9593\u5fdc\u7b54\u304c\u306a\u3044\u5834\u5408\u306b\u8d77\u3053\u308a\u307e\u3059\u3002\nTCP\u306e\u30b3\u30cd\u30af\u30b7\u30e7\u30f3\u306b\u3064\u3044\u3066\u306e\u8a73\u7d30\u306f\u4ee5\u4e0b\u306e\u30a8\u30f3\u30c8\u30ea\u3092\u53c2\u7167\u3057\u3066\u304f\u3060\u3055\u3044\u3002\ntcpdump\u3067\u7406\u89e3\u3059\u308bTCP\u306e\u30b3\u30cd\u30af\u30b7\u30e7\u30f3\n\u30bf\u30a4\u30e0\u30a2\u30a6\u30c8\u306f\u3001OS\u306e\u8a2d\u5b9a\u306b\u3088\u308b\u30b3\u30cd\u30af\u30b7\u30e7\u30f3\u78ba\u7acb\u8981\u6c42\u306e\u518d\u9001\u56de\u6570\u3001\u307e\u305f\u306f\u30a2\u30d7\u30ea\u30b1\u30fc\u30b7\u30e7\u30f3\u3067\u30bf\u30a4\u30e0\u30a2\u30a6\u30c8\u3092\u5b9f\u88c5\u3057\u3066\u3044\u308b\u5834\u5408\u306f\u30a2\u30d7\u30ea\u30b1\u30fc\u30b7\u30e7\u30f3\u306e\u8a2d\u5b9a\u306b\u4f9d\u5b58\u3057\u3001\u77ed\u3044\u65b9\u304c\u9069\u7528\u3055\u308c\u307e\u3059\u3002\n\u4e0a\u8a18\u306e\u30b3\u30cd\u30af\u30b7\u30e7\u30f3\u78ba\u7acb\u8981\u6c42\u306e\u518d\u9001\u53ca\u3073\u30b3\u30cd\u30af\u30b7\u30e7\u30f3\u30bf\u30a4\u30e0\u30a2\u30a6\u30c8\u3092iptables\u30b3\u30de\u30f3\u30c9\u3068tcpdump\u30b3\u30de\u30f3\u30c9\u3067\u5b9f\u969b\u306b\u78ba\u8a8d\u3057\u3066\u884c\u304d\u307e\u3059\u3002\n\u672c\u624b\u9806\u3067\u306eiptables\u306e\u64cd\u4f5c\u306f\u3001\u8a66\u9a13\u74b0\u5883\u3084\u30ed\u30fc\u30ab\u30eb\u306eVM\u7b49\u306e\u5916\u90e8\u304b\u3089\u9589\u3058\u3089\u308c\u305f\u74b0\u5883\u3092\u60f3\u5b9a\u3057\u3066\u3044\u307e\u3059\u3002\u5916\u90e8\u306b\u516c\u958b\u3057\u3066\u3044\u308b\u3088\u3046\u306a\u30bb\u30ad\u30e5\u30ea\u30c6\u30a3\u5bfe\u7b56\u304c\u5fc5\u8981\u306a\u74b0\u5883\u3067\u306f\u884c\u308f\u306a\u3044\u3067\u4e0b\u3055\u3044\u3002\n\ntcpdump\u3068iptables\u3067\u7406\u89e3\u3059\u308bTCP\u306e\u30b3\u30cd\u30af\u30b7\u30e7\u30f3\u30bf\u30a4\u30e0\u30a2\u30a6\u30c8\n\n0.\u524d\u6e96\u5099\n\n\u4f7f\u7528\u3059\u308b\u30cd\u30c3\u30c8\u30ef\u30fc\u30af\u30b3\u30de\u30f3\u30c9\n\u672c\u30a8\u30f3\u30c8\u30ea\u3067\u306f\u3001\u4ee5\u4e0b\u306eLinux\u30b3\u30de\u30f3\u30c9\u3092\u4f7f\u7528\u3057\u307e\u3059\u3002\n\ntcpdump\n\n\n\u30cd\u30c3\u30c8\u30ef\u30fc\u30af\u4e0a\u306e\u30d1\u30b1\u30c3\u30c8\u3092\u51fa\u529b\u3059\u308b\u305f\u3081\u306b\u4f7f\u7528\u3057\u307e\u3059\u3002\n\n\nnc,telnet\n\n\ntcp\u30b5\u30fc\u30d0\u30fc/\u30af\u30e9\u30a4\u30a2\u30f3\u30c8\u3068\u3057\u3066\u4f7f\u7528\u3057\u307e\u3059\u3002\n\n\nnetstat\n\n\n\u30b3\u30cd\u30af\u30b7\u30e7\u30f3\u306e\u72b6\u614b\u3092\u78ba\u8a8d\u3059\u308b\u305f\u3081\u306b\u4f7f\u7528\u3057\u307e\u3059\u3002\n\n\niptables\n\n\n\u30b3\u30cd\u30af\u30b7\u30e7\u30f3\u78ba\u7acb\u8981\u6c42\u3092DROP\u3059\u308b\u305f\u3081\u306b\u4f7f\u7528\u3057\u307e\u3059\u3002\n\n\n\n\u4e0a\u8a18\u30b3\u30de\u30f3\u30c9\u304c\u30a4\u30f3\u30b9\u30c8\u30fc\u30eb\u3055\u308c\u3066\u3044\u306a\u3044\u5834\u5408\u3001\u4ee5\u4e0b\u306e\u30b3\u30de\u30f3\u30c9\u3067\u30a4\u30f3\u30b9\u30c8\u30fc\u30eb\u3057\u307e\u3059\u3002\n$ sudo yum -y install tcpdump nc telnet net-tools iptables\n\n\n1. \u30b3\u30cd\u30af\u30b7\u30e7\u30f3\u306e\u78ba\u8a8d\n\u4ee5\u4e0b\u306e\u30a8\u30f3\u30c8\u30ea\u306e1.2.\u306e\u624b\u9806\u3092\u5b9f\u65bd\u3057\u3066\u3001\u30b3\u30cd\u30af\u30b7\u30e7\u30f3\u306e\u78ba\u7acb\u304c\u3067\u304d\u308b\u4e8b\u3092\u78ba\u8a8d\u3057\u3066\u304f\u3060\u3055\u3044\u3002\ntcpdump\u3067\u7406\u89e3\u3059\u308bTCP\u306e\u30b3\u30cd\u30af\u30b7\u30e7\u30f3\n\n1. TCP\u30b5\u30fc\u30d0\u306e\u8d77\u52d5\n2. TCP\u30af\u30e9\u30a4\u30a2\u30f3\u30c8\u306e\u8d77\u52d5\u3001\u30b3\u30cd\u30af\u30b7\u30e7\u30f3\u306e\u78ba\u7acb\u3002\n\n\u307e\u305f\u30011.\u306e\u624b\u9806\u306b\u3066\u3001nc\u30b3\u30de\u30f3\u30c9\u3067\u8d77\u52d5\u3057\u305fTCP\u30b5\u30fc\u30d0\u30fc\u306f\u8d77\u52d5\u3057\u305f\u307e\u307e\u3068\u3057\u3066\u304a\u3044\u3066\u304f\u3060\u3055\u3044\u3002\n\n2. iptables\u306e\u524d\u6e96\u5099\n(\u672c\u624b\u9806\u3067\u306eiptables\u306e\u64cd\u4f5c\u306f\u3001\u8a66\u9a13\u74b0\u5883\u3084\u30ed\u30fc\u30ab\u30eb\u306eVM\u7b49\u306e\u5916\u90e8\u304b\u3089\u9589\u3058\u3089\u308c\u305f\u74b0\u5883\u3092\u60f3\u5b9a\u3057\u3066\u3044\u307e\u3059\u3002\n\u5916\u90e8\u306b\u516c\u958b\u3057\u3066\u3044\u308b\u3088\u3046\u306a\u30bb\u30ad\u30e5\u30ea\u30c6\u30a3\u5bfe\u7b56\u304c\u5fc5\u8981\u306a\u74b0\u5883\u3067\u306f\u884c\u308f\u306a\u3044\u3067\u4e0b\u3055\u3044\u3002)\niptables\u30b3\u30de\u30f3\u30c9\u3067lo interface\u306e\u901a\u4fe1\u3092\u5168\u3066\u8a31\u53ef\u3057\u3066\u3044\u308b\u30eb\u30fc\u30eb\u3001\u53ca\u3073\u30d1\u30b1\u30c3\u30c8\u3092REJECT\u3057\u3066\u3044\u308b\u30eb\u30fc\u30eb\u3092\u524a\u9664\u3057\u307e\u3059\u3002\n$ sudo iptables -D INPUT -i lo -j ACCEPT\n$ sudo iptables -D INPUT -j REJECT --reject-with icmp-host-prohibited \n$ sudo iptables -n -L INPUT \n\n\u307e\u305f\u306f\u3001service\u30b3\u30de\u30f3\u30c9\u3067iptable\u306estop\u3092\u884c\u3063\u3066\u4e0b\u3055\u3044\u3002\n$ sudo service iptables stop\n$ sudo iptables -n -L INPUT \n\niptables\u306e-L\u30aa\u30d7\u30b7\u30e7\u30f3\u306e\u5b9f\u884c\u7d50\u679c\u306b\u4ee5\u4e0b\u306e\u30eb\u30fc\u30eb\u304c\u5b58\u5728\u3057\u306a\u3044\u3053\u3068\u3092\u78ba\u8a8d\u3057\u307e\u3059\u3002\nACCEPT     all  --  0.0.0.0/0            0.0.0.0/0           \nREJECT     all  --  0.0.0.0/0            0.0.0.0/0           reject-with icmp-host-prohibited \n\n\n3. iptables\u3067\u306e\u30b3\u30cd\u30af\u30b7\u30e7\u30f3\u78ba\u7acb\u8981\u6c42(SYN\u30d1\u30b1\u30c3\u30c8)\u306e\u30d1\u30b1\u30c3\u30c8\u5ec3\u68c4(DROP)\niptables\u30b3\u30de\u30f3\u30c9\u3067\u3001\u30b3\u30cd\u30af\u30b7\u30e7\u30f3\u78ba\u7acb\u8981\u6c42(SYN\u30d1\u30b1\u30c3\u30c8)\u306e\u30d1\u30b1\u30c3\u30c8\u5ec3\u68c4(DROP)\u306e\u305f\u3081\u306e\u30eb\u30fc\u30eb\u3092\u8a2d\u5b9a\u3057\u307e\u3059\u3002\n$ sudo iptables -A INPUT -p tcp -d 127.0.0.1 --dport 12345 -j DROP\n$ sudo iptables -n -L INPUT \n\niptables\u306e-L\u30aa\u30d7\u30b7\u30e7\u30f3\u306e\u5b9f\u884c\u7d50\u679c\u306b\u4ee5\u4e0b\u306e\u30eb\u30fc\u30eb\u304c\u5b58\u5728\u3059\u308b\u3053\u3068\u3092\u78ba\u8a8d\u3057\u307e\u3059\u3002\nDROP       tcp  --  0.0.0.0/0            127.0.0.1           tcp dpt:12345 \n\n\u3053\u306e\u72b6\u614b\u3067\u4ee5\u4e0b\u306e\u30b3\u30de\u30f3\u30c9\u3092\u5b9f\u884c\u3057\u307e\u3059\u3002\n$ telnet 127.0.0.1 12345\nTrying 127.0.0.1...\n\n\u4e0a\u8a18\u306e\u51fa\u529b\u306e\u307e\u307e\u3001\u4f55\u3082\u53cd\u5fdc\u306a\u3051\u308c\u3070\u6210\u529f\u3067\u3059\u3002\u9069\u5f53\u306a\u6642\u9593\u3067[Ctrl + C]\u3067\u30b3\u30de\u30f3\u30c9\u5b9f\u884c\u3092\u505c\u6b62\u3057\u3066\u304f\u3060\u3055\u3044\u3002\n\u3053\u308c\u3067\u3001\u30b3\u30cd\u30af\u30b7\u30e7\u30f3\u30bf\u30a4\u30e0\u30a2\u30a6\u30c8\u3092tcpdump\u3067\u78ba\u8a8d\u3059\u308b\u6e96\u5099\u304c\u3067\u304d\u307e\u3057\u305f\u3002\n\n3. tcpdump\u3067\u306e\u30b3\u30cd\u30af\u30b7\u30e7\u30f3\u78ba\u7acb\u8981\u6c42(SYN\u30d1\u30b1\u30c3\u30c8)\u306e\u518d\u9001\u3001\u30b3\u30cd\u30af\u30b7\u30e7\u30f3\u30bf\u30a4\u30e0\u30a2\u30a6\u30c8\u3092\u76ee\u8996\u3059\u308b\u3002\n\u5225\u30bf\u30fc\u30df\u30ca\u30eb\u3067tcpdump\u30b3\u30de\u30f3\u30c9\u3067local interface\u306eport12345\u3092\u6307\u5b9a\u3057\u3066\u5b9f\u884c\u3057\u307e\u3059\u3002\n$ sudo tcpdump -i lo -nnn port 12345\ntcpdump: verbose output suppressed, use -v or -vv for full protocol decode\nlistening on lo, link-type EN10MB (Ethernet), capture size 65535 bytes\n\n2.\u306e\u624b\u9806\u3068\u540c\u69d8\u306btelnet\u30b3\u30de\u30f3\u30c9\u3092time\u30b3\u30de\u30f3\u30c9\u3092\u3064\u3051\u3066\u5b9f\u884c\u3057\u307e\u3059\u3002\u7d041\u5206\u5c11\u3005\u5f85\u3064\u3068\u3001telnet\u30b3\u30de\u30f3\u30c9\u304c\u30b3\u30cd\u30af\u30b7\u30e7\u30f3\u30bf\u30a4\u30e0\u3057\u307e\u3059\u3002\n$ time telnet 127.0.0.1 12345\nTrying 127.0.0.1...\ntelnet: connect to address 127.0.0.1: Connection timed out\n\nreal    1m3.xxxs\n...\n$ \n\ntcpdump\u306e\u51fa\u529b\u3092\u78ba\u8a8d\u3057\u307e\u3059\u3002\n17:37:32.908573 IP 127.0.0.1.60632 > 127.0.0.1.12345: Flags [S], seq <seq num>, ...\n17:37:33.907642 IP 127.0.0.1.60632 > 127.0.0.1.12345: Flags [S], seq <seq num>, ...\n17:37:35.907653 IP 127.0.0.1.60632 > 127.0.0.1.12345: Flags [S], seq <seq num>, ... \n17:37:39.908743 IP 127.0.0.1.60632 > 127.0.0.1.12345: Flags [S], seq <seq num>, ... \n17:37:47.909561 IP 127.0.0.1.60632 > 127.0.0.1.12345: Flags [S], seq <seq num>, ...\n17:38:03.910784 IP 127.0.0.1.60632 > 127.0.0.1.12345: Flags [S], seq <seq num>, ...\n\n\u4e0a\u8a18\u306etcpdump\u306e\u51fa\u529b\u30d5\u30a9\u30fc\u30de\u30c3\u30c8\u306f\u4ee5\u4e0b\u306e\u901a\u308a\u3067\u3059\u3002\ntimestamp src > dst: flags data-seqno\n\n\ntimestamp: \u30bf\u30a4\u30e0\u30b9\u30bf\u30f3\u30d7\nsrc: \u9001\u4fe1\u5143IP.\u30dd\u30fc\u30c8\ndst: \u9001\u4fe1\u5148IP.\u30dd\u30fc\u30c8\nflags: \u30d5\u30e9\u30b0 S (SYN)\ndata-seqno: \u30b7\u30fc\u30b1\u30f3\u30b9\u756a\u53f7(\u4e0a\u8a18\u306fSYN\u30d1\u30b1\u30c3\u30c8\u306e\u307f\u306a\u306e\u3067\u521d\u671f\u30b7\u30fc\u30b1\u30f3\u30b9\u756a\u53f7) \n\n\u4e0a\u8a18\u306e\u30d1\u30b1\u30c3\u30c8\u30ad\u30e3\u30d7\u30c1\u30e3\u306f\u3001TCP\u30af\u30e9\u30a2\u30f3\u30c8\u304c\u30b3\u30cd\u30af\u30b7\u30e7\u30f3\u78ba\u7acb\u8981\u6c42\u3092\u9001\u4fe1\u3057\u305f\u304c\u3001\u5fdc\u7b54\u304c\u306a\u3044\u305f\u3081\u3001\u518d\u9001\u3092\u884c\u3044\u4e00\u5b9a\u56de\u6570\u306e\u518d\u9001\u3092\u884c\u3063\u305f\u5f8c\u3001\u30bf\u30a4\u30e0\u30a2\u30a6\u30c8\u3057\u305f\u3053\u3068\u3092\u793a\u3057\u3066\u3044\u307e\u3059\u3002\n\u4e00\u5b9a\u56de\u6570\u306f\u4ee5\u4e0b\u306ekernel parameters\u306e\u8a2d\u5b9a\u306b\u4f9d\u5b58\u3057\u307e\u3059\u3002\n$ sysctl -n net.ipv4.tcp_syn_retries\n5\n$ \n\n\u4ee5\u4e0b\u306f\u30b7\u30fc\u30b1\u30f3\u30b9\u306e\u6982\u8981\u3067\u3059\u3002\n\n\u307e\u305f\u3001\u518d\u9001\u3092\u884c\u3063\u3066\u3044\u308b\u9593\u306bnetstat\u30b3\u30de\u30f3\u30c9\u3067\u30b3\u30cd\u30af\u30b7\u30e7\u30f3\u306e\u72b6\u614b\u3092\u78ba\u8a8d\u3059\u308b\u3068\u3001\u4ee5\u4e0b\u306e\u3088\u3046\u306bSYN_SENT\u3067\u3042\u308b\u3053\u3068\u304c\u78ba\u8a8d\u3067\u304d\u307e\u3059\u3002\n$ sudo netstat -anp | grep 12345\ntcp  0  1 127.0.0.1:<port>  127.0.0.1:12345  SYN_SENT  <PID>/telnet        \n$ \n\n## TCP\u306e\u30b3\u30cd\u30af\u30b7\u30e7\u30f3\u30bf\u30a4\u30e0\u30a2\u30a6\u30c8\n\nTCP\u3067\u30c7\u30fc\u30bf\u3092\u8ee2\u9001\u3059\u308b\u5834\u5408\u3001\u30c7\u30fc\u30bf\u306e\u8ee2\u9001\u3092\u884c\u3046\u524d\u306b\u30b3\u30cd\u30af\u30b7\u30e7\u30f3\u3092\u78ba\u7acb\u3059\u308b\u5fc5\u8981\u304c\u3042\u308a\u307e\u3059\u3002\nTCP\u306e\u30b3\u30cd\u30af\u30b7\u30e7\u30f3\u30bf\u30a4\u30e0\u30a2\u30a6\u30c8\u306f\u3001TCP\u30af\u30e9\u30a4\u30a2\u30f3\u30c8\u304c\u30b3\u30cd\u30af\u30b7\u30e7\u30f3\u78ba\u7acb\u8981\u6c42\u3092\u767a\u884c\u3057\u305f\u5f8c\u3001TCP\u30b5\u30fc\u30d0\u30fc\u304b\u3089\u4e00\u5b9a\u6642\u9593\u5fdc\u7b54\u304c\u306a\u3044\u5834\u5408\u306b\u8d77\u3053\u308a\u307e\u3059\u3002\n\nTCP\u306e\u30b3\u30cd\u30af\u30b7\u30e7\u30f3\u306b\u3064\u3044\u3066\u306e\u8a73\u7d30\u306f\u4ee5\u4e0b\u306e\u30a8\u30f3\u30c8\u30ea\u3092\u53c2\u7167\u3057\u3066\u304f\u3060\u3055\u3044\u3002\n[tcpdump\u3067\u7406\u89e3\u3059\u308bTCP\u306e\u30b3\u30cd\u30af\u30b7\u30e7\u30f3](http://qiita.com/keikmobile/items/93cf6dc5b95019c6a442)\n\n\u30bf\u30a4\u30e0\u30a2\u30a6\u30c8\u306f\u3001OS\u306e\u8a2d\u5b9a\u306b\u3088\u308b\u30b3\u30cd\u30af\u30b7\u30e7\u30f3\u78ba\u7acb\u8981\u6c42\u306e\u518d\u9001\u56de\u6570\u3001\u307e\u305f\u306f\u30a2\u30d7\u30ea\u30b1\u30fc\u30b7\u30e7\u30f3\u3067\u30bf\u30a4\u30e0\u30a2\u30a6\u30c8\u3092\u5b9f\u88c5\u3057\u3066\u3044\u308b\u5834\u5408\u306f\u30a2\u30d7\u30ea\u30b1\u30fc\u30b7\u30e7\u30f3\u306e\u8a2d\u5b9a\u306b\u4f9d\u5b58\u3057\u3001\u77ed\u3044\u65b9\u304c\u9069\u7528\u3055\u308c\u307e\u3059\u3002\n\n\u4e0a\u8a18\u306e\u30b3\u30cd\u30af\u30b7\u30e7\u30f3\u78ba\u7acb\u8981\u6c42\u306e\u518d\u9001\u53ca\u3073\u30b3\u30cd\u30af\u30b7\u30e7\u30f3\u30bf\u30a4\u30e0\u30a2\u30a6\u30c8\u3092iptables\u30b3\u30de\u30f3\u30c9\u3068tcpdump\u30b3\u30de\u30f3\u30c9\u3067\u5b9f\u969b\u306b\u78ba\u8a8d\u3057\u3066\u884c\u304d\u307e\u3059\u3002\n\u672c\u624b\u9806\u3067\u306eiptables\u306e\u64cd\u4f5c\u306f\u3001\u8a66\u9a13\u74b0\u5883\u3084\u30ed\u30fc\u30ab\u30eb\u306eVM\u7b49\u306e\u5916\u90e8\u304b\u3089\u9589\u3058\u3089\u308c\u305f\u74b0\u5883\u3092\u60f3\u5b9a\u3057\u3066\u3044\u307e\u3059\u3002\u5916\u90e8\u306b\u516c\u958b\u3057\u3066\u3044\u308b\u3088\u3046\u306a\u30bb\u30ad\u30e5\u30ea\u30c6\u30a3\u5bfe\u7b56\u304c\u5fc5\u8981\u306a\u74b0\u5883\u3067\u306f\u884c\u308f\u306a\u3044\u3067\u4e0b\u3055\u3044\u3002\n\n## tcpdump\u3068iptables\u3067\u7406\u89e3\u3059\u308bTCP\u306e\u30b3\u30cd\u30af\u30b7\u30e7\u30f3\u30bf\u30a4\u30e0\u30a2\u30a6\u30c8\n\n### 0.\u524d\u6e96\u5099\n\n#### \u4f7f\u7528\u3059\u308b\u30cd\u30c3\u30c8\u30ef\u30fc\u30af\u30b3\u30de\u30f3\u30c9\n\n\u672c\u30a8\u30f3\u30c8\u30ea\u3067\u306f\u3001\u4ee5\u4e0b\u306eLinux\u30b3\u30de\u30f3\u30c9\u3092\u4f7f\u7528\u3057\u307e\u3059\u3002\n\n* tcpdump\n * \u30cd\u30c3\u30c8\u30ef\u30fc\u30af\u4e0a\u306e\u30d1\u30b1\u30c3\u30c8\u3092\u51fa\u529b\u3059\u308b\u305f\u3081\u306b\u4f7f\u7528\u3057\u307e\u3059\u3002\n* nc,telnet\n * tcp\u30b5\u30fc\u30d0\u30fc/\u30af\u30e9\u30a4\u30a2\u30f3\u30c8\u3068\u3057\u3066\u4f7f\u7528\u3057\u307e\u3059\u3002\n* netstat\n * \u30b3\u30cd\u30af\u30b7\u30e7\u30f3\u306e\u72b6\u614b\u3092\u78ba\u8a8d\u3059\u308b\u305f\u3081\u306b\u4f7f\u7528\u3057\u307e\u3059\u3002\n* iptables\n * \u30b3\u30cd\u30af\u30b7\u30e7\u30f3\u78ba\u7acb\u8981\u6c42\u3092DROP\u3059\u308b\u305f\u3081\u306b\u4f7f\u7528\u3057\u307e\u3059\u3002\n\n\u4e0a\u8a18\u30b3\u30de\u30f3\u30c9\u304c\u30a4\u30f3\u30b9\u30c8\u30fc\u30eb\u3055\u308c\u3066\u3044\u306a\u3044\u5834\u5408\u3001\u4ee5\u4e0b\u306e\u30b3\u30de\u30f3\u30c9\u3067\u30a4\u30f3\u30b9\u30c8\u30fc\u30eb\u3057\u307e\u3059\u3002\n\n```\n$ sudo yum -y install tcpdump nc telnet net-tools iptables\n```\n\n### 1. \u30b3\u30cd\u30af\u30b7\u30e7\u30f3\u306e\u78ba\u8a8d\n\n\u4ee5\u4e0b\u306e\u30a8\u30f3\u30c8\u30ea\u306e1.2.\u306e\u624b\u9806\u3092\u5b9f\u65bd\u3057\u3066\u3001\u30b3\u30cd\u30af\u30b7\u30e7\u30f3\u306e\u78ba\u7acb\u304c\u3067\u304d\u308b\u4e8b\u3092\u78ba\u8a8d\u3057\u3066\u304f\u3060\u3055\u3044\u3002\n\n[tcpdump\u3067\u7406\u89e3\u3059\u308bTCP\u306e\u30b3\u30cd\u30af\u30b7\u30e7\u30f3](http://qiita.com/keikmobile/items/93cf6dc5b95019c6a442)\n\n* 1. TCP\u30b5\u30fc\u30d0\u306e\u8d77\u52d5\n* 2. TCP\u30af\u30e9\u30a4\u30a2\u30f3\u30c8\u306e\u8d77\u52d5\u3001\u30b3\u30cd\u30af\u30b7\u30e7\u30f3\u306e\u78ba\u7acb\u3002\n\n\u307e\u305f\u30011.\u306e\u624b\u9806\u306b\u3066\u3001nc\u30b3\u30de\u30f3\u30c9\u3067\u8d77\u52d5\u3057\u305fTCP\u30b5\u30fc\u30d0\u30fc\u306f\u8d77\u52d5\u3057\u305f\u307e\u307e\u3068\u3057\u3066\u304a\u3044\u3066\u304f\u3060\u3055\u3044\u3002\n\n### 2. iptables\u306e\u524d\u6e96\u5099\n\n(\u672c\u624b\u9806\u3067\u306eiptables\u306e\u64cd\u4f5c\u306f\u3001\u8a66\u9a13\u74b0\u5883\u3084\u30ed\u30fc\u30ab\u30eb\u306eVM\u7b49\u306e\u5916\u90e8\u304b\u3089\u9589\u3058\u3089\u308c\u305f\u74b0\u5883\u3092\u60f3\u5b9a\u3057\u3066\u3044\u307e\u3059\u3002\n\u5916\u90e8\u306b\u516c\u958b\u3057\u3066\u3044\u308b\u3088\u3046\u306a\u30bb\u30ad\u30e5\u30ea\u30c6\u30a3\u5bfe\u7b56\u304c\u5fc5\u8981\u306a\u74b0\u5883\u3067\u306f\u884c\u308f\u306a\u3044\u3067\u4e0b\u3055\u3044\u3002)\n\niptables\u30b3\u30de\u30f3\u30c9\u3067lo interface\u306e\u901a\u4fe1\u3092\u5168\u3066\u8a31\u53ef\u3057\u3066\u3044\u308b\u30eb\u30fc\u30eb\u3001\u53ca\u3073\u30d1\u30b1\u30c3\u30c8\u3092REJECT\u3057\u3066\u3044\u308b\u30eb\u30fc\u30eb\u3092\u524a\u9664\u3057\u307e\u3059\u3002\n\n```\n$ sudo iptables -D INPUT -i lo -j ACCEPT\n$ sudo iptables -D INPUT -j REJECT --reject-with icmp-host-prohibited \n$ sudo iptables -n -L INPUT \n```\n\n\u307e\u305f\u306f\u3001service\u30b3\u30de\u30f3\u30c9\u3067iptable\u306estop\u3092\u884c\u3063\u3066\u4e0b\u3055\u3044\u3002\n\n```\n$ sudo service iptables stop\n$ sudo iptables -n -L INPUT \n```\n\niptables\u306e-L\u30aa\u30d7\u30b7\u30e7\u30f3\u306e\u5b9f\u884c\u7d50\u679c\u306b\u4ee5\u4e0b\u306e\u30eb\u30fc\u30eb\u304c\u5b58\u5728\u3057\u306a\u3044\u3053\u3068\u3092\u78ba\u8a8d\u3057\u307e\u3059\u3002\n\n```\nACCEPT     all  --  0.0.0.0/0            0.0.0.0/0           \nREJECT     all  --  0.0.0.0/0            0.0.0.0/0           reject-with icmp-host-prohibited \n```\n\n### 3. iptables\u3067\u306e\u30b3\u30cd\u30af\u30b7\u30e7\u30f3\u78ba\u7acb\u8981\u6c42(SYN\u30d1\u30b1\u30c3\u30c8)\u306e\u30d1\u30b1\u30c3\u30c8\u5ec3\u68c4(DROP)\n\niptables\u30b3\u30de\u30f3\u30c9\u3067\u3001\u30b3\u30cd\u30af\u30b7\u30e7\u30f3\u78ba\u7acb\u8981\u6c42(SYN\u30d1\u30b1\u30c3\u30c8)\u306e\u30d1\u30b1\u30c3\u30c8\u5ec3\u68c4(DROP)\u306e\u305f\u3081\u306e\u30eb\u30fc\u30eb\u3092\u8a2d\u5b9a\u3057\u307e\u3059\u3002\n\n```\n$ sudo iptables -A INPUT -p tcp -d 127.0.0.1 --dport 12345 -j DROP\n$ sudo iptables -n -L INPUT \n```\n\niptables\u306e-L\u30aa\u30d7\u30b7\u30e7\u30f3\u306e\u5b9f\u884c\u7d50\u679c\u306b\u4ee5\u4e0b\u306e\u30eb\u30fc\u30eb\u304c\u5b58\u5728\u3059\u308b\u3053\u3068\u3092\u78ba\u8a8d\u3057\u307e\u3059\u3002\n\n```\nDROP       tcp  --  0.0.0.0/0            127.0.0.1           tcp dpt:12345 \n```\n\n\u3053\u306e\u72b6\u614b\u3067\u4ee5\u4e0b\u306e\u30b3\u30de\u30f3\u30c9\u3092\u5b9f\u884c\u3057\u307e\u3059\u3002\n\n```\n$ telnet 127.0.0.1 12345\nTrying 127.0.0.1...\n```\n\n\u4e0a\u8a18\u306e\u51fa\u529b\u306e\u307e\u307e\u3001\u4f55\u3082\u53cd\u5fdc\u306a\u3051\u308c\u3070\u6210\u529f\u3067\u3059\u3002\u9069\u5f53\u306a\u6642\u9593\u3067[Ctrl + C]\u3067\u30b3\u30de\u30f3\u30c9\u5b9f\u884c\u3092\u505c\u6b62\u3057\u3066\u304f\u3060\u3055\u3044\u3002\n\u3053\u308c\u3067\u3001\u30b3\u30cd\u30af\u30b7\u30e7\u30f3\u30bf\u30a4\u30e0\u30a2\u30a6\u30c8\u3092tcpdump\u3067\u78ba\u8a8d\u3059\u308b\u6e96\u5099\u304c\u3067\u304d\u307e\u3057\u305f\u3002\n\n### 3. tcpdump\u3067\u306e\u30b3\u30cd\u30af\u30b7\u30e7\u30f3\u78ba\u7acb\u8981\u6c42(SYN\u30d1\u30b1\u30c3\u30c8)\u306e\u518d\u9001\u3001\u30b3\u30cd\u30af\u30b7\u30e7\u30f3\u30bf\u30a4\u30e0\u30a2\u30a6\u30c8\u3092\u76ee\u8996\u3059\u308b\u3002\n\n\u5225\u30bf\u30fc\u30df\u30ca\u30eb\u3067tcpdump\u30b3\u30de\u30f3\u30c9\u3067local interface\u306eport12345\u3092\u6307\u5b9a\u3057\u3066\u5b9f\u884c\u3057\u307e\u3059\u3002\n\n```\n$ sudo tcpdump -i lo -nnn port 12345\ntcpdump: verbose output suppressed, use -v or -vv for full protocol decode\nlistening on lo, link-type EN10MB (Ethernet), capture size 65535 bytes\n```\n\n2.\u306e\u624b\u9806\u3068\u540c\u69d8\u306btelnet\u30b3\u30de\u30f3\u30c9\u3092time\u30b3\u30de\u30f3\u30c9\u3092\u3064\u3051\u3066\u5b9f\u884c\u3057\u307e\u3059\u3002\u7d041\u5206\u5c11\u3005\u5f85\u3064\u3068\u3001telnet\u30b3\u30de\u30f3\u30c9\u304c\u30b3\u30cd\u30af\u30b7\u30e7\u30f3\u30bf\u30a4\u30e0\u3057\u307e\u3059\u3002\n\n```\n$ time telnet 127.0.0.1 12345\nTrying 127.0.0.1...\ntelnet: connect to address 127.0.0.1: Connection timed out\n\nreal    1m3.xxxs\n...\n$ \n````\n\ntcpdump\u306e\u51fa\u529b\u3092\u78ba\u8a8d\u3057\u307e\u3059\u3002\n\n\n```\n17:37:32.908573 IP 127.0.0.1.60632 > 127.0.0.1.12345: Flags [S], seq <seq num>, ...\n17:37:33.907642 IP 127.0.0.1.60632 > 127.0.0.1.12345: Flags [S], seq <seq num>, ...\n17:37:35.907653 IP 127.0.0.1.60632 > 127.0.0.1.12345: Flags [S], seq <seq num>, ... \n17:37:39.908743 IP 127.0.0.1.60632 > 127.0.0.1.12345: Flags [S], seq <seq num>, ... \n17:37:47.909561 IP 127.0.0.1.60632 > 127.0.0.1.12345: Flags [S], seq <seq num>, ...\n17:38:03.910784 IP 127.0.0.1.60632 > 127.0.0.1.12345: Flags [S], seq <seq num>, ...\n```\n\n\u4e0a\u8a18\u306etcpdump\u306e\u51fa\u529b\u30d5\u30a9\u30fc\u30de\u30c3\u30c8\u306f\u4ee5\u4e0b\u306e\u901a\u308a\u3067\u3059\u3002\n\n```\ntimestamp src > dst: flags data-seqno\n```\n* timestamp: \u30bf\u30a4\u30e0\u30b9\u30bf\u30f3\u30d7\n* src: \u9001\u4fe1\u5143IP.\u30dd\u30fc\u30c8\n* dst: \u9001\u4fe1\u5148IP.\u30dd\u30fc\u30c8\n* flags: \u30d5\u30e9\u30b0 S (SYN)\n* data-seqno: \u30b7\u30fc\u30b1\u30f3\u30b9\u756a\u53f7(\u4e0a\u8a18\u306fSYN\u30d1\u30b1\u30c3\u30c8\u306e\u307f\u306a\u306e\u3067\u521d\u671f\u30b7\u30fc\u30b1\u30f3\u30b9\u756a\u53f7) \n\n\u4e0a\u8a18\u306e\u30d1\u30b1\u30c3\u30c8\u30ad\u30e3\u30d7\u30c1\u30e3\u306f\u3001TCP\u30af\u30e9\u30a2\u30f3\u30c8\u304c\u30b3\u30cd\u30af\u30b7\u30e7\u30f3\u78ba\u7acb\u8981\u6c42\u3092\u9001\u4fe1\u3057\u305f\u304c\u3001\u5fdc\u7b54\u304c\u306a\u3044\u305f\u3081\u3001\u518d\u9001\u3092\u884c\u3044\u4e00\u5b9a\u56de\u6570\u306e\u518d\u9001\u3092\u884c\u3063\u305f\u5f8c\u3001\u30bf\u30a4\u30e0\u30a2\u30a6\u30c8\u3057\u305f\u3053\u3068\u3092\u793a\u3057\u3066\u3044\u307e\u3059\u3002\n\u4e00\u5b9a\u56de\u6570\u306f\u4ee5\u4e0b\u306ekernel parameters\u306e\u8a2d\u5b9a\u306b\u4f9d\u5b58\u3057\u307e\u3059\u3002\n\n```\n$ sysctl -n net.ipv4.tcp_syn_retries\n5\n$ \n```\n\n\u4ee5\u4e0b\u306f\u30b7\u30fc\u30b1\u30f3\u30b9\u306e\u6982\u8981\u3067\u3059\u3002\n\n![tcp_con_timeout.png](https://qiita-image-store.s3.amazonaws.com/0/22861/72cf3dad-840a-3e2c-a2a4-a3e1df09db35.png)\n\n\n\u307e\u305f\u3001\u518d\u9001\u3092\u884c\u3063\u3066\u3044\u308b\u9593\u306bnetstat\u30b3\u30de\u30f3\u30c9\u3067\u30b3\u30cd\u30af\u30b7\u30e7\u30f3\u306e\u72b6\u614b\u3092\u78ba\u8a8d\u3059\u308b\u3068\u3001\u4ee5\u4e0b\u306e\u3088\u3046\u306bSYN_SENT\u3067\u3042\u308b\u3053\u3068\u304c\u78ba\u8a8d\u3067\u304d\u307e\u3059\u3002\n\n```\n$ sudo netstat -anp | grep 12345\ntcp  0  1 127.0.0.1:<port>  127.0.0.1:12345  SYN_SENT  <PID>/telnet        \n$ \n```\n"}