{"context": " More than 1 year has passed since last update.mirage-skeleton\u306eping\u306e\u30b5\u30f3\u30d7\u30eb\u3092\u8a66\u3057\u3066\u307f\u305f\u3051\u3069xen\u4e0a\u3067\u3046\u307e\u3044\u3053\u3068\u52d5\u304b\u305b\u306a\u304b\u3063\u305f\u3002\n\u307e\u305a\u3001unix\u306e\u307b\u3046\u3002\u666e\u901a\u306b\u30d3\u30eb\u30c9\u3057\u3066\u52d5\u304b\u3059\u3002\ntap0\u306e\u30a4\u30f3\u30bf\u30d5\u30a7\u30fc\u30b9\u3092\u4f5c\u308b\u306e\u3067\u5b9f\u884c\u306b\u306f\u7ba1\u7406\u8005\u6a29\u9650\u304c\u5fc5\u8981\u307f\u305f\u3044\u3002\n% mirage configure --unix\n% mirage build\n% sudo ./mir-ping\n\n\u3053\u308c\u3067tap0\u3068\u3044\u3046\u306e\u304c\u4f5c\u3089\u308c\u308b\u306e\u3067\u3001ip\u30a2\u30c9\u30ec\u30b9\u3092\u8a2d\u5b9a\u3059\u308b\u3068ping\u304c\u901a\u308b\u3088\u3046\u306b\u306a\u308b\u3002\nmirage\u306e\u307b\u3046\u306f\u30c7\u30d5\u30a9\u30eb\u30c8\u306710.0.0.2\u306eip\u30a2\u30c9\u30ec\u30b9\u304c\u8a2d\u5b9a\u3055\u308c\u3066\u3044\u305f\u3002\n% sudo ip addr add 10.0.0.1/24 dev tap0\n% ping 10.0.0.2\n\n\u3053\u308c\u3067\u5fdc\u7b54\u304c\u5e30\u3063\u3066\u304f\u308c\u3070\u3088\u3044\u3002\n\u3067\u3001\u6b21\u306bxen\u306e\u307b\u3046\u3002\u30d3\u30eb\u30c9\u307e\u3067\u306f\u307b\u307c\u540c\u3058\u3002\n% mirage configure --xen\n% mirage build\n\nping.xl\u3068\u3044\u3046\u540d\u524d\u3067domU\u306e\u8a2d\u5b9a\u30d5\u30a1\u30a4\u30eb\u304c\u3067\u304d\u308b\u306e\u3067vif\u306e\u3068\u3053\u308d\u3092\u7de8\u96c6\u3059\u308b\u3002\n\u3088\u304f\u308f\u304b\u3063\u3066\u306a\u3044\u3051\u3069\u3053\u3093\u306a\u611f\u3058\u306b\u3057\u305f\u3002\u3042\u3089\u304b\u3058\u3081mirbr0\u3068\u3044\u3046\u540d\u524d\u3067\u30d6\u30ea\u30c3\u30b8\u3092\u3064\u304f\u3063\u3066\u304a\u304f\u3002\nvif = [ 'bridge=mirbr0,vifname=mirtap0' ]\n\ndomU\u3092\u8d77\u52d5\u3059\u308b\u3002\n% sudo xl create -c ping.xl\n\nunix\u306e\u3068\u304d\u3068\u540c\u3058\u3088\u3046\u306bmirtap0\u3068\u3044\u3046\u30a4\u30f3\u30bf\u30d5\u30a7\u30fc\u30b9\u304c\u4f5c\u3089\u308c\u308b\u306e\u3067ip\u30a2\u30c9\u30ec\u30b9\u3092\u8a2d\u5b9a\u3059\u308b\u3002\n% sudo ip addr add 10.0.0.2/24 dev mirtap0\n\n\u540c\u3058\u3088\u3046\u306bping\u3092\u6253\u3063\u3066\u307f\u3066\u3082\u5fdc\u7b54\u304c\u8fd4\u3063\u3066\u3053\u306a\u304b\u3063\u305f\u3002\n% ping 10.0.0.2\nPING 10.0.0.2 (10.0.0.2) 56(84) bytes of data.\nFrom 10.0.0.1 icmp_seq=1 Destination Host Unreachable\nFrom 10.0.0.1 icmp_seq=2 Destination Host Unreachable\nFrom 10.0.0.1 icmp_seq=3 Destination Host Unreachable\n^C\n--- 10.0.0.2 ping statistics ---\n4 packets transmitted, 0 received, +3 errors, 100% packet loss, time 3016ms\n\n\u8a66\u3057\u306btcpdump\u3057\u3066\u307f\u308b\u3068arp reply\u306f\u8fd4\u3063\u3066\u304d\u3066\u3044\u308b\u3089\u3057\u3044\u3002\n% sudo tcpdump -i mirtap0 -vv\ntcpdump: listening on mirtap0, link-type EN10MB (Ethernet), capture size 65535 bytes\n20:14:00.808886 ARP, Ethernet (len 6), IPv4 (len 4), Request who-has 10.0.0.2 tell 10.0.0.1, length 28\n20:14:00.809100 ARP, Ethernet (len 6), IPv4 (len 4), Reply 10.0.0.2 is-at c0:ff:ee:c0:ff:ee (oui Unknown), length 28\n20:14:01.827181 ARP, Ethernet (len 6), IPv4 (len 4), Request who-has 10.0.0.2 tell 10.0.0.1, length 28\n20:14:01.827371 ARP, Ethernet (len 6), IPv4 (len 4), Reply 10.0.0.2 is-at c0:ff:ee:c0:ff:ee (oui Unknown), length 28\n^C\n16 packets captured\n16 packets received by filter\n0 packets dropped by kernel\n\n\u305f\u3060\u3001\u30a2\u30c9\u30ec\u30b9\u89e3\u6c7a\u304c\u3067\u304d\u3066\u3044\u306a\u3044\u3063\u307d\u3044\u3002\n% cat /proc/net/arp\nIP address       HW type     Flags       HW address            Mask     Device\n10.0.0.2         0x1         0x0         00:00:00:00:00:00     *        mirtap0\n\n\u3060\u308c\u304b\u89e3\u6c7a\u65b9\u6cd5\u6559\u3048\u3066\u304f\u3060\u3055\u3044\u3002\nmirage-skeleton\u306eping\u306e\u30b5\u30f3\u30d7\u30eb\u3092\u8a66\u3057\u3066\u307f\u305f\u3051\u3069xen\u4e0a\u3067\u3046\u307e\u3044\u3053\u3068\u52d5\u304b\u305b\u306a\u304b\u3063\u305f\u3002\n\n\u307e\u305a\u3001unix\u306e\u307b\u3046\u3002\u666e\u901a\u306b\u30d3\u30eb\u30c9\u3057\u3066\u52d5\u304b\u3059\u3002\ntap0\u306e\u30a4\u30f3\u30bf\u30d5\u30a7\u30fc\u30b9\u3092\u4f5c\u308b\u306e\u3067\u5b9f\u884c\u306b\u306f\u7ba1\u7406\u8005\u6a29\u9650\u304c\u5fc5\u8981\u307f\u305f\u3044\u3002\n\n```\n% mirage configure --unix\n% mirage build\n% sudo ./mir-ping\n```\n\n\u3053\u308c\u3067tap0\u3068\u3044\u3046\u306e\u304c\u4f5c\u3089\u308c\u308b\u306e\u3067\u3001ip\u30a2\u30c9\u30ec\u30b9\u3092\u8a2d\u5b9a\u3059\u308b\u3068ping\u304c\u901a\u308b\u3088\u3046\u306b\u306a\u308b\u3002\nmirage\u306e\u307b\u3046\u306f\u30c7\u30d5\u30a9\u30eb\u30c8\u306710.0.0.2\u306eip\u30a2\u30c9\u30ec\u30b9\u304c\u8a2d\u5b9a\u3055\u308c\u3066\u3044\u305f\u3002\n\n```\n% sudo ip addr add 10.0.0.1/24 dev tap0\n% ping 10.0.0.2\n```\n\n\u3053\u308c\u3067\u5fdc\u7b54\u304c\u5e30\u3063\u3066\u304f\u308c\u3070\u3088\u3044\u3002\n\n\u3067\u3001\u6b21\u306bxen\u306e\u307b\u3046\u3002\u30d3\u30eb\u30c9\u307e\u3067\u306f\u307b\u307c\u540c\u3058\u3002\n\n```\n% mirage configure --xen\n% mirage build\n```\n\nping.xl\u3068\u3044\u3046\u540d\u524d\u3067domU\u306e\u8a2d\u5b9a\u30d5\u30a1\u30a4\u30eb\u304c\u3067\u304d\u308b\u306e\u3067vif\u306e\u3068\u3053\u308d\u3092\u7de8\u96c6\u3059\u308b\u3002\n\u3088\u304f\u308f\u304b\u3063\u3066\u306a\u3044\u3051\u3069\u3053\u3093\u306a\u611f\u3058\u306b\u3057\u305f\u3002\u3042\u3089\u304b\u3058\u3081mirbr0\u3068\u3044\u3046\u540d\u524d\u3067\u30d6\u30ea\u30c3\u30b8\u3092\u3064\u304f\u3063\u3066\u304a\u304f\u3002\n\n```\nvif = [ 'bridge=mirbr0,vifname=mirtap0' ]\n```\n\ndomU\u3092\u8d77\u52d5\u3059\u308b\u3002\n\n```\n% sudo xl create -c ping.xl\n```\n\nunix\u306e\u3068\u304d\u3068\u540c\u3058\u3088\u3046\u306bmirtap0\u3068\u3044\u3046\u30a4\u30f3\u30bf\u30d5\u30a7\u30fc\u30b9\u304c\u4f5c\u3089\u308c\u308b\u306e\u3067ip\u30a2\u30c9\u30ec\u30b9\u3092\u8a2d\u5b9a\u3059\u308b\u3002\n\n```\n% sudo ip addr add 10.0.0.2/24 dev mirtap0\n```\n\n\u540c\u3058\u3088\u3046\u306bping\u3092\u6253\u3063\u3066\u307f\u3066\u3082\u5fdc\u7b54\u304c\u8fd4\u3063\u3066\u3053\u306a\u304b\u3063\u305f\u3002\n\n```\n% ping 10.0.0.2\nPING 10.0.0.2 (10.0.0.2) 56(84) bytes of data.\nFrom 10.0.0.1 icmp_seq=1 Destination Host Unreachable\nFrom 10.0.0.1 icmp_seq=2 Destination Host Unreachable\nFrom 10.0.0.1 icmp_seq=3 Destination Host Unreachable\n^C\n--- 10.0.0.2 ping statistics ---\n4 packets transmitted, 0 received, +3 errors, 100% packet loss, time 3016ms\n```\n\n\u8a66\u3057\u306btcpdump\u3057\u3066\u307f\u308b\u3068arp reply\u306f\u8fd4\u3063\u3066\u304d\u3066\u3044\u308b\u3089\u3057\u3044\u3002\n\n```\n% sudo tcpdump -i mirtap0 -vv\ntcpdump: listening on mirtap0, link-type EN10MB (Ethernet), capture size 65535 bytes\n20:14:00.808886 ARP, Ethernet (len 6), IPv4 (len 4), Request who-has 10.0.0.2 tell 10.0.0.1, length 28\n20:14:00.809100 ARP, Ethernet (len 6), IPv4 (len 4), Reply 10.0.0.2 is-at c0:ff:ee:c0:ff:ee (oui Unknown), length 28\n20:14:01.827181 ARP, Ethernet (len 6), IPv4 (len 4), Request who-has 10.0.0.2 tell 10.0.0.1, length 28\n20:14:01.827371 ARP, Ethernet (len 6), IPv4 (len 4), Reply 10.0.0.2 is-at c0:ff:ee:c0:ff:ee (oui Unknown), length 28\n^C\n16 packets captured\n16 packets received by filter\n0 packets dropped by kernel\n```\n\n\u305f\u3060\u3001\u30a2\u30c9\u30ec\u30b9\u89e3\u6c7a\u304c\u3067\u304d\u3066\u3044\u306a\u3044\u3063\u307d\u3044\u3002\n\n```\n% cat /proc/net/arp\nIP address       HW type     Flags       HW address            Mask     Device\n10.0.0.2         0x1         0x0         00:00:00:00:00:00     *        mirtap0\n```\n\n\u3060\u308c\u304b\u89e3\u6c7a\u65b9\u6cd5\u6559\u3048\u3066\u304f\u3060\u3055\u3044\u3002\n", "tags": ["mirage", "Xen"]}